reviewTitle,review_details,reviewDate,reviewFor,reviewRating,reviewLocationOur favourite place to eat in Skala Kallonis (and t'standards were high)!,"We had a relaxing holiday in the lovely sea side village of Skala Kellonis and ate 3 times at this lovely restaurant. Holidaying with my wife & teenage son, this was one of numerous restaurants we ate at. We never had a bad meal, but Ambrosia was our personal highlight.
Here's some comments about stuff.
Location: the restaurant is slightly off the village square, opposite the little church. We sat on the elevated side outside the main restaurant rather than on the tables directly outside the church. It was a lovely setting, lemon trees and subtle lighting with the church opposite was a relaxing way to enjoy good food.
Staff: They were ace. Friendly, respectful and accommodating. We got that everywhere however - it's a very friendly place. What they did do however is remember us! They spent time on our first visit chatting to us about the food, the village and stuff like the squash plant growing in the restaurant. We ordered salted sardines for the first time here. The waiter asked if we'd had them before, then asked for a sample for is to try. After enjoying the sample and ordering them, we were then told a little about how they might form part of a communal meal for locals. I can feel myself waffling, so I will stop by saying we had a third meal where we were offered 'our usual table' and made a real fuss of. They were bang on!
Drink: All you would expect. Their ouzo was nice and smooth and their house wine very reasonable. We enjoyed the chilled medium sweet red wine (dessert wine???) for a change as house wines tend to be dry.
Food: The main reason we liked it (well, well, well!!). We enjoyed everything we tried, so rather than bore you, here's a FEW highlights...
The first night saw me dabble with a beef Stefano. Beautiful! This was after enjoying the salted sardines (Greek sushi). The better half wanted to try lamb stamina, but they refused to serve it as it had not been cooking for long enough. So on the second visit the stamnas was the first thing we asked for. It was worth the wait. Gorgeous! On the third and final meal we asked for a mezze style meal that included plenty of seafood. Wow! More salted sardines, marinated anchovies (it has a name) octopus in vinegar, all beautiful.
Summary: We ate well wherever we went in Skala Kallonis, but Ambrosia just got the edge over some other very nice evening meals. Without patronising or pestering, staff made our visits feel special, but my God, the food!! Bang on!",Date of visit: July 2015,Ambrosia,4,"Lesbos, Greece"
A Relaxing Break in a Welcoming Resort,"We have just returned from a very relaxing beak at Kalloni Bay. Having read lots of reviews before and after booking we were looking forward to a quiet but friendly stay at this small hotel and we weren't disappointed.
We stayed for two weeks, flying from Manchester and after nearly missing the flight, we arrived late evening to the fastest check-in ever! We were just too late to get a meal in the restaurant, but they kindly rustled up some tasty left overs (then charged us full price) which we appreciated. Having eaten and reacquainted with my Greek mate Mythos, I settled in to enjoy a lovely break with my wife and teenage son. Here's a summary of 'stuff'...
ROOMS: Clean n basic. Ours were both on the ground floor at the front, which felt like a nicer location than the back rooms. Decent fridge and air conditioning. Plenty of wardrobe and cupboard space. Basic shower with olive oil soap n shower gel and towels. Our beds were singles pushed together, but I didn't mind sleeping on the crack if required!
POOL: Lovely and clean and plenty big enough. The pool itself was fairly deep, with just a small shallow end, but there was a nice kids pool too. Plenty of sun beds and parasols with very little pressure to claim your spot at stupid o-clock. The pool bar opened at 11ish and served all that you would expect. The freshly made orange juice was lovely. Dinner time snacks were ideal and reasonably priced. We enjoyed the salads and pizzas.
OTHER FACILITIES: There's free Wi-Fi, but only around the central area of the hotel. The grounds are small but nicely kept. There's a tennis court, but it looked past it's best.
BREAKFAST: Ample choice, nicely laid out buffet style, including a small selection of hot stuff (baked beans, bacon or sausage with omelette or fried eggs), fruit (the kiwi fruits were lovely), breads, cereals, continental stuff etc. The juice machine served luke warm weak juices, but that would be my only negative.
EVENING MEAL: Hard to comment except that it smelt lovely and people on half board seemed to like it. We went into the village to eat. It finished quite early for us (9pm).
BEACH: The hotel is virtually on the beach and provides free loungers for guests. We are pool people, so we didn't spend much time there, but we had a paddle (the bay is very shallow) and it was a bit see-weedy under foot for us.
STAFF: Friendly and helpful, without getting in your face or trying too hard to be your best mate. Exactly what we expected from previous reviews. Many multi task. A good example is the lad that runs the pool bar. If the pool is busy over dinner time, he gets run a bit ragged serving food, clearing up and running the bar - just relax and he'll get to you!
THE VILLAGE: Only a short walk away. A small working harbour and a village square with a fountain is just about all there is to it, but it's lovely. Often busy on an evening, both with tourists and locals, there's a lovely atmosphere around the place.
EATING OUT: Our highlight! The majority of restaurants are either around the square or overlooking the sea. We never had a bad meal, but our favourite place to eat was Ambrosia. Try the lamb stamnas or the Stefado if you enjoy a Greek stew, but whatever you do try the fish n seafood. Salted sardines (Greek sushi) and marinated anchovies, octopus in vinegar, the list goes on. Just beautiful. A close second for us was Caprice. We enjoyed their mezze 'set meals' -but make sure you ask what the actual dishes will be as they are subject to change. Our only mediocre meal was a pizza we got at Sampo. Lots of good reviews, but my son found it bland - it had no tomato base. There were two restaurants that you pass on the way in to the village - one called the Sea Horse - that we never tried. I could go on, but like I said, we never had a bad meal and they were all very reasonable in price.
DRINKING OUT: We enjoyed a cocktail, a beer or an ouzo at Exodus. It was great to 'people watch' on the square. Friendly staff and nibbles with each round! Sugar Bay on the harbour was also popular and similar.
TIPS: Get around the island in a car. The prices are reasonable, parking is free and there are no real excursions that grabbed our attention. There's some nicer beaches and quaint little villages. And if you do...
Spend a day in Molyvos. Very picturesque. Lovely views and great food (we enjoyed a mezze at the Captain's Table on the harbour). Boat trips seem to leave from here too.
Enjoy a quiet morning swim whilst swallows and house martin's swoop down for a drink.
An old chap turned up every other morning to sell his produce. Melon, bananas, nectarines, tomatoes etc. He speaks no English, but spend a couple of Euros and give him a bit of trade. The fruit I tried was lovely (and you can keep it in your fridge).
Be prepared to check in then leave the airport when leaving. If you get there in plenty of time, the tiny airport has little to offer, but there's a nice café just up the road!",Date of stay: July 2015,Kalloni Bay Hotel,4,"Lesbos, Greece"
