reviewTitle,review_details,reviewDate,reviewFor,reviewRating,reviewLocation
Amazing!!!!!,"We were 3 friends we had a lovely time with vassili he was upset nice and careful
You shouldn’t miss it if you’re in Rhodes!!!!",Date of experience: October 2020,Makarounas Fishing Trip Rhodes,5,"Rhodes, Greece"
"חוויה מצויינת , מרכזי שקט נקי וכיף","תמורה מדהימה למחיר , נהננו מכל רגע הייתה לי בעיה עם הזמנה שרכשתי באינטרנט ובעלי המלון דאגו לעזור ולפתור לי את הבעיה , ואפילו שדרגו אותנו לחדר יותר גדול ! בעלי המלון מקסימים והצוות עזר לנו בכל בעיה , המלון פחות מ10 דקות מהקולסאום ו6 דקות מטרמיני , הלכנו הכל ברגל ! שהרגשנו כבר בסוף היום שאנחנו מרוחקים מהמלון לקחנו תחבורה ציבורית .
מלון משפחתי חדרים מרווחים ונעימים !
נהננו מאוד !! חוויה מדהימה ! מומלץ מומלץ מומלץ!!",Date of stay: December 2018,Domus Liberius,5,"Rome, Italy"
