reviewTitle,review_details,reviewDate,reviewFor,reviewRating,reviewLocationCity break to the wonderful city of Prague,"Our friends found a city break package to which we simply could not say no! Admittedly, I was a little dubious as to what to expect for such a low price. There was 8 of us in our group and I think it's fair to say that we were all pleasantly surprised. Rooms were spacious with comfy beds and big pillows. Our TV was a little dated but worked non the less if the Czec language is within your repertoire. Safe is built into the wall and very sturdy. They insist on room and safe keys being handed in whenever you leave the hotel. Probably makes sense. The key is quite bulky anyway. Just an odd feeling handing your safe key to the hotel. Code access safes are better but hey, this hotel provides an authentic Czec experience so it's ok. We were offered a meal on our arrival but opted to try a bar recommended by the reception staff (check out my review of Caspera). We never did try the evening meal. We always ate out. Breakfast is ok if you're happy with a mainly cold buffet. They do some hot bits like sausage, egg omelette ""cake"". Yes, it's egg, but not as we know it. Quite tasty but only appeared on one morning. Other mornings we had mixed veg, couscous with veg and some other odd choices. Coffee, tea and juices ok. The star of the show was the choice of local breads. Yum! Their toaster is in need of updating. Other than that, all good. Staff were very friendly and helpful. Even smiled on occasion. In summary, I would recommend this hotel as a budget base to explore Prague. The location can appear a little rough in places but you'll find some friendly bars and a nice park to explore within 5 minutes walk from the hotel. Trams also within easy walking distance. No. 18 gets you to the old part of Prague while the 22 will take you to the other side of the river for the castle and Petrin lookout tower. Mini Blackpool or Eiffel Tower depending on where you're from. Food and drink can be very good value the further away you are from the famous Astronomical Clock. A bar on the hill near the castle provided us with a round of 8 drinks for the princely sum of 299 CK. About £10! We did frequent some Irish Bars as well. They tend to charge a little more. 99 CK for one 0.5l beer nearer to the clock. Still, not too bad really. We'll be back.",Date of stay: March 2019,Hotel Ostruvek,4,"Prague, Czech Republic"
Visiting our son at Uni,"A lovely stay in the main and a great welcome from Louis. I only have a couple of small issues. Our room was great with a sea view and all the facilities you need such as tea, coffee, biscuits, tv, towels, shower gel, soap and even hand wash but no traditional shower. Bath with hand held shower head. I suspect that some of the other rooms have a shower instead of a bath. I'll be sure to ask next time. My only other issue was that my fried egg was under done. In hindsight, I should probably have mentioned it to Louis and he would undoubtedly have sorted it for me. We'll be back next time we're visiting our son. I would definitely recommend Glyn Garth as a great place to stay in Aberystwyth. Thanks Louis. See you next time.",Date of stay: March 2019,Glyn Garth Guest House,4,"Aberystwyth, United Kingdom"
Beautiful space!,Masses of photo opportunities. Very grand architecture wherever you look. Definitely worth including in your itinerary.,Date of experience: September 2018,Dam Square,4,"Amsterdam, The Netherlands"
A must visit for beer lovers!,"Having done a similar experience at the Guinness Factory in Dublin, I have to say that the Heineken Experience is just as much fun and informative. Some great interactive bits and pieces to do along the way and free beer at the end! Some of us got an extra free beer from the pouring experience/competition. Didn't see any other freebies as mentioned in other reviews. No meatballs from a waiter etc. Also omitted to mention that one of our group was celebrating a birthday. Maybe would have been different if we had. Would definitely recommend a visit while in Amsterdam. We also did the canal cruise as part of the package. Enjoyed learning about some of the history but one of our group fell asleep. Probably one too many Heinekens on top of all the walking involved. Incidentally, we walked a total of 30 miles over 4 days simply because we didn't get to grips with the tram system which I would recommend and will be doing so myself when we return. Then again, we did get to see quite a lot of the city during our ambles!",Date of experience: September 2018,Heineken Experience,4,"Amsterdam, The Netherlands"
Enlightenment on a grand scale!,"Having heard a few stories and viewed a few paintings on line, it was a real pleasure to properly get to know the troubled soul that was Vincent Van Goch and view his work in the flesh so to speak. Amazingly informative multi media handset and earphones added to the whole experience. For me, the painting of the tree in blossom against the bright blue sky and the story behind his motivation to paint it was a real highlight for me. I felt quite emotional which I really did not expect! Be prepared to do lots of walking up and down stairs (there are lifts) and lots of standing and staring. If you have a niggly back problem like I do, you'll be glad to know that there are plenty of areas to sit and rest. We also elected to have a spot of lunch in the cafe. We had the pea soup that was tasty although could have been hotter. Cake was delicious too. Gift shop has a great choice of souvenirs to buy at reasonable prices.",Date of experience: September 2018,Van Gogh Museum,4,"Amsterdam, The Netherlands"
Stopped for a sit down and a drink after spending man wonderful hours in the Van Goch museum.,"We opted for the pitchers of beer to share between three of us while our 4th member chose a cocktail. Great atmosphere, staff and the drinks were good. We didn't try any food sadly but it did look delicious. Will be back next time in Amsterdam and will try the food!",Date of visit: September 2018,Cobra Cafe,4,"Amsterdam, The Netherlands"
"Classy, clean and very comfortable with great staff!","Top notch hotel with everything you could ever need in your ample sized room. Coffee, tea making facilities, iron and board, robes, slippers, amazing hair dryer, fresh towels every day, wonderful walk in rain shower with hand held shower head as well, free body wash, shampoo etc., very comfortable bed! Our view from our window was of buildings and a patio. We could just about see a canal if you went right up against the glass like a loon and looked left. A well, can't have everything. I'd say that it's the luck of the draw as to what view you end up with. Truth is, city hotels rarely offer a good view so wasn't that bothered really. You won't be disappointed if you choose this hotel for your stay in Amsterdam. Location is close enough to the Metro and the usual popular bits of the old town, if you know what I mean! Some of the other attractions such as the Van Goch museum and Heineken Experience are a good 20 - 30 minute walk away. We took a taxi that the hotel booked for us when we went to the Van Goch museum. As pleasant as he was and knowledgeable about the city's history, his choice of route was let's say, scenic to say the least. His comment about the fact that it is a shorter route for cycling or walking than it is for driving due to the road system left me wondering whether or not we were taken for a ride......literally! An Uber journey to the Heineken Experience the following day which was in the same vicinity was €10 cheaper! Uber all the way in foreign cities for me.",Date of stay: September 2018,Monet Garden Hotel Amsterdam,4,"Amsterdam, The Netherlands"
Our first bar & drink upon arriving in Amsterdam and it did not disappoint.,"Visited this bar twice during our 4 day visit to Amsterdam. Both times were most enjoyable and the location is beautiful with the Church looming over us. Great place to sit outside and watch the world go by. In summary, good location, good beer, good atmosphere and good staff. Thank you!",Date of visit: September 2018,The Old Church Bar,4,"Amsterdam, The Netherlands"
Such fun with tasty food to boot!,"As soon as we walked into this little gem, we spotted the ponchos and HUGE sombreros hanging just to the left behind the entrance. Being a thespian in my spare time, I simply could not resist and proceeded to dress up myself and fellow diners from our group of 4. Then this funny little front of house gentleman, Adriano turns up and declares that he will dress us up with colours better suited to our complexion, eyes, hair colour etc! Well, what a scream! We could not stop laughing! I might add at this stage that no substances had been taken other than a couple of glasses of Heineken at the Heineken Experience.
Adriano then proceeded to bring out a free plate of Nachos prior to taking our order. Delicious! Better than the Nachos we had at The Hard Rock Cafe that we visited the day before. (We had tried going back there on this day only to find that they were sold out of Nachos and pretty much everything else we asked for as an alternative and ended up coming here instead - things clearly happen for a reason!)
I've seen some unkind reviews about El Vino and their Nachos on here. Well, if you enter into the fun and games of dressing up, I think that like any performance or stage production, if you really get into it, the performers almost always raise their game and deliver the best show ever! I think that this is what happens here. Of course, it has to be said that if Adriano is on a day off and you are left with his colleague that was very quiet in comparison to say the least, well, your experience may be entirely different.
The food was plentiful and delicious. Yes, it's not fine dining but you simply can't avoid having the best time ever if you're willing to have fun with the costumes and Adriano.
We were there for lunch and immediately booked for dinner that evening and had an equally good time and good wholesome food. I will definitely be seeking out this wonderful place when we return to Amsterdam in the future. Incidentally, please be careful when using the ladies toilet. Make sure you turn the tap off after washing your hands, one of our group accidentally left the tap on which then proceeded to cause a mini flood that Adriano and his colleague had to mop up. Sorry Adriano!",Date of visit: September 2018,El Vino,4,"Amsterdam, The Netherlands"
Breakfast three mornings in a row!,"We found this cafe restaurant on our way into the centre of Amsterdam from our hotel (see separate review to come). Enjoyed our breakfast and view of Rembrandt's house/museum across the road so much, we decided to return every morning. We had the full breakfast with crispy bacon, veal sausages and a choice of fried or scrambled (both equally good) as well as beans and tomato. Some of us had the bagel with egg and bacon which I myself enjoyed on the last morning. Coffee and freshly squeezed orange juice really good. Good value for money as well!",Date of visit: September 2018,Cafe Restaurant Orff,4,"Amsterdam, The Netherlands"
Dutch pancakes!,"Having spotted this little place after taking a look at the Anne Frank house, we decided that we should try the Dutch favourite of pancakes before leaving the city that day. I opted for a savoury ham, cheese & mushroom pancake while my wife opted for the Chicken & Bacon club sandwich. We ended up sharing our meals in order to experience both. I must say that the club sandwich was superior to the pancake but would have it on white bread next time as the brown bread was more like very dark malted brown bread and really did not contribute anything to the sandwich. The pancake was ok but I struggled to get over the fact that it looked like a pizza only with a squishy soft base. I think I'll stick to sugar and lemon on my pancakes in future. Worth noting that I tried a little maple syrup with my savoury pancake and it was actually quite nice! The Americans do it all the time apparently. Watch out for the spiral staircase down to the toilets. A bit hairy to say the least!",Date of visit: September 2018,Roem,4,"Amsterdam, The Netherlands"
A chilled hour for a beer or two,"What can I say, cool vibe and friendly staff. Enjoyed our beers and a cigar while sitting outside watching the people and tourists of Amsterdam go about their business. Happy! We didn't eat but will look for this place when we return to this wonderful city in the future and will try the meatballs for sure.",Date of visit: September 2018,Schaakcafe Het Hok,4,"Amsterdam, The Netherlands"
Last minute decision after pondering for what seemed like ages,"We chose this steakhouse after spending a good while trying to decide which of the many steakhouses in central Amsterdam to select for our dinner on our second evening in this wonderful city. Our group of four were in the main very happy with their choices and the service was good even though they were clearly busy. Incidentally, I was given advice by two separate friends that your best bet for a good steak or meal in general is to look for a steakhouse that is full of diners. My only criticism would be that they are a little overpriced for what I would call a decent steak. I've enjoyed steak in the UK at one of the top steakhouse chains and paid less than we did here for a much better product, service and experience on the whole. Still warrants 4 stars but would have been 5 had it been better value for money.",Date of visit: September 2018,De Nachtwacht,4,"Amsterdam, The Netherlands"
Birthday celebrations. 🍻🍾🎂,"Having read some of the previous reviews about the Seacroft, I have to admit that I was a little concerned that the evening might end up being a little disappointing. I suppose that some punters have impossibly high standards that will never be fulfilled. Being August the 4th, it was heaving with holiday makers but the staff were dealing with the manic pace like a well oiled machine. The front of house staff were very helpful and friendly with nothing being too much trouble. We were a party of 13 and all the meals came out within minutes of each other with nobody having to wait uncomfortably for their meal to arrive. We were also able to bring a birthday cake that the waitress brought out while we all sang the usual Happy Birthday ditty. Oh, by the way, the food was top notch as well. Hence, a rare 5 from me. Well done Seacroft.",Date of visit: August 2018,The Seacroft,4,"Anglesey, United Kingdom"
Last treat on our way home from our weekend in London,Great value and very tasty carvery. The presence of a few retired folk clearly confirms my opening statement. Very conveniently located a minute or two off the A50 of you're looking for a easy lunch stop. The atmosphere is very welcoming and friendly. The busy road adjacent to the beer garden seating area prevented us from eating outside. 4.5 stars none the less from us.,Date of visit: July 2018,The Boars Head Hotel,4,"Draycott in the Clay, United Kingdom"
Bruno Mars weekend,"Sadly, I must concur with a few reviewers in terms of the misleading nature of many of the reviews about this hotel. There's a few that are a lot more frank and honest and these are the ones you should pay attention to. We paid £120 per room while others it would seem paid £80. I'd have been a little more forgiving had the basement cupboard we were given as a room been £80. The room also was extremely tired and needed a serious refurbishment. Our friends room upstairs on the ground floor was not much bigger but was clearly recently updated. Rusty radiator and flaking ceiling paint above the tiny shower as well as a hole in the bathroom door were all evidence of poor maintenance. The shower was fun to operate. A bit like working out the combination on a safe. Left a bit....too hot! Right a bit......brrr, too cold. Petty perhaps, but should be better for the money they are asking for the room.
Breakfast was very nice and Georgio, the waiter very funny. Echoes of Manuel from Fawlty Towers? His humor very nearly helped us forget that 1 out of our party of 4 had to wait over 30 minutes for her breakfast. Everyone else on our table had long finished by the time it finally arrived. It wasn't just our table either. A couple of other guests had similar problems. Having said all that, the actual breakfast was very tasty. We were also given as much toast and tea as we could eat and drink. It may have been a one off rush due to several guests arriving for breakfast at once. Georgio was ever so apologetic and kept repeating, ""is a not my fault!"" I think I'll go for a Travel lodge or Premier Inn for our next visit to London. A bit pricier but you know exactly what to expect.",Date of stay: July 2018,St. David's Hotels,4,"London, United Kingdom"
A pleasant enough day out with our own version of a pole dancer!,"This is one of those catamaran sea trips that relies heavily on the sea conditions and weather being nothing short of perfect. Without those elements present, it is still enjoyable but won't leave you with that feeling that you have just experienced something extra special. We did a very similar excursion in Fuerta Ventura in 2016 that was cheaper, more fun and had a richer itinerary. Yes, the weather was much better but not perfect. Ah well, mustn't compare as each one has its own interpretation of an itinerary and what should be included in the price (there lies another story that I will come to shortly). The crew were nice enough and the food OK. BBQ chicken fillets and sausages with a nice selection of cold salads. If you're wondering why the title of this review mentions a pole dancer, well truth is I'm being a tad facetious. One of our fellow punters was a young mum with her partner and young family in tow, one of which was a very cute baby girl not more than 6 or 7 months old. Clearly, her attention was on the baby for much of the trip. That's fine in itself and to be fair, the baby was very content and didn't cry once on the catamaran. My point is that she may as well have been doing it in her underwear such was the ultra skimpy nature of her swimwear. It's probably just me and probably should have just stared at my feet. Then again, what would be the point of that when you're surrounded by beautiful views of the sea, sky and shore line. So to what's included. It has to be said that our nice holiday rep over sold the excursion when he mentioned that the trip included a BBQ and drinks THROUGHOUT! Sounded about right to me based on the price charged. Over 250€ for the 4 of us. Like some reviewers on here, you'll be a tad disappointed if you believe what you're told by the rep. Drinks are included for 1 hour during the BBQ as the rep confidently informed me AFTER the event. The excursion we did in Fuerta Ventura included all drinks and snacks throughout. No BBQ admittedly but then again a great deal cheaper all told. You'll find the review for it in my thread. It was top notch which sadly I can't say for Magic Catamaran. Just make sure you check the forecast prior to booking. Wind and clouds equals clouded waters for snorkeling and no warm sun to dry you off after your swim. It was our fault for choosing the wrong day weather wise so perhaps 3 stars is a tad unfair. Would give 3.5 if I could.",Date of experience: July 2018,Magic Catamarans,4,"Majorca, Spain"
Lunch time pit stop.,"Yup! It's very good! Pizza and pasta all good. 'Nuff said! Lots of locals as well. Even had reserved tables at 1pm in the afternoon! Chilled Rioja but hey, we're in Mallorca and they know best!",Date of visit: July 2018,Cafeteria Neptuno,4,"Majorca, Spain"
520m of beautiful views,"After a hairy journey up the twisty albeit wide (in the main) route up to the summit, we were greeted with spectacular 360 views. I enjoyed the drive it if I'm honest. We spent a good hour taking in the majesty of the place and also enjoyed a light lunch in the cafe while sitting at a table with a view. We encountered a couple of boy racers treating the route as a hill climb on our way back down. Other than that we very much enjoyed our visit to Sant Salvador's Monastery and monument.",Date of experience: July 2018,Santuari De Sant Salvador,4,"Majorca, Spain"
Chilled afternoon watching the super cruisers come into the marina.,Found this little cafe following our walk down to the Marina. Enjoyed two jugs of sangria at reasonable prices. So chilled and a great spot for people watching. Always a good sign when lots of local Spaniards surround you on the other tables! Just wish I could afford to own one of the cruisers.,Date of visit: July 2018,Cafeteria Piscis,4,"Majorca, Spain"
Acting on a work colleagues recommendation.,"We took advice from the many reviews and indeed from my colleague and booked a good few days in advance. We arrived to find this gem of a restaurant and location buzzing with customers and the aroma of delicious sea food dishes of all kinds filling our senses. Needless to say, the food was beautifully prepared & presented and as fresh as can be. I can see why some would say that the staff might come across as rude. I suspect that due to its popularity and the number of guests they deal with, the staff are no doubt under pressure to deliver. They could be a little more friendly but this is not one of the Greek Islands so don't expect the same hospitality. Would definitely come back for more.",Date of visit: July 2018,S'Arenal De Portocolom,4,"Majorca, Spain"
Spot of lunch mid cycle ride on a warm May Bank Holiday,This place is just a wonderful little gem ideally placed for a cycle ride pit stop. We've just enjoyed two very fresh and tasty chicken salads as well as a lovely rhubarb Bakewell slice. Lovely outside seating area. Could do with a shady area as properly hot when the sun was out. A bit of a sun trap. Good value too. We'll be back for sure.,Date of visit: May 2018,Meadow Lea Farm Cafe,4,"Chester, United Kingdom"
50th Birthday Celebrations,"I have to say that our stay at Rose Tor Hotel was very good. Room was clean and spacious although the en suite was bijou to say the least. It was fun trying to dock with the lavatory! Slept well even though our room was on the ground floor at the front of the hotel. I suspect that the drinks consumed may have contributed! We were there to celebrate a 50th birthday after all. Breakfast was varied. My plate was missing a sausage on our first morning. It did, however, arrive sharpish after notifying the waitress. Breakfast was spectacular on the following morning; 2 fried eggs, 2 bacon, 2 grilled tomatoes and 2 sausages! All cooked to perfection. Plenty of fresh and tinned fruit with a selection of cereals as well. The bar is well stocked and a few of us enjoyed an afternoon watching football. The Guinness was the canned variety but was OK. In summary, The Rose Tor is very good value for money with friendly staff to boot.",Date of stay: April 2018,Rose Tor Hotel,4,"Llandudno, United Kingdom"
A cooked breakfast after a night out over Easter BH,"Although my wife and I have been aware of Rhino Cafe for a while, we had not found an opportunity to try it until now. It was one of those mornings after a drink or seven when you need something substantial for breakfast but don't have the energy to cook it yourself. I'm glad to say that this little cafe delivered exactly what we were looking for. A tasty cooked breakfast with quality ingredients prepared with lots of love and care. Both came with toast and tea or filter coffee. Yum! Bigger versions can be ordered at extra cost if you're appetite is bigger than ours or just add extra this or that to your plate. News papers available too. We also note that they offer curry evenings whereby you can bring your own alcohol. We'll be back to try their Indian fayre very soon. Keep up the good work.",Date of visit: March 2018,Rhino Coffee House,4,"Chester, United Kingdom"
Overnight stop on our journey to Lyon,"First impressions were encouraging. Especially when I clocked the roaring wood fire in the corner. The smells and warmth were very welcoming. After a brief exchange of hand signals and poorly pronounced French, the gentleman on reception issued our keys for room 25 and off we went. The hotel is arranged in a motel sort of way whereby you drive or walk around the outside of the building to find your room and adjacent parking space. The room itself turned out to be a disabled friendly room that proved to be perfect for my 84 yr old Mum. I had mentioned when booking that she was a little infirm and would prefer a ground floor room where possible. Nice to see that they had given the room choice some thought. The room itself was very pleasant and warm on our arrival. A little too warm when it came to sleeping. I probably could have switched the heating off had I taken a closer look at the controls. Too lazy and tired after my drive from Chester in the UK! By the time we were ready to eat, it was too late to attempt exploring one of Saint-Quentin's local restaurants so we elected to eat at the hotel. While the prices were a tad expensive for our needs that evening, it's safe to say that the portions and quality were off the scale! With drinks and three main courses, our bill came to approximately €100. My Silrloin was massive and cooked to perfection with delicious chips. My wife's beef was also beautifully cooked as was my Mum's salmon. I would definitely recommend this hotel!",Date of stay: March 2018,Le Pot d'Etain,4,"Holnon, France"
