reviewTitle,review_details,reviewDate,reviewFor,reviewRating,reviewLocation
Amazing fishing & boat trip,"We have had the most beautiful day on this boat. Especially cool was observing the catch from a 700 m long net. It seems endless. And a lot of different fish and sea food
We went to the most outstanding beaches this island had to offer with crystal clear water. So if you do this bring all your snorkeling & swimming gear and of cause your camera...
While we were having fun Xristina and Yannis prepared the most delicious meal ever, all from the fresh catch. Now this is an experience you will never forget. My family and me loved it!",Date of experience: July 2019,Kefalonia Fishing Tours,5,"Cephalonia, Greece"
sehr hilfsbereit und freundlich,"Wir (Familie mit 3 Kindern) hatten einen Autounfall und der Besitzer hat uns sehr gut beigestanden, die Angelegenheit mit der Gegenpartei zu regeln. Er war sogar so nett ein Taxi zu besorgen. Nach der Aufregung hat er uns noch auf einen Drink in seinem Restaurant eingeladen. Wirklich eine sehr schöne Terrasse! Wir durften sogar den Pool der herrlich schönen Anlage benutzen, während wir auf ein Taxi warteten. Ich kann das Restaurant wie auch die Hotelanlage sehr empfehlen.
Vielen Dank nochmal für die wahnsinnig nette und zuvorkommende Unterstützung!",Date of visit: August 2017,Le Jardin de Celina,5,"Valensole, France"
