reviewTitle,review_details,reviewDate,reviewFor,reviewRating,reviewLocation
Fantastic Day,We met up with them at the dock and promptly got on the boat and had coffee and cake. After visiting for a few minutes we were off to find the nets. They reeled in the net and we got to pick the fish out. Many varieties and sizes. After we finished the nets they motored over to a nice cove for swimming and lunch. Wonderful food! Fresh caught fish cooked to perfection. At the end of the day we motored back to the dock! It was an excellent day. Wonderful hosts!,Date of experience: October 2019,Fishing Tourism Kefalonia Michalis,4,"Cephalonia, Greece"
Free waking tour ultimate rome,Nick was a fantastic guide and our teenager even enjoyed the day! Nice to see sights not on other tours.,Date of experience: February 2019,Rome's Ultimate Free Walking Tours,4,"Rome, Italy"
Excellent Italian,"After 8 days in the area, for medical procedures, we found Fiddies! Excellent Italian food and wonderful staff! We will return in a few weeks when we come back to the area from Bucharest.",Date of visit: November 2018,Fiddie’s Italian Kitchen,4,"London, United Kingdom"
castle tour,The tour was good and transportation great. It was nice to have someone else in charge of getting everything planned and executed.,Date of experience: October 2018,TravelMaker,4,"Bucharest, Romania"
Sibiu walking tour,Diana was our guide for the Sibiu walking tour. She is very informative and was willing to answer our many questions about Sibiu and the history of the area. I would highly recommend this tour to anyone new to Sibiu or visiting for the first time.,Date of experience: August 2018,Sibiu Walking Tour,4,"Sibiu, Romania"
