reviewTitle,review_details,reviewDate,reviewFor,reviewRating,reviewLocation
SunSet,"Verstehe diesen Heip um den SunSet nicht schönes Dorf...gnadenlos überlaufen unnette Touristen die einen rückskichtlos überrennen.
Es gibt durchaus schönere Sonnenuntergänge und ürsprünlichere Orte in Santorini...",Date of experience: September 2018,Sunset in Oia,1,"Santorini, Greece"
Baden,"Mehr erwartet ....schöne Natur doch leider durch die ganzen Aktivitäten unschön.
Viel zu viel Drumm herum.....",Date of experience: September 2018,Red Beach,1,"Santorini, Greece"
Perfect,"My husband and me book this tour it was a really nice trip the tourgides was friendly we feel home from the first moment .
We have a perfect meal swim and sunset .
We will come back...go on like this .
Best regards‍️",Date of experience: September 2018,Santorini Fishing Trips,1,"Santorini, Greece"
Schönes Restaurant...Eine Beleidigung für die Spanisch/Deutsche Küche,"Ein schönes nettes Restaurant ,es fehlt ein wenig an Ambiente wozu auch die Bedienung Beiträgt,sehr unflexibles Personal .Ich habe mit Karte bezahlt mir wurde das Gerät auf den Tisch gelegt ich konnte den Rest selber machen mir den Beleg selber ausdrucken Händlerbeleg / Kundenbeleg.. die die Bedienung drehte uns den Rücken zu .Kein danke kein schönes Wochenende nichts.
Zum Essen fehlen mir die Worte ich bin selber Spanierin ... Vorweg das das Essen hier in Deutschland nicht so sein kann wie in Spanien ....Ok .....doch das was wir hatten kam aus der Tüte gefroren und bei den Gambas hatte ich den Eindruck das das Haltbarkeitsdatum überschritten war . Patas bravas ...Tüte ...und waren Wedges .. der angesagte Knoblauch auf der Karte glänzte durch abwesenheit . Bei der Nachfrage grummelte Der Kellner da ist knofi drauf...!!! Wir hatten uns sehr auf den Spagat zwischen Spanisch/Deutschen Essen gefreut ...doch nichts wurde von den Erwartungen erfüllt. ..eher irgendwas undefinierbares.
Sehr schade und wie ich vorweg schon sagte eine Schande für die Spanisch / Deutsche Kochkunst.",Date of visit: April 2015,Hans Jose Tapas Bar,1,"Mönchengladbach, Germany"
