reviewTitle,review_details,reviewDate,reviewFor,reviewRating,reviewLocation
Trip,"Superb day out, great food, great swimming stops, great atmosphere on board, very informative, if you are in zakynthos give this trip a try",Date of experience: August 2020,Zante Fishing Tours,4,"Zakynthos, Greece"
Lunch or dinner,"Erato in its new position, just gets better and better, nothing is too much trouble, if its not on the menu make up your own meal, ask Elsa for stifado calzone!",Date of visit: August 2019,Erato Restaurant,4,"Zakynthos, Greece"
Trip,"This is a must do trip when in zakynthos, very professional and very greek, fish caught, cooked (by the FBI) superb day out",Date of experience: August 2019,Zante Fishing Tours,4,"Zakynthos, Greece"
Wow,Thomas & Elena have worked so hard and transformed this bar. A must visit location when you are in argassi,Date of experience: September 2017,Thomas Elena Beach Bar,4,"Zakynthos, Greece"
Family trip,"We always use Peter for trips and car hire,
He is the most friendly and professional trip adviser. Went on the jeep safari today and cannot recommend it enough",Date of experience: September 2017,Peter Tours,4,"Zakynthos, Greece"
