reviewTitle,review_details,reviewDate,reviewFor,reviewRating,reviewLocation
Sempre...una piacevolissima conferma!!,"...sentirsi a casa avvolti da quella discrezione che li contraddistingue...piacevolezza e intimità dell'ambiente...sapori definiti, chiari, sofisticati, che trasmettono pienamente l'idea che Claudio e Ruggero hanno della loro cucina, direi molto equilibrata ed elegante.
Come anticipato dal titolo, ennesima serata trascorsa in un ristorante che, per come riesce a coinvolgere i nostri sensi, non è più solo un ristorante ma, ormai, un luogo dove trascorrere piacevolmente un paio d'ore di spensierata tranquillità.
Grazie a tutti per l'impegno e l'amore che ci mettere!
G&G",Date of visit: January 2019,La Bottega di Vittorio Ristorante in Salumeria,4,"Brescia, Italy"
..un angolo di magia...con sapore di amicizia..,"...qualche piacevole scalino...un contesto ricco di fascino...si sa, le cose belle, quelle vere, vanno sempre ricercate lontano dagli sguardi indiscreti.
...divani, poltrone, un grosso braciere...una splendida terrazza dalla quale, la sera, è possibile ammirare il cielo stellato sentendosi parte della natura.
...una lieve brezza accompagna l’intera giornata, rendendo anche le ore più torride, piacevoli e godibili...un tavolone immenso restituisce, a chi ci si accomoda, un senso di condivisione...come una volta..
...agli occhi nulla stona, ogni particolare è stato finemente pensato per esser posizionato proprio dove dovrebbe essere...
...ma, oltre a tutto questo, il vero motivo per cui torneremo al bbq, sono le persone che lo animano, i due supertitolari, la gentilissima Martina ed lo staff sempre attento e discreto!
Grazie a tutti per averci fatto sentire a casa!!!

Gemma e Gian",Date of stay: July 2018,BBQ Lodge,4,"Camogli, Italy"
The best way to discover the BLUE SEA,"The experience of a true fisherman, the capabilities of a real chef, the welcome of a family!
Thaks for the whole day, great sailing experience!
Realy nice to meet you! See you soon!

Nikolaos, the sole capitain!",Date of experience: September 2018,Milos Fishing Experience,4,"Milos, Greece"
...casa dolce casa...a Panarea..,"Hotel familiare dal sapore antico...attenzioni e coccole le parole d'ordine! Vista mozzafiato, melodia delle onde che si infrangono sugli scogli, colori e profumi dei giardini in fiore sapientemente curati sono il contorno...gentilezza del personale, capacità e desiderio di farci sentire parte della famiglia Cincotta sono stati il vero valore aggiunto di questa vacanza.
Aspettateci! Torneremo molto presto!!",Date of stay: May 2017,Hotel Cincotta,4,"Panarea, Italy"
...l'isola nell'isola..,"...una finestra sul porto da cui ammirare i tre faraglioni che accompagnano immutati il tramonto di Panarea...una porticina si affaccia sulla piazzetta e lascia spazio ad una piccola scala bianca...scalini azzurri al termine dei quali si apre la sala principale...semplice, lineare, pulita ma allo stesso tempo curata e ricercata.
Ad accoglierci Giuseppe, il padrone di casa...una persona discreta, eclettica che ama profondamente la sua terra.
Ci fa accomodare, nel menù pochi piatti ma ricercati;la semplicità, la qualità della materia prima e una rivisitazione attenta della tradizione sono alla base di ogni proposta.
Ci facciamo ingolosire dalle verdure stufate del suo orto, pescato del giorno cotto alla griglia (un dentice favoloso) per chiudere con una torta di riso con mele ed una delicatissima crema chantilly.
Il tutto accompagnato da un paio di bicchieri di vino bianco etneo ed una compagnia d'eccezione...un vero cantastorie, un pozzo di esperienze, avventure e sogni ancora da realizzare.
Grazie Giuseppe per averci fatto sentire di casa...un'isola nell'isola...",Date of visit: May 2017,Da Adelina,4,"Panarea, Italy"
