reviewTitle,review_details,reviewDate,reviewFor,reviewRating,reviewLocation
Τέλειο,Φανταστικό μέρος απίστευτη εμπειρία τα θαλάσσια σπορ με φοβερό επαγγελματισμό και εξυπηρέτηση !!σας το συνιστώ !!,Date of experience: August 2019,Porto Paros Watersports,5,"Paros, Greece"
Fantastic!!!,"Great experience .. I recommend,
fantastic locations and great staff!!
suitable for the family for both young and old,
absolutely safe and fun",Date of experience: August 2019,Happy Boats - Haraki Rhodes,5,"Rhodes, Greece"
incredible experience,"unique experiences for childrens and older , unreliable staff and excellent captain ... I highly recommend you",Date of experience: August 2019,Makarounas Fishing Trip Rhodes,5,"Rhodes, Greece"
