reviewTitle,review_details,reviewDate,reviewFor,reviewRating,reviewLocation"Clean, great food and excellent service","This place is a humble gem in the heart of Bugibba. Menu is so vast that it will surely suit all tastes! Opted for the Blackedout Hot Dog with sweet potato waffle fries. Portions were big and taste was superb! Fries were delicious, sauces were tasty. The sausage itself was so good and all the flavours went very well together. The pulled pork bites on top of the hot dog were awesome. My boyfriend took the honey dog which he also enjoyed thoroughly. Highly recommended! Clean and very friendly service!",Date of visit: March 2020,BlackPaw,1,"Island of Malta, Malta"
Pricy but exceptional!,"Visited this establishment in St. Julians for the first time for Sunday brunch. Upon arrival, we were pleasantly surprised by the amount of people seated, surely a good sign!
The interior is amazingly decorated and the management surely has an eye for detail; Bird cages hang from the ceiling, glasses with a particular design, armchairs instead of chairs with printed pillows. An amazing vibe overall!
Food ordered was: Porridge with berries, Strawberry and burnt marshmallow Milkshake, Beef and Ale pie, Eggs Benedict with bacon and doughnuts
The Porridge was quite filling and thick. It had an interesting texture and a nice taste. The mulkshake was large and fresh and had a very good jam taste. The pie was served in a dish with melted mash potato. The pie itself was quite small for its price (14 euro). However, it was delicious. The crust was crispy and the filling was hearty, with shredded beef, potatoes and carrots.
On to the eggs Benedict. These were beyond divine! The bread was a sweet brioche, bacon was crispy and cooked perfectly and the Hollandaise sauce was by far the best I've ever had. It was creamy and light, with a nice citrus taste. Wow!
Finally, I am not keen on doughnuts. However, the hype about Sean Gravina's doughnuts here made me too curious to pass on the opportunity to try them. Oh my Lord. These were BY FAR the best on the island... scratch that, probably the best in the world!!!! The Doughnuts themselves are tiny, but the dough is so soft, covered in sugar and filled with either kinder bueno cream, nutella or jam. I sampled one of each and all were to die for, simply perfect!
This place is surely not to be missed. These items, together with one large still water amounted to 50 euro. A hefty price, sure. And portions aren't big so for big eaters like myself, prepare to spend a lot. However, I guarantee, you will not be disappointed. WELL DONE CHEF
Will be back to try the burgers (and more doughnuts of course)",Date of visit: March 2020,Crust Bakery Bar Bistro,1,"Island of Malta, Malta"
Mediocre,"So this was quite a disappointing surprise. Being always full of people, and the fact that typically restaurants in Mgarr serve excellent Maltese dishes, we expected this to be a pleasant dining experience. We have dined in many Maltese establishments serving traditional cuisine and this restaurant is the worst to date. We ordered Maltese Mixed plates with rabbit, horsemeat and quail, a ribs combo platter and a whole rabbit im gravy.
The meat was lukewarm (all dishes) and was poorly seasoned. In fact, all meats had same taste and lacked flavour. Fries were delicious but very small portion served for 6 people. Service was ok. Prices, if the food was good, is fair. However, the quality of the food left us feeling like we were ripped off.
Mediocre",Date of visit: March 2020,il-Barri Restaurant,1,"Island of Malta, Malta"
Beyond amazing! Impeccable!,"Visited this place 3 times. The last was on my birthday. The staff went out of their way to make sure my day was a special one! Food and service were phenomenal! We took Pizza Bianca, Pizzotto, Calamari fritti, Beef Rib and churros. Everything was delicious, especially the special Churros they made for me for the occasion!
Portions huge and arguably the best pizza on the island. Despite being packed with people, the ambiance was very cosy and fun and the staff were very friendly and diligent and made sure everything was perfect. WELL DONE! One of my favourites in Malta!",Date of visit: February 2020,Cardini,1,"Island of Malta, Malta"
Best Cannoli and Pastries!,"This place has been round for a very long time and has acquired quite a reputation for being the best cafe/caterer in Malta.
Visited the Msida outlet which brought back many memories of when I was a child, coming in with my grandparents. We went on a Sunday exactly when it opened at 8am. In around 30 minutes the place was almost packed!
We tried various items: my boyfriend opted for the Arancini and Cannoli and a Hazelnut latte, while I took a hearty breakfast consisting of Cannoli, one pea cake, their classic hot chocolate and a few pastries (Fudgy, Caramel and Cherise).
The savouries were hot and delightful, not oily and great taste and texture. The Cannoli are by far the best we've ever had, and no doubt Busy Bee is renowned for them! The shell just breaks as it is soo fresh! The ricotta is cold and fresh and light, dusted with powdered sugar and finished with nuts. Just wow!
The pastries were divine! Fudgy (parcel-shaped) was encrusted with rich dark chocolate and hosting the most moist chocolate cake inside. Any chocaholic's dream! Cherise had a delicious milk chocolate airy mousse and a layer of berry insert which was lovely. Caramel was gooey and light, with a peanut chocolate coating which was equally as magnificent.
As for the drinks, my boyfriend was super impressed with his latte. The classic hot chocolate was served as hot milk in a glass with a home made chocolate stick on the side. This was ingenious and so delicious, one of the best hot chocolates I've had! I also tried the special Jaffa Hot Chocolate which was oozing chocolate orange goodness! Exactly like a jaffa cake.
Prices are fair for quantity and quality you get! Staff is friendly and atmosphere very relaxed. The best cafe in Malta!",Date of visit: February 2020,Busy Bee,1,"Island of Malta, Malta"
Perfection! One of top 5 in Malta,"We visited on a Sunday evening after seeing multiple positive reviews online. The place is quite small, located at the very beginning of Mosta (if you're coming up from Bugibba). We were greeted by a cosy ambiance with rustic decor. The staff were plentiful in numbers for such a small establishment. They were very polite and explained the menu thoroughly.
The menu here changes every week as fresh goods are imported from Italy. We opted for the degustation menu for 30 euro per person which included a four course meal.
The first was a Cheese and Cuts platter consisting of various cheeses, cold cuts, olives, figs, candied fruit, jam, croquettes, sausages etc. This was a big portion and a delightful start. The bread which was brought to the table was so fresh and soft!
The second course was spaghetti alla Gricia cooked in a parmesan wheel. The portion was to share but was very large, with fresh crispy guanciale on the side to put on the pasta. The pasta was so cheesy and delicious, the highlight of the entire meal! Wow, spectacular!
The third course was a tagliata to share, cooked medium and served with potato wedges and Himalayan salt in a small container on the side. The meat was cooked to perfection: juicy and char-grilled so you can taste the smokiness. The potatoes were salty and delicious. This was spot on!
Finally, we were given a choice of desserts and we opted for a white chocolate fondant, served with vanilla Ice cream. This was also impeccable, cooked with the perfect amount of heat to provide the right consistency. Wow!
The only minor critique is that the service was quite slow, despite there being a lot of staff. Even the bill took quite some time to arrive and we had to bring it to more than one waiter's attention. However, they were very courteous and made sure we enjoyed each course.
Bottom line: amazing food, big quantities, good service and great price! Highly recommended!",Date of visit: February 2020,Cheese & Cuts,1,"Island of Malta, Malta"
That's a LEGIT burger!,"Visited as a group of 4 on a sunny Saturday for lunch. The location of the Qawra outlet is central, close to the bus terminus. The ambiance gives you a clear Impression of a fast food joint and is quite rugged looking. We had a meal consisting of nachos and Buffalo Wings as starters, then 4 Legit burgers with normal fries and extra Sweet Potato Fries on the side.
The wings were okay, nothing special. The blue cheese sauce on the side, however, was divine! So much so, that I saved it in order to dip my fries in later. The nachos were smothered in runny cheese which was nice, but underwhelming. Then came the burgers. They truly live up to their name, as they are LEGIT! The burger consisted of a juicy patty, lettuce, tomato, American style grilled cheese, crispy bacon, pickle and burger sauce which we took on the side. The burger tasted like an evolved and upgraded version of McDonald's Quarter Pounder! It was delicious and all components were exquisite when combined! The burger sauce was great, and fries were thin, salty and crispy. The sweet potato fries were also delicious.
Jane served us very well and made sure our experience was great. Bottom line: come here for the burgers as they are exquisite! Highly recommended!",Date of visit: February 2020,NOVI Bar - Qawra,1,"Island of Malta, Malta"
Efficient service and great pizza!,"Called on Sunday evening for pizzas to be delivered at home. The telephone operator was friendly and made sure our order was correct. The delivery arrived at the exact time we requested. We were given free garlic bread with our order
The pizzas are great, the BBQ chicken is by far our favourite. I opted for the new Philadelphia Cheesy Crust and it was to die for! A nice twist by putting cream cheese in a crust. Pizzas were fresh and warm. Garlic bread also very tasty.
Not the cheapest pizzas, but well worth it. Recommended!",Date of visit: January 2020,Domino's,1,"Island of Malta, Malta"
Exquisite food and amazing service!,"Being close to home and boasting beautiful views of the Xemxija bay, we decided to dine at this restaurant on a quiet Sunday evening.
The ambiance inside is very quaint: a rustic building with simple decor but nonetheless, very romantic and relaxing. The tables are spaced out adequately, giving diners their space and privacy.
The staff was excellent. They were polite and made sure our experience was fabulous throughout. Even when there was a brief power cut, they made sure we had enough candles and even gave us their mobile phone with torch on to have enough light. They were super!
As for the food, the menu is unique and boasts amazing creative dishes, from mouthwatering starters, to inviting mains of meat and fish, to an enormous pizza menu, which is cooked in their wood oven.
For starters, after the divine smell of seafood coming out of the kitchen, I opted for their risotto marina while my boyfriend opted for the Casarecce rabbit. His dish lacked enough rabbit but the sauce was very well seasoned. My risotto was perfect: cooked in a salty prawn bisque and filled with ample seafood (a king prawn, mussels and vongole). Sizes were quite large
Mains were ribs cooked in a honey BBQ sauce for my boyfriend and a pizza Tronchetto for myself. My pizza was a rolled closed shape filled with gorgonzola cheese, mozzarella and guyere cheese and covered with a truffle and honey dressing, topped with parmesan and extra crushed walnuts. This was to die for! The truffle infused with honey was a huge surprise as I'd never tried a sweet version of truffle before. The combination was sublime. Pizza crust was also delicious and sizes very good. My boyfriend's ribs were huge. The meat was tender and sauce was deliciously sweet
Price for two starters, ribs, pizza and 3 pints of coke and beer was 66 euros. Liquor was offered on the house. Very good quality food for a very fair price
Will be back for the Tegaminos!",Date of visit: January 2020,Pepe Nero - Shellshack & Grill,1,"Island of Malta, Malta"
Multiple visits!,"In our one week stay, my boyfriend and I visited this establishment multiple times. We tried many different drinks: Gingerbread Latte, Toffee Nut Frappuccino, Toasted Marshmallow Hot Chocolate and more. All drinks were beyond divine in flavour. Yes, not cheap at 6 euros for a medium cup, however it matches the prices in the area. Also, medium drink is very large and satisfying. The place has a relaxing vibe and the staff very helpful. Also a yummy Chocolate Starbucks coin goes well with your hot drink!",Date of visit: December 2019,Starbucks,1,"Chessy, France"
Simple good hot dogs but expensive,"The decor of this small fast food joint is on point: actual photographs of old baseball teams, memorabilia and great attention to detail. A must for any baseball fan!
Menu is limited with four hot dog choices. Price for two hot dogs, 2 cokes and one fries was a hefty 28 euros. Nonetheless, it is to be expected in Disneyland Paris. Food was good and enjoyable. Extremely busy with long queues",Date of visit: December 2019,Casey's Corner,1,"Marne-la-Vallee, France"
"Wow, what an excellent meal!","We visited the restaurant located in Val d'Europe shopping centre in Paris. Being meat lovers, we were keen on trying this place out.
We were welcomed by a great team of waiters who sat us at our table. We had some crunchy crisps to nibble on while we looked at the vast menu.
My boyfriend opted for the mushroom burger cooked medium while I opted for the BBQ ribs. We were pleased to find out that this place offers unlimited sides and sauces, no extra charge!!
My boyfriend's burger was so tender it melts in your mouth. My ribs were spectacular: they had an amazing smokey marinade that was finger-licking good! Both ribs and burger were not very big, but the quality cannot be faulted at all! The fries were thin and crispy and very nicely cooked. I also ordered a portion of chorizo rice which was salty and delicious. As sauces, I thoroughly enjoyed their BBQ sauce as well as their divine Roquefort cheese sauce. As a dessert, I highly recommend the profiterole. It is this giant crispy sweet pastry filled with vanilla ice cream and whipped cream, served with the most mouthwatering hot chocolate fudge sauce on the side.
Staff was very diligent and friendly throughout, ambiance is chic and modern and prices are very fair. Highly recommended!",Date of visit: December 2019,Hippopotamus,1,"Serris, France"
Overpriced and nothing special,"Visited solely for their infamous Volcano dessert. Staff was welcoming and decor is fantastic: machine-driven animals in a cool forest layout, complete with sound and lighting effects. The effects can get a bit too loud at times though.
I ordered the sparkling volcano dessert. It was huge: vertically decorated brownie pieces, in which ice cream was embedded, and covered with whipped cream and chocolate and caramel sauces
The taste was good. However, brownies were not warm. So it was basically cake and whipped cream. Way overpriced at 18 euro! Anyways, was worth a try. Visit Planet Hollywood for a better dining experience!",Date of visit: December 2019,Rainforest Café,1,"Marne-la-Vallee, France"
Second time round and still spectacular!,"I had already booked this show three years ago when I visited Disney Paris with my mother. This time, I suggested to my boyfriend to book it again as I remembered how fun it was.
We arrived half an hour before the start of the show and were greeted by lovely live music by Goofy (dressed all Westernly) and some other musicians who sang some country songs. Then we were taken to our seats in a huge arena-like hall. While we were eating, a very entertaining show of comboys and Indians was going on beneath us. The staff highly encouraged the audience to participate and it was fun seeing all the stunts and action live on stage.
The food was as immaculate as I remember it! First, some nachos to nibble on. Followed by some chilli with corn bread which is delicious. Then, a skillet of a huge chicken leg, two enormous BBQ ribs, a sausage and tiny potatoes which was a very filling main course. The meat was all cooked to perfection! Sauce on point and meat tender. The dessert was out of this world! A delicious apple crumble with a scoop of vanilla bean ice cream which is mouthwatering. The crumble is hot and full of mushed apples which went down nicely with the cold ice cream. This was followed by lovely coffee and a Chocolate coin. Free flowing water, coke and beer was given. The beer is excellent also.
Staff very nice and the attention to detail is phenomenal.
The cost of the show was 65 euro per person. Totally worth every penny! Highly recommended",Date of experience: December 2019,Buffalo Bill's Wild West Show with Mickey & Friends,1,"Marne-la-Vallee, France"
Good fresh food at affordable prices!,"Visited for the first ever time at Disneyland Paris. We visited once for pizza and once for pasta.
The place was jam-packed with people. You are given a card as it is a self-service system.
We opted for the truffle pizza special the first time and the second time, I chose the truffle pasta while my boyfriend opted for the pasta al crema di funghi.
The pizza was delicious! Full of Truffle cream and topped with a generous amount of parmesan shavings and walnuts. Yum!!
My truffle pasta was a tad disappointing as it was bland. My boyfriend's pasta was so good, I ordered one for myself as an extra and it was delicious! The mushroom cream was thick and tasty. Portions are satisfying and prices are fair especially when compared to restaurants in Disney.
Staff nothing special but I would recommend it for a cheap(ish) meal",Date of visit: December 2019,Vapiano Disney Village,1,"Chessy, France"
Best restaurant in Disney Village!,"I had visited this restaurant three times when I first visited Disneyland Paris 3 years ago and I remember it being very good with big portions. So this time round, I suggested to my boyfriend to dine here also. It was so good, we dined here four times this year!
We tried the following: BBQ ribs, Nachos, Wings, Lasagna, Noodles, Mac Attack burger, Ribeye, Comet Milkshake and Super Sundae Brownie
The food is exquisite! The wings were the only thing we disliked (tasted like vinegar) and the burger was nothing special for its price. However, the BBQ Ribs were among the best we ever had and were enormous! The meat came right off the bones and was so tender! The fries are assorted: normal, curly and waffle fries. They are sublime! The nachos are TO DIE FOR! We had them once with extra pulled pork and once with extra BBQ chicken. They are huge and almost filling by themselves! They have delicious melted cheese, aour cream, beans, guacamole and pico do gallo. Amazing! Pasta dishes were unique and very tasty. The desserts are a MUST! Yes, the prices are high but the sundae with hot brownies and Chocolate and vanilla ice cream was divine and super in presentation! The comet Milkshake was decorated with mouthwatering sweets and was very thick and pleasant.
The staff is very friendly and accommodating. Service was excellent and quick. Prices are high but considering the location and the quantity and quality of the food, it is very fair
Our favourite spot in Disney!",Date of visit: December 2019,Planet Hollywood,1,"Marne-la-Vallee, France"
"Comfortable, excellent breakfast and close to Disneyland!","We stayed here for 7 nights as we were planning a 5-day trip to Disneyland Paris. As most of the hotels in the area, this one has a free shuttle bus service every ten minutes going to Disney and coming back. This provided us with a fast and efficient way to get to Disney
The buffet breakfast was surprising. It is by far the best breakfast I'd ever had in a hotel. The choices are vast and will please everyone! The breakfast contained: baked beans, eggs, sausages, the cispiest and saltiest bacon ever, baguettes, pound cake, cereals, jams, compotes, canned and fresh fruit, ham, cheese, yogurt, the most amazing pastries in the world (crunchy croissants and delicious pain au Chocolat), buckets full of nutella, maple syrup and a pancake machine!!!!!! Not to mention the wide array of cold and hot drinks (amazing hot chocolate)
The room was large and beda very comfortable. The bathroom was very big. Hotel very clean and staff very accommodating!
Will definitely be back when we come back to Disney!",Date of stay: December 2019,Campanile Val de France,1,"Magny-le-Hongre, France"
Abundant and delicious food in an unexpected place!,"We celebrated my cousin's Confirmation dinner at this quaint small restaurant in the heart of Haz-Zebbug. Upon entering, it gives you the impression that this was an old townhouse converted into a restaurant. The decor is antique, yet innovative. They use used tomato sauce tins as cutlery holders which is a great recycling idea. The toilets are clean but small, decorated with a black board with chalk so that guests can write a message. The sink basin is an old wine barrell which was also very cool.
First we had three rounds of appetizers:
1. Cold cuts and cheese platter - contained salami, brie cheese, blue cheese and other cheeses, bread biscuits and cranberry jam. This was delicious and a great entree
2. Stuffed mushrooms - porcini mushrooms stuffed with speck and filled with a DIVINE mushroom sauce infused with melted cheese. This was a mind-blowing dish, everyone was super impressed by these Heavenly bites!
3. Vitello tonnato - thinly cut veal pieces served with a cold tuna paste. This was also good
Then as a starter we had the risotto Porcini Mushroom with speck, mushroom soup or orechiette bolognese. Both dishes were homemade and delicious, the risotto especially was savoury and thick with a nice salitiness to it. Those who had mushroom soup were blown away by how good it was
Mains we all had the tagliata served with parmesan, cherry tomatoes and roasted veg and potatoes. Now being a fries fan, I was sceptical about the roasted potatoes. However these were so sublime that I ordered an extra portion! Cut in wedges, they were crispy yet soft and contained thr right amount of salt and oil! The meat was juicy and tender. Perfect parmesan to complement it. Recommended!
Service was friendly and very good portions. Amazing food and great prices. Pleasantly surprised!",Date of visit: November 2019,Lokomotif Kafe,1,"Island of Malta, Malta"
Most divine cakes in the island!!,"Visited this beautiful place for the second time on a lovely Sunday morning. As we went at 10am, the place wasn't packed and we chose a seat on the terrace overlooking the bastions, surrounded by breathtaking views of the surrounding areas.
I opted for the classic chocolate cake, the cassatella cake and the strawberry meringue. I also took the Perugina Flavoured Hot Chocolate coconut flavour. The hot chocolate was a tad too thick and I preferred the chocolate orange flavour that I had opted for the previous time. Nonetheless, it was enjoyable!
The cakes....were too good to describe in words!!! The chocolate cake is huge, moist and has the most divine ganache top layer ever... perfect for chocaholics!! The cassatella was one of the best I'd ever had, and this cake is my favourite kind of cake! It was light, the ricotta filling was fresh and contained pieces of candied fruit and hazelnuts, delicious! The strawberry meringue had a lovely crust and was light and airy. Very good!
Service was beyond exceptional, the waiter spilled some of my friend's capuccino and immediately changed it to a new one. Price reflects the quality and quantity of the food.
A MUST WHEN IN MDINA! Best cakes and views on the island!",Date of visit: November 2019,Fontanella Tea Garden,1,"Island of Malta, Malta"
AMAZING experience!,"We were a group of four and we chose""The Pub"" room. Clues were difficult and challenging, and it took a lot of teamwork to solve the puzzles! It was truly exciting and one clue led to the next. Some hints were given also. Staff is beyond amazing - cheerful and helpful! Very good value for money: 17.50 per person. A bit off the beaten track, but worth the effort!",Date of experience: November 2019,Can You Escape? Malta,1,"Island of Malta, Malta"
Amazing pizza and a wide variety of choices!,"Visited on a Saturday evening after seeing a lot of good reviews about the pizzas. The menu boasts over 40 choices of pizza, and upon entering one immediately gets the vibe that this is a genuine pizza haven.
My boyfriend chose the Zaza' pizza which contained pistachio cream, crushed pistachios and speck while I chose the Tartuffata pizza which contained mushrooms, truffle cream and speck
The pizza dough was light and fluffy and not filling at all. The ingredients were amazing! Both pizzas were divine: the pistachio cream was buttery smooth and the truffle on my pizza was potent and amazing! The speck was salty and went very well with the other ingredients.
Service was nothing special, pizzas came out very quickly and the price was 13 euro per pizza, which was fair for the quality.
A highly recommended pizza place! Will definitely visit again!",Date of visit: November 2019,Al Legna Pizzeria,1,"Island of Malta, Malta"
