reviewTitle,review_details,reviewDate,reviewFor,reviewRating,reviewLocation
Good but nothing special,"Visited on a quiet Thursday morning for breakfast. Service was very good as both waitresses were very friendly and helpful.
The food was good. Nothing out of this world, but good.
The breakfast bagel was nicely served with tasty crispy bacon, poached egg and avocado. The Chocolate bowl was quite nice also with a good balance of Chocolate, peanut butter, granola and banana. Chocolate brownie was also good
Some key points: We had to bring it to the staff's attention that the breakfast bagel was missing the crispy onion. Also, the Chocolate bowl was supposed to have coconut shavings in it which it didn't. So I'd expect the food served to include all ingredients mentioned on the menu. Second, rhe food took quite a long time to be served which I'd read also on previous comments by other clients.
Price was fair. Quantify is satisfactory.",Date of visit: November 2020,Java,1,"Island of Malta, Malta"
Ticks all the right boxes,"Visited with my boyfriend for dinner. We entered into a beautiful restaurant with a romantic atmosphere. The service was very good, even though it is worth mentioning the restaurant was almost empty.
Food was excellent. My boyfriend took curry risotto which was abundant and tasty and I took pizza Chef's special with a cheesy crust. It was delicious: smoked duck breast, walnuts, honey and raisins. Divine combination. We were given complimentary homemade cherry wine at the end which was also exquisite.
Price was very fair at 35 euro total for two dishes and four drinks.
Will visit again for sure!",Date of visit: November 2020,Ta' Stringi,1,"Island of Malta, Malta"
Very good products!,"Stumbled upon this cafeteria by chance. The multiple blocks of chocolate on display were gorgeous and appetizing. Opted for a 50g slab of milk chocolate honeycomb and a minni chocolate dessert with passionfruit. The chocolate was divine. The latte was also interesting and unique. Needless to say, presentation was top notch and ambiance was quaint. Only reason why I don't give it full marks is the price. 100g chocolate for 7 euro is a bit hefty. However, it is worth a try for chocolate enthusiasts!",Date of visit: November 2020,Sunday in Scotland,1,"Island of Malta, Malta"
Did not enjoy the meal,"The ribs were cold and lacked much BBq flavour. Fries were very good. Pricey for quality. Service was fine and ambiance was nice. That being said, my friend enjoyed her Local Burger.",Date of visit: November 2020,StrEat Whisky Bistro,1,"Island of Malta, Malta"
Good food,"Food and ambiance are both pleasant, even though nothing special. Pulled pork ftira was nice and different, with a strong mustard taste. My boyfriend enjoyed the Asian noodles, but he claimed they had too much ginger. The apple pancakes were good, but toffee was not enjoyable. The batter and apples were delicious.
I do recommend the cannoli milkshake which was divine! Honestly one of the best milkshakes I've ever had!
Quite pricey. Not sure if I'd revisit",Date of visit: November 2020,Villager By Munchies,1,"Island of Malta, Malta"
Spectacular throughout!,"This restaurant is located as a part of a hotel in the main road of Mellieha. The interior is very nicely decorated and waitresses were extremely friendly and diligent.
Ordered Pappardelle e Manzo for starter,which was delicious: cooked in a mushroom wine sauce and boasting with beef fillet and sundried tomatoes.
For main course, I opted for the Truffle burger which was accompanied with sweet potato fries and a delicious bourbon-like sauce. The patty was very flavorful and truffle sauce exquisite
Finally, one of the highlights, the divine mini doughnuts, smothered in warm Nutella and pistachios. The doughnuts were soft and coated with cinnamon and were sublime!
Value is also great, for a three course meal with a large coke the price was 30 euro.
Highly recommended!",Date of visit: October 2020,Tosca Restaurant,1,"Island of Malta, Malta"
Exceeded expectations!,"Ordered delivery from Bianca's which arrived hot and looking great
Ordered chicken burger, mac and cheese and Chocolate Chip shake
The burger was simply amazing, chicken was juicy and breading was super tasty. Chips were also exquisite
Mac and cheese was mouthwatering! Oozing with strong cheese taste so if you are a cheese lover, this is a must!
Milkshake was also very good
Price is very fair and portions large. Highly recommended! Will order more soon!",Date of visit: October 2020,Bianca's,1,"Island of Malta, Malta"
Great coffee and sweets!,This Italian Cafe surely excels when it comes to coffee and sweets. I highly recommend their Pistachio Crostata and Fresh Doughnut filled with nutella on order. Simply divine! Very friendly staff and great espresso too!,Date of visit: October 2020,UC Cafè,1,"Island of Malta, Malta"
Delicious food and great atmosphere!,"We visited Planet Hollywood Malta for the first time last Saturday for dinner. Having been to the one at Disneyland Paris several times, we had high expectations.
The decor is just as fabulous, with memorabilia of famous movies and actors. The restaurant in Malta is not quite as big, and the merchandise store is a bit dull. But otherwise, well decorated.
We chose a table outside overlooking the shopping mall.
We tried The Pink Panther mocktail which was very nice. We then ordered a Pulled Pork Burger and BBQ Pork Ribs. Both were delicious. The ribs were very tender and the sauce was amazing. Fries were thick and pleasant also. Portions were huge. For dessert, we ordered ice cream and the double chocolate Brownie. These were also wonderful, as was the chocolate milkshake.
We were also very well served by Tatiana who made sure our night was wonderful. Price is on the expensive side, but the quantity and quality make up for it for sure!
Highly recommended1!",Date of visit: October 2020,Planet Hollywood Malta,1,"Island of Malta, Malta"
Great food ar great prices!,"We visited for Saturday lunch. Ambiance is very welcoming and staff was friendly.
We opted for the mixed doner in plate which came with a generous serving of chicken and lamb, 6 salads of our choice, pita bread, fries and sauces. The serving was huge! Meat was delicious and I particularly enjoyed the rice, couscous, mushrooms and potato salad. Fries were thin and crispy also. all this food for just 9.50!
Highly recommended!",Date of visit: October 2020,Posh Turkish,1,"Island of Malta, Malta"
Would give it more stars if I could!!!,"Visited for the first time on my boyfriend's birthday. We were seated inside due to weather conditions. The interior is quaint and nicely decorated. Simple, but great attention is paid to detail; the couches are very comfortable and decorated with embroidered cushions, walls are characteristic of old Maltese stone.
Service was impeccable. We were attended to very well. The chef also came out to speak to us and described how all the food is made in-house. In fact, the warm bread rolls served in the beginning were amazing and tasted homemade for sure.
The starters were delicious: Pork Cheek Croquette for my boyfriend and Parmesan Agnolotti for myself. Both were exquisite, the Agnolotti were filled with delicious Parmesan cheese and topped with fresh truffles, a sweet onion sauce and Parmesan chips.
Main courses were definitely the highlight of the night. My boyfriend opted for the grilled Rib Eye while I took the Braised Belly of Local Pork. The Pork Belly dish was unbelievable! One of the best dishes I've ever had in my life! The pork was soft, juicy and tender to the touch. It's flavour was unbeatable. It was served with a canneloni filled with Maltese sausage. This was also phenomenonal. We both took a side portion of Truffled Polenta Chips which were incredibly tasty too!
Dessert was also a hit. I opted for the oozing hot Hot Chocolate Fondant served with vanilla ice cream and topped with hazelnut brittle. Simply wow!
Price with drinks was 107 euro. I can tell you it was worth every single penny! A shout out to chef Ryan Vella and waitress Ariana. Excellent experience and easily one of the best restaurants in Malta!",Date of visit: October 2020,Commando Restaurant,1,"Island of Malta, Malta"
Perfect Pizza and wonderful service!,"We visited on a Tuesday evening after being curious as to how good the pizzas are at this famous restaurant chain.
The location of the Qawra restaurant is beautiful. We sat on the terrace overlooking the beautiful coastline. We were served by a very diligent and helpful young man who made sure our experience was a great one.
We ordered several pizzas. I ordered the famous Calzone Capo di Monte and I also tried the Pizza Funghi Bianca. The Calzone was huge and had a delicious filling of truffle, cheese and mushroom and topped with a generous amount of parmesan, rucola and parma ham. The olive oil was also a nice touch. The pizza Funghi Bianca was also divine. It tasted like a Carbonara dish with a strong garlic flavour. Pizza dough was also very good.
For dessert we ordered the Pizzotto dei Peccatori which is a small calzone filled with nutella and topped with crushed nuts and chocolate sauce. This was to die for! The portion was perfect and it was generously filled with oozing warm Nutella. The dough complemented the sweetness of the dessert.
Lastly, I'd like to mention their amazing and unique drinks. I was particularly impressed by their Ice flavoured hot chocolate which was basically hot chocolate with ice. This was incredible. Their cappuccino with cinnamon flavour was also a hit.
Price is fair for quality and quantity. Highly recommended and will definitely be back!",Date of visit: September 2020,Vecchia Napoli,1,"Island of Malta, Malta"
Unique and Super Delicious!,"Ordered an Octopus Burger for take away. I was surprised by how good this was. The octopus was so soft and delicious. The chorizo complemented the octopus very well, as did the excellent tomato relish. The bread was fresh and crispy. The burger came with a large portion of amazing salty fries. Highly recommended! Very unique and worth every penny!",Date of visit: September 2020,Sea Salt Gourmet Takeaway,1,"Island of Malta, Malta"
Great pastries!,Ordered a Pistachio and Nutella Croissant to go. They were huge at only 1.80 a piece. The Pistachio one was ok but the Nutella one was TO DIE FOR! Heavily filled and very soft dough. Will try other pastries for sure!,Date of visit: September 2020,Le 2 Sicilie,1,"Island of Malta, Malta"
Definitely a new favourite!,"Visited this restaurants after seeing the menu online. I was intrigued by their unique burgers. The restaurant is tucked away behind Naxxar Parish Church and the interior, although small, is very welcoming. We were served by a lovely man (presumably the owner). I ordered a cookies flavoured ice coffee, the Indian Bhaji Burger and Waffle Fries with Cheese and Bacon. The ice coffee was one of the best I've ever had and the food...WOW! The burger was bursting with flavour, aromatic Indian spices, a fried Bhaji and excellent mango chutney. The bread was also toasted nicely. The waffle fries were also perfect. The melted nacho cheese definitely hit the spot!
Fair prices, nice ambiance and DIVINE food. Definitely a new favourite!",Date of visit: September 2020,The Daily Grub,1,"Island of Malta, Malta"
Delightful and genuine!,"We haveave been visiting Peking for several years and it has been the best Chinese restaurant we've ever tried. The food doesn't have excessive oil and is always fresh. Amazing dishes: from their yummy mixed starter plate and aromatic crispy duck, to their amazing chicken with cashew nuts, noodles and rice, to their divine desserts. Great service and cosy atmosphere. Not cheap, but very good if you're feeling up for Chinese!",Date of visit: September 2020,Peking,1,"Island of Malta, Malta"
A very good family-run restaurant!,"Visited this restaurant on a Friday evening for dinner. The interior was cosy and quaint, much like an old Maltese townhouse. We were seated by the window, with a perfect view of the St. Paul's Bay Dock. Staff was super friendly and explained to us some of the history of the restaurant and how their family runs the place.
The menu is quite vast. We chose the curried chicken pasta as a starter and two pizzas as a main course. The pasta was delicious and pizzas were also very good. My meat feast pizza had a bolognese sauce instead of the usual tomato sauce, which was great. Pizzas were very large and we barely could eat all of them!
One critique was that the pizzas were so piping hot, that we could not eat them for a few minutes. And it was difficult to eat them by hand because toppings fell off.
However, very high quality ingredients, great dough and very good price.
I highly recommend!",Date of visit: September 2020,Damiano's,1,"Island of Malta, Malta"
Great apple crumble,"To be quite honest, I expected a lot better after reading multiple reviews. Ordered three small nutella and white chocolate doughnuts, a brownie cake pop, and two slices of apple crumble. the apple crumble with caramel was the best I've ever had! However, the other items were average. Total price 10 euro for small pastries which I though was a bit pricy. Very nice gentleman serving clients.",Date of visit: September 2020,Tad-Dulċier,1,"Island of Malta, Malta"
One of the top Burger spots!,"After the hype on social media, my friends and I decided to give this eatery a try. We were welcomed by friendly staff in a cosy restaurant with chic decor. The place was very busy and most tables were reserved (lunch time)
We ordered the Pig Out Burger, Tiffany's Special Burger and Geez Louise Burger. All burgers were exquisite and perfect in taste: the beef patty was genuine, juicy and full of flavour, the pork belly and honey in the Tiffany's Special Burger was phenomenal and the extra crispy bacon in the Pig Out Burger was mouthwatering. The sweet potato fries were also a must, as was the amazing house sauce served with each burger.
We also enjoyed the Maltesers and Bounty cakes which we ordered.
Can't wait to visit again! Definitely one of the best restaurants in Malta!",Date of visit: August 2020,Tiffany's Bistro,1,"Island of Malta, Malta"
Amazing food and very cheap!,"This place was bustling with activity on a Sunday evening. The ambiance was fine, we were seated on the road (perhaps due to social distancing they had to include tables also on the road). Service was quite slow, for which the head waitress apologised as they were very busy and some waiters were beginners.
Other than this, we were pleasantly surprised. A complimentary board with mushroom rice, local tomato paste, beans and a basket of hot crispy Maltese bread was given. This was divine and we devoured it heartily. Then came the ribs. A huge rack of juicy tender ribs which were super easy to eat with a knife and fork as they fell right off the bone. The meat was full of flavour and BBQ sauce was excellent. Fries were very nice also. The bill for two drinks and 2 racks of ribs came to only 28 euro - what a bargain!
Great food, friendly waiters and unbeatable prices. Will be back!!!!",Date of visit: August 2020,The Fat Rabbit,1,"Island of Gozo, Malta"
Exquisite!,"Being a huge fan of ice cream, and having one of the best ice cream Parlours round around the corner, I was eager to see whether Roll & Chill is par with my favourite ice cream spots
The ""show"" where your ice cream is made in front of you is pretty fun to watch. We opted for the Kinder Bueno rolls and the Banana and Peanut Butter rolls. Both flavours were AMAZING and definitely recommended! The taste is so genuine, plus you can see with your own eyes that no artificial ingredients or sugar is added.
The staff was SUPER FRIENDLY and made the experience even more fantastic. The Kinder Bueno Bubble Waffle was delicious and huge too! Mum also opted for a watermelon lemonade which she enjoyed immensely
WELL DONE! Can't wait to visit again!",Date of visit: August 2020,Roll & Chill Ice Cream,1,"Island of Malta, Malta"
Good but expected better,"This quaint restaurant is found in Old Theatre Street, among the bustling activity of our beautiful capital.
Having seen reviews, especially about the carbonara, I was eager to visit
The place is very quirky: small outdoor tables, colourful decor and a lovely display of the various fresh pasta they make in-house.
For starters, we opted for the Bruschetta Norma and the Semolina Pie. The Bruschetta was good. The pie was PHENOMENAL. Bursting with truffle flavour and surrounded by the most divine Pistacchio pesto ever!
As mains we took the tagliatelle carbonara and the spinach pasta with garlic, oil and chilly. Both were good. Carbonara pasta needed a bit more creaminess as the sauce left me wanting to drink water after each bite. The guanciale was delicious. The spinach pasta was very well cooked.
Bottom line: good food and big portions at a fair price. Service was also satisfying. But there are better places for pasta.",Date of visit: August 2020,Pastaus,1,"Island of Malta, Malta"
Spectacular!,"Had already visited the establishment in Valletta twice. This time opted for the Mgarr restaurant. We were seated on the rooftop with a view of the Mgarr church. This was perfect! The ambiance was very beautiful and the fresh air was just what we needed in this heat!
Servers were very polite and diligent. They made sure our needs were met at all times.
We shared a few ftiras which were divine. The one with Maltese sausage and pork belly (Ta' Karmnu l-Bidija) was mouth watering! For mains I tried the Horse stew served in a whole Maltese bread. This was delicious: the red wine sauce was rich and the meat so tender and flavorful! The portion was enormous and no one managed to eat it all! I also sampled some of my Grandad's octopus stew which was to die for! The roast potatoes on the side were out of this world and everyone happily gobbled them up!
For desserts most of us had the traditional Imqaret served with Maltese ice cream. These are my far the best I've ever had. Coming from someone who doesn't like Mqaret so much, this is saying a lot! The ice cream was also divine and complimented the date fritters very well.
Price is fair for quantity and quality. I prefer this restaurant over the Valletta one just for ambiance.
Highly recommended!",Date of visit: July 2020,Nenu the Artisan Baker,1,"Island of Malta, Malta"
Perfect!,"A very busy cafeteria in Victoria Gozo. Delicious coffee and fresh traditional food which was divine! Great qassata, amazing pastizzi and pizza! Try the caramel latte!!",Date of visit: July 2020,Kafe' San Gorg,1,"Island of Gozo, Malta"
Good,Good but not as good as the proper chimney cake in Hungary. The dough was too crispy and not fluffy enough. Ice cream is very good and delicious toppings. Super friendly service!,Date of visit: July 2020,Funny’s Wood House,1,"Island of Gozo, Malta"
Good but expected better,"There were many things that were great, but other things that were sub par.
For starters, one dish came out cold. This was returned without issues. The service was quite poor on the whole, we were neglected most of the time and we had to make an effort to catch a waiter's attention. When we asked questions regarding price of the dessert, the reply was ""I don't know"". Cutlery was forgotten. Pasta lobster was nothing special. The sauce was good but quite average on the whole

That being said, the waiters were polite and did apologize for mistakes. Starters and desserts were divine and so were the cocktails.

Good restaurant, but expected better, considering the price",Date of visit: July 2020,Hilltop Restaurant,1,"Island of Malta, Malta"
"Delicious food, unbeatable scenery!","Visited for the second time for a romantic dinner date.
We were seated outside, overlooking the gorgeous Mellieha hill, on top of which lays the beautiful Church. The manager and staff were all very welcoming and attentive.
We were served a complimentary board consisting of a fresh warm Maltese loaf accompanied by their house made tomato paste, olive oil and some salt and pepper. This went down very well
For starters we opted for the Rabbit sausage and Fried Gnocchi. The rabbit sausage lacked any distinct presence of rabbit but was enjoyed. My gnocchi were perfect - deliciously soft and flavorful, served with pumpkin veloute which was exquisite and a lot of speck - also amazing
For mains we opted for taglierini with walnut pesto and mushrooms and agnolotti with beef cheeks served in truffled butter. Both pasta dishes were excellent. The agnolotti contained very tasty juicy meat and a very salty sauce. There was not much hint of truffle however. The taglierini were delicious and also had a very good sauce.
We also had truffle parmesan chips on the side. These were very good and went well with our meal. However, yet again, a bit more truffle would have made them perfect.
This was a gorgeous experience: Excellent food, fantastic view and diligent service. Definitely will visit again!!!",Date of visit: June 2020,one80 Kitchen & Lounge,1,"Island of Malta, Malta"
UNBELIEVABLE burger!,"I ordered for the first time, food came by delivery quick and hot. Ordered La Romana combo. The burger was to die for, an explosion of flavours! Burger had delicious porchetta, crispy onions and the most divine pepper sauce ever. Fries were THE BEST I've ever had by far! Super crispy! Also ordered three sauces: Jack Daniels, Peanut Butter Mayo and Hermanos sauce. The peanut butter mayo and hermanos sauces were mind blowing!!! The staff is super friendly and ready to answer any questions with enthusiasm!
Great price, exceptional food!!!!!",Date of visit: June 2020,Hermanos Burgers,1,"Island of Malta, Malta"
Great desserts!,"Visited after seeing all the mouthwatering dessert items on Facebook. We often go to Gozo to spend a weekend, and had not yet found a place that offers unique desserts fit for a true foodie!
Ordered a Chocolate Lover bubble waffle. It was warm, filled with chocolate and goodies like Maltesers and Kinder fingers, and topped with ice cream! Price was 6 euro, which is fair. Also, I asked for extra nutella on the side and they did not charge me for it. Nice staff, convenient location, and tasty sweets. We will be back!!",Date of visit: June 2020,Cup Cake,1,"Island of Gozo, Malta"
Good ice cream!,"Excellent ice cream, a lot of flavours to choose from. Soft serve is delicious, as are their various scoop flavours! To be honest, I was not at all impressed with the Kinder and Ferrero flavours, however I did enjoy the Helwa tat-Tork flavour. The best are by far the chocolate orange, Bounty and cannolo Siciliano flavours! Simply wow! The scoop sizes are quite small, price is ok. Recommended!",Date of visit: June 2020,Marco Tanti Gelateria,1,"Island of Malta, Malta"
Phenomenal!,"Definitely the best pies on the island! Can recommend the Bouchey and Pig 'n' Cheese pies, both of which contained incredibly juicy, succulent meat and amazing crust. The mushy peas were also great. The brownie was TO DIE FOR too! Don't miss it! Will be back for more!",Date of visit: June 2020,Bouche,1,"Island of Malta, Malta"
Innovative and delicious!,"Amazing food, quick delivery by Bolt and the most cordial service! Ordered a vegetarian Chimichanga, a pork Chimichanga and a Banana Chimichanga. All were excellent. Pork one was to die for! It was heavily filled and cooked to perfection! Highly recommended",Date of visit: May 2020,Avotaco,1,"Island of Malta, Malta"
Delicious cuisine!,"Ordered take away, food was delicious and piping hot! Garganelle Cartoccio was pleasant, pizza al Gorgonzola very salty and divine! My boyfriend thoroughly enjoyed his Paccheri Pulled Beef. Cordial service and very good quality. Highly recommended",Date of visit: May 2020,Bianco's,1,"Island of Malta, Malta"
Perfect food!,"Ordered delivery multiple times. Pizza is the best ever, I highly recommend the Peking Duck and Quattro Stagioni ones! The crust is amazing - full of sesame seeds!
Would also recommend the chicken pie which is delicious, Mixed Sunday Roast with gorgeous melt-in-your-mouth meats and their huge ribs!
Huge portions, prompt service and great prices! Highly recommended!",Date of visit: May 2020,Rusty spoon,1,"Island of Malta, Malta"
"Good pasta, wrong pizza choice?","Ordered delivery which was on time. A mistake was done to the order regarding a missing item , to which the establishment offered a free soft drink on the next order. Opted for the Oven Special Pizza with a deep pan option. The crust was beautiful, however, the pizza was not to my liking, very bitter perhaps due to the balsamic glaze. Perhaps it was the choice that was a mistake. On a more positive note, the Tickly my Fancy pasta was delicious! perfectly cooked and full of juicy chicken pieces and nice salty cream sauce.",Date of visit: May 2020,The Oven,1,"Island of Malta, Malta"
On point!,"Amazing food at great prices! Delivery always on time and huge portions. One of the best pizzas I've ever had: Ample toppings, fresh ingredients and the most amazing dough with sesame seeds! Both Quattro Stagioni and Peking Duck pizzas are recommended!
Staff also VERY polite and helpful Well done!",Date of visit: April 2020,Rusty spoon,1,"Island of Malta, Malta"
Exceptional pastries!,"Visited Qawra outlet Amazing pastries in their simplest form! Opted for a Doughnut-like pastry with Ricotta filling, and a Rum Baba. Both were Heavenly! Highly recommended!",Date of visit: March 2020,Dolce Sicilia,1,"Island of Malta, Malta"
