reviewTitle,review_details,reviewDate,reviewFor,reviewRating,reviewLocationOne of the best meals!,"To get things straight - I gave four stars not five due to my boyfriend's steak. He opted for a 350g USDA ribeye which cost 45 euro. Presentation was pretty dismal and he said was nothing special in quality either
On the other hand, my experience was of a whole other level!! We shared a speciality starter - ribs glazed in Bourbon sauce - Wow!!!! We were highly impressed
My mains was a special also - surf n turf consisting of half lobster and wagyu burger which chips and salad for 39 euro. The burger was juicy and tender and lobster was a taste of Heaven! Wow I felt like I was dreaming with every bite!
All in all, service was impeccable, my food was phenomenal and I would recommend this place!
Pricey so be prepared",Date of visit: November 2018,Sciacca Grill Valletta,1,"Island of Malta, Malta"
Best donuts!,"I am not such a keen donut lover. However decided to try the Donut Factory for the first time. Tried maple, apples and cinnamon, kinder and strawberry sprinkles donuts - they were DIVINE especially the kinder ans maple!!! The donut holes are also amazing!
Cheap prices and friendly staff. Also very cosy ambiance. Enough said!",Date of visit: November 2018,The Donut Factory,1,"Island of Malta, Malta"
Elevated and something for everyone!,"Mellows has been open ever since I can remember. Was usually a cafe, serving basic and simple snacks. Today, excellent and experienced chefs have taken over and have turned this restaurant into a great gem, not to be missed!
Menu is varied and includes tastes for everyone, ranging from the staple pizza and pasta dishes to high quality, fine dining style gourmet burgers, speciality pizzas and meat and fish dishes! And as if this wasn't great enough, prices are on the lower side and portions huge!!
Starters: fried Maltese gbejna, rabbit liver and focaccia. All divine especially gbejna!
Mains - I opted for their special pizzotto which had the sweetest shape and was one of the best pizzas I had ever eaten!
Well done to chef Chris and waitress Naomi for excellent experience!",Date of visit: October 2018,Mellows Cafe,1,"Island of Malta, Malta"
Best steaks ever!,"Treated my boyfriend to a nice birthday dinner at this place, what appeared to be the only steakhouse in Santorini!
Starters - pork belly in fava bean puree and meatballs
Mains - bon fillet and tagliata
Every single dish was impeccable down to the last detail! Best steaks we had ever eaten!
Make sure to book ahead as it gets busy. Also not cheap but great quality so well worth it!!",Date of visit: September 2018,Rare Greek Restaurant Santorini,1,"Santorini, Greece"
Wow worth every penny!,"My boyfriend being a fishing enthusiast, we decided to boom this trip for end September. We were a total of 3 couples so it was very easy to make friends as it was a small group.
The tour started quite close to the white beach where they pulled up their fishing cages and 800m long fishing net. They show you the catch as they pull them out. We had caught quite a few fish including squid and octopus!
Then they let you swim and give you snorkelling equipment. After they provide fishing rods and lines and fresh bait and show you how to fish. We caught some more fish this way which was very fun and exciting!
After, they cook all the freshly caught fish on board and provide you with a huge buffet of fresh fish, seafood, homecooked rice and salad and plenty of yummy bread! We were stuffed!
Captain was an amazing young lady who stayed with us and showed us everything she knew
She was also interested in getting to know us and sharing our own experiences
Also pick up from hotel and drop off at hotel was a great plus. Worth the price at 130 euro per person! Cheapest in Santorini!!!",Date of experience: September 2018,Santorini Traditional Fishing Experience with transportation,1,"Santorini, Greece"
One of the best experiences of our lives!,"Visited this gem for a five night stay. Was in Fira so the central location drew us to this villa. Little did we know that the service and ambiance was beyond our expectations!
The rooms are small apartments: a lovely bedroom with tv, balcony and a comfy double bed, a kitchen with all amenities and a very spacious bathroom with fabulous shower!
The pool is very relaxing, great area as only 7 minute walk to centre.
What I was really happy with was the amazing service. They greeted us and booked all that we needed (tours, restaurant reservations). They even helped me surprise my boyfriend with cake and champagne on his birthday!!!
Will definitely visit again. Highly recommended!!!!!!!",Date of stay: September 2018,Villa Ilios,1,"Santorini, Greece"
Wow one of a kind!!!!,"After multiple attempts at visiting, we were disappointed with not having the chance to eat at Debbie's. Once we were told kitchen was about to close, and the other time we found it closed in the morning.
After reading the reviews, we swore we would try again. And boy was it worth it!!
My boyfriend opted for a full English breakfast and I opted for their blueberry and coconut pancakes with nutella on the side
The food was BEYOND EXPECTATIONS - My boyfriend thoroughly enjoyed the breakfast. Toast was like a brick wall so huge!!
My pancakes were so fluffy and delicious- I didn't even need a knife to cut them! Blueberries really complimented the greek yogurt and very nice sweet maple syrup and the nutella was a great addition
We also took the most phenomenal milkshakes ever...Nutella !!
We were left speechless !
Service was also very nice and friendly

Do not miss this place....exceptional!",Date of visit: September 2018,Debbie's Cafe,1,"Island of Malta, Malta"
Our go-to place wherever in Gozo!,"This family run bakery never disappoints! Have visited countless times, each time ordering their ftiras, pizzas and baked goods!
We tried the cheese, tuna and anchovy and beef ftiras - all sublime! Personal favourite is beef!
Pizza tried capricciosa which is amazing!still made with bread dough (typical Gozitan)
Also tried their lampuki and pumpkin pies, muffins and qassatat - all delicious!
Not to mention the impeccable service each time and ridiculously cheap prices! Don't miss this gem of a bakery!",Date of visit: September 2018,Mekren Bakery,1,"Island of Gozo, Malta"
Wow! Amazing choice and prices!,"This gelateria is right beside the parking area in Xlendi. Being a huge fan of ice cream and having an obsession with Sotto Zero gelateria in Bugibba (arguably the best ice cream by a long shot), I was keen to try this gem of a place
Staff was extremely friendly and helpful! They had various of scoop flavours to choose from. Also a variety of cones dipped in nutella and nuts, milkshakes, soft ice cream and flurries! Not to mention the gazillion toppings one can choose from!
I opted for three scoops: belgian chocolate, red velvet and chocolate orange. I chose nutella, crunchie and dairy milk as toppings and a nut and nutella dipped waffle cone. My boyfriend opted for an oreo flurry with nutella
Both options were DIVINE! huge ice creams with intense and incredible flavour! The total price came to 7 euro for both huge desserts!
Highly recommended! Best ice cream and dessert place in Gozo, without a doubt!",Date of visit: September 2018,Gelateria Granola,1,"Island of Gozo, Malta"
Long wait but good food,"Visited on a public holiday on a Saturday night. Located in the busy village of Xlendi, it is a quaint restaurant right beside the parking area.
We ordered fillet with mushroom sauce and octopus in garlic. We were given complimentary bruschetta which was nice. Even though the restaurant was not full and there were plenty of waiters, food took 45 min to arrive
Fillet was cooked to perfection, mushroom sauce was the best I've ever had. Octopus was tender and cooked very well, with plenty of garlic sauce to dip their deliciously served hot bread! Finally we were given complimentary limoncello.
Prices are reasonable and menu very extensive...almost too varied!
Service was average, nothing particularly good or bad
Overall a great dining experience and recommended especially for fish lovers!",Date of visit: September 2018,Talija Restaurant,1,"Island of Gozo, Malta"
Go for the exquisite ribs!,"Visited as a group of 6 (3 couples). Ordered ribs, chicken, ribeye, burgers and pasta
My boyfriend's mushroom sauce was rather watery and not to his taste. However portions were all big and plentiful
My rack of honey and BBQ ribs were EXQUISITE!! as a rib-eater, I know my ribs and these were among the best!pork meat was very tender and fell right off the bone. Flesh was pink and sauce very delicious and not overpowering!!
French fries were also very tasty and crispy! Loved the whole experience!
Bottom line: if you are a ribs fan, you must come here!",Date of visit: August 2018,dBistro Restaurant,1,"Island of Malta, Malta"
Can't recommend this enough.....NEW THINGS TO TRY EVERY TIME!,"Been visiting this amazing ice cream shop since it opened around 6 years ago. And let me tell you, there is nothing that will ever disappoint!
Ice cream: exquisite over 30 flavours to choose from, new flavours each week, meet all dietary requirements , eah flavour is like tasting the original item; personal favourites are kinder sorpresa, ricotta e pera and whole nut cadbury.
Cake: they have the option of pre ordering either a semi freddo cake or a torta gelato. The latter being ice cream in cake form and is exquisite...beyond words can describe!!!! Tried kinder and cadbury ones and all guests were impressed!
Granita and milkshake: AMAZING! I'm not a fan of strawberry however their strawberry granita tastes like genuine strawberries! Milkshakes made of blended ice cream scoops of your choice are creamy yum!
Most recent discovery....CANNOLIS!!! Oh...my...God! The best cannoli I've ever tried by a long shot! Whole crunchy pistachios at the ends, sugary ricotta and a crunchy cannoli shell...like no other!

Bottom line: this place has ruined every other gelateria for me, as no other ice cream on the island..or in other countries I've visited compare to this place! If you seek homemade goodness that will send your taste buds to Heaven and back, you cannot even dream of missing out on this place!!! FANTASTIC",Date of visit: August 2018,Sottozero the Gelato Factory,1,"Island of Malta, Malta"
Ok now I'm getting obsessed....,"Decided to leave yet another review about this amazing establishment after visiting for the fourth and fifth time.
The fourth time: Carbonara burger and Lindt pancake
The fifth time: Cow and Chicken burger and Galaxy Caramel pancake

The Carbonara burger was BY FAR the best burger in existence!! It's genuinely like eating carbonara pasta in a juicy succulent burger! Not to mention the creamy egg, lovely guanciale and also a thick piece of fine grana padano cheese. Wow!!!!
The lindt pancake was also very good and presented exquisitely
The Cow and Chicken burger was HUGEE! Burger was juicy and chicken pieces amazing!
As for the galaxy caramel pancake....OH MY GOD!it was honestly like a taste of Heaven with every single bite....pleaseeee YOU CAN'T MISS THIS!!!!

anyways, this place always impresses me and is the place where I want to get married and get buried (seriously)

Special thanks to chef and owner Daniel and waitress Danika!",Date of visit: August 2018,Shoreditch Bar & Kitchen,1,"Island of Malta, Malta"
Wow!! Wasn't expecting this!,"Finally visited after tons of good reviews and recommendations from friends. Opted for a Maxibon waffle with extra Hersheys and nutella and also a Thirsty cow shake (with oreos)
The shake was immensely delicious and went down very well! As for the waffle, I usually dont like waffles that much so was sceptical whether this would impress me. However, I can safely say that this was the BEST waffle I'd ever tasted! The waffle itself was thick and crunchy, chocolate and nuts complimented perfectly and helped the Maxibon ice cream to melt delicately over the whole dessert.
The only thing is, the items werw a tad pricey - paid over 12 euro for both items. However will definitely return to try more waffles and shakes!
A+++++++",Date of visit: July 2018,Thirsty Cow,1,"Island of Malta, Malta"
Impeccable cuisine!,"Visited for the second time for a family birthday lunch.
First time had the Jack Daniels ribs which were so perfect and among the best I've ever had (being a rib-aholic,I've tasted plenty), I was lookibg forward to revisiting.
This time opted for their octopus .the portion was HUGE and it was without a doubt the best I have ever had.
Service was a tad slow this time round. Staff did not bring bread or cutlery when we were cutting the cake. However all in all this is one of my favourite restaurants in Malta!
Will try their famous pasta next time",Date of visit: July 2018,Uncle Matt's Kitchen,1,"Island of Malta, Malta"
Very lovely ambiance and very genuine and good food,"Visited this establishment three times. All were exceptional!
However we wanted to visit again due to change of ownership to see if it retained its 5 star status
Opted for rabbit in gravy and horsemeat on one dish. Horsemeat could have been served hotter, but was delicious and had great gravy!
Rabbit was BY FAR the best I've ever had!gravy was succulent and salty, ate a lot of bread with it!!
Very nice chips and roast veg served on the side, so food was not only divine,but delicious!
Price is very good considering great service, fabulous dishes and amazing ambiance. Feels like a fine dining restaurant with an affordable price!
Highly recommended!",Date of visit: July 2018,Maestrale Gourmet,1,"Island of Gozo, Malta"
Pricy but good,"Very nice view and good amount of choices on menu
Muffin was large. Good but nothing special
Freakshakes were presented nicely with over 50 flavours to choose from, served with a doughnut and kinder egg. But for 6.50 euro per shake, they weren't very big
Will visit again to try snacks :)",Date of visit: July 2018,Sea View Bar,1,"Island of Malta, Malta"
Never been served,"Very disappointed with this establishment. We always wanted ro visit after seeing great reviews .
First time went at around 4.30 and told us they were closing
Second time went at around 11.30am and we found it closed.
Very disappointed and I doubt we will ever attempt to visit again",Date of visit: July 2018,Debbie's Cafe,1,"Island of Malta, Malta"
Best service and exquisite food and view!,"Big thanks to the manager and to chef David for the great care taken to serve our group of 9 people. Were served special bbq ribs which were plentiful and divine! Everyone was very delighted with the food. Prices worth the quality!
Also we were seated in the terrace with a lovely view of Qawra and Bahar ic Caghaq. Amazing experience! Definitely a gem!!!",Date of visit: July 2018,Luzzu Restaurant,1,"Island of Malta, Malta"
Great snacks!!,"Been wanting to visit this food truck for ages,never had the chance since it doesn't open on weekends.
Went on a Friday and opted for their renowned pulled pork bun
This was by far the best pork bun I'd ever tasted! Generous with the meat, delicious fried onions and cabbage
Highly recommended!!!",Date of visit: June 2018,EAT,1,"Island of Malta, Malta"
5 stars are NOT ENOUGH for this place!,"Visited for the third time after falling in love with their burgers and pancakes with a goal to keep trying a lot of their food items from a wide variety on their menu! They keep adding new burgers and pancakes on the menu, which is fantastic!

This time round, opted for the speciality burnt duck burger. This was huge! Meat was cooked to perfection, tender and pink in the middle! Thin cut fries delicious and coleslaw not overpowering! Burger hit the spot!

For dessert my boyfriend and I took Reese cups pancake and kinder pingui pancake and shared both. Reese was good but kinder pingui was OUT OF THIS WORLD! when I took a bite out of it, I was about to die with astonishment. The taste was bewilderingly good!

To top it off, service was also perfect and prices very reasonable!
Bottom line, if you haven't yet visited this establishment, you are missing out big time!!

WELL DONE SHOREDITCH!",Date of visit: June 2018,Shoreditch Bar & Kitchen,1,"Island of Malta, Malta"
"Amazing view, good food and service!","We visited here one night during our stay in Istanbul. We opted to stay on the rooftop where we had an outstanding view of the Blue Mosque.
We opted to share a meat pide and also ordered manti (ravioli) and a meat stew. Food was very good,even though the manti were not to my liking, a bit heavy on the sour cream, but I suppose that's the traditional way of cooking them. All in all, we really enjoyed our visit! Service was also very good and attentive!",Date of visit: May 2018,The Terrace Restaurant cafe,1,"Istanbul, Turkey"
Best restaurant we've been at Istanbul!!,"My mum and I ate here three times out of seven days we were at Istanbul!
First night we opted for hamsi fish starter and a mixed grill for 2. Second night we chose the mixed fish grill for 2 and the final night we returned for that amazing and mouth watering mixed grill meat platter for 2!!!
Food is plentiful, ambiance is relaxing and welcoming and service is very attentive!all waiters became friends with us and we were given complimentary baklava and tea after dinner.
Slightly pricier than other restaurants (approx 40 euro/200TL between 2 people) but definitely worth it!!",Date of visit: May 2018,Saltanat Fish & Kebab House,1,"Istanbul, Turkey"
Definitely coming back!!,"Visited Istanbul for the first time and stayed at this gem. It had the complete package! Great decor and ambiance, clean rooms and amazing service! All members of staff are super sweet and helpful! Room was small but comfortable and equipped with all necessities! They give you free water upon arrival
They also offer a transport card which can be used by up to 5 people. Make sure to ask for it!
Location is EXCELLENT! one road up you find the tram and metro. Also very central area,walking distance to main attractions!
Breakfast is by far the best I've ever experienced at a hotel! Choices are abundant: various types of bread, eggs, cereals, cold cuts, various cheeses and cakes and cookies ...what I loved most..
Typical Turkish food items!!! Like halva (amazing), cheese-filled pastry, grilled veg with sour cream, Turkish cake, Turkish tea and more!
Also a small fitness room and sauna downstairs. We felt spoilt like Queens!
Tipped them 80TL (15 euros) as we really enjoyed our stay!
Highly recommended!!!",Date of stay: May 2018,Enderun Hotel Istanbul,1,"Istanbul, Turkey"
Good food and atmosphere,"Visited this establishment as a large group. We had a set menu which was quite varied
Starters included pasta with wild boar ragu, mixed fish fritters, a heated Maltese loaf with goat cheese, burrata, arancini and fried large meatballs. Especially enjoyed the heated bread, burrata and meatballs!
For main course I opted for duck breast with a honey glaze sauce, plated alongside a roasted butternut squash and a 'potato cake'
I usually rarely eat duck but I must say this dish was Gordon Ramsey worthy!
Duck was exquisitely cooked, honey sauce so good I devoured bread with it! And oh my God... what on earth was that potato cake?! It was one of the most divine things I had ever eaten! Layers of succulent potato embellished with creamy cheese in between! Wow!!!
For dessert opted for a millefoglie - layers of crispy sweet dough filled with white chocolate in one layer and with milk chocolate in another. Served with peanut ice cream. Also very good
All in all,I am glad I visited this restaurant. Good food, view and service!
TRY THE DUCK!!!!",Date of visit: May 2018,one80 Kitchen & Lounge,1,"Island of Malta, Malta"
"Creative and messy, but delicious milkshakes!","After all the hype about these milkshakes, my boyfriend and I decided to pay this place a visit at Tigne Point in Sliema.
We opted for nutella and kinder milkshakes.
A+ for decoration and aesthetic appeal! They look divine with several chocolate goodies related to the flavour you choose. Very messy, my hair ate some of it also haha!
Taste was very good, even though a tad overpriced at 6.50 per shake
However made me curious enough to try the other flavours so will return to try them again!",Date of visit: May 2018,JAR,1,"Island of Malta, Malta"
Managed to convert me to a Neapolitan pizza lover!!,"Being a person who loves a thick pizza crust and abundant toppings on a pizza, I have never been a fan of Italian style pizzas with thin crusts and few toppings. However, after being recommended by a few friends of mine, I decided to try this hidden pizza place located in our lovely capital
We arrived an hour before our booking as we were ravenous, hoping they would accept us despite our early arrival. We were greeted by very friendly waiting staff and told it was no problem.
We were served tiny fresh bruschetta. Then, about 8 minutes after ordering the pizzas arrived! Talk about fast service!
My mum opted for pizza patate e salsiccia (potatoes and sausage) while I opted for their famous carbonara pizza
Pizza was one of the BEST I've ever had in my life!!!! True, crust is thin and light but the taste and quality is beyond SUBLIME!
Atmosphere is very cosy, service gentle and quick, food impeccable and prices are very good given the quality!
Will definitely visit again!",Date of visit: April 2018,Sotto Pizzeria,1,"Island of Malta, Malta"
Made mistakes but they made up for them!!,"Visited this gem for the second time on a very busy Saturday night.
At first we were a bit annoyed. We had a reservation at 8.30 and were told to wait to be seated. We were finally seated after 15 minutes. Then, it took the staff 45 minutes to take our order!!
However, his must have been due to some shortage of waiting staff as, after food arrived, it was exceptional!
My boyfriend opted for a fillet and I opted for a rabbit spaghetti. The rabbit pasta was HUGE and consisted of many pieces of rabbit as well as rabbit liver which I requested. The fillet was tender and tasteful. What is more, due to the long waiting time, every member of staff came to check on us and also gave us complimentary drinks (any drink we desired).
Highly recommended!!!!",Date of visit: April 2018,Qbajjar Restaurant,1,"Island of Gozo, Malta"
Astounding view and amazing food!,"My boyfriend and I visited on our anniversary. We were seated outside, with an incredible breathtaking view of the Gozo harbour, with Malta visibly showing in the horizon. The view alone is an enough reason to visit this gem!
Then came the food: a gorgeous fillet of beef and spare ribs. The spare ribs were to die for, barely any fat on them and so tender you can use a fork to simply get the meat off the bone. The food is also VERY well priced and service is also very good!
A+++++",Date of visit: April 2018,Xerri l-Bukkett,1,"Island of Gozo, Malta"
2nd time and I'm in love!!!,"Visited for the second time after a fantastic experience the first time.
Last time had taken Jameson burger, this time opted for braised beef rib speciality burger
Last time for dessert, opted for a kinder pancake and a Hersheys pancake while this time took the speciality cannoli pancake
After the first visit being such a perfect dining experience, I was looking forward for the second visit
And i can say with full confidence that it was SUBLIME once again!!
Burger had a very delicious peppercorn sauce and the beef was delicately cooked and top notch
The pancake was indescribable. Milk and white chocolate sauce with yummy cannoli and stacked with 4 divine pancakes. Words cannot describe this place!!!!",Date of visit: April 2018,Shoreditch Bar & Kitchen,1,"Island of Malta, Malta"
WOWWW!!!!,"Visited this establishment on a very busy Easter Sunday. We were a group of 9 people and immediately upon arrival, we were greeted and taken care of with the utmost care!
Ordered a variety of dishes - from pizza, burgers, pasta, octopus and ribs. I tasted all and EVERYTHING was SUPERB!
my dish was the rack of ribs with Jack Daniels sauce....I must say they were divine, so tender and exquisite! Also very generous portions and reasonable prices!
The service was impeccable from start to finish! My thought is, if they are capable of delivering such a perfect experience on a fully booked holiday, imagine how they treat their customers on a regular day!!!
This has been an unforgettable dining experience, seated opposite the picturesque Marsascala seafront with AMAZING food and service.
One of my favourites!has been ranked at the top of my list!",Date of visit: April 2018,Uncle Matt's Kitchen,1,"Island of Malta, Malta"
Third time's a charm!,"On previous occasions,visited Hard rock cafe for burgers. Burgers were always mediocre in my opinion,when compared to their prices
However yesterday opted for the BBQ mix containing ribs and pulled pork. The meat was slow cooked to perfection,so tender!!!fried onions on pulled pork were delicious, cowboy beans, fries and sauce were all perfect! Then shared their delicious hot brownie for dessert which was to die for!
Service quick, prices a tad high especially cocktails. However the ribs and meat was perfect. A very good experience!",Date of visit: March 2018,Hard Rock Cafe,1,"Island of Malta, Malta"
