reviewTitle,review_details,reviewDate,reviewFor,reviewRating,reviewLocation
A great and funny Day with Tasos !!,"Tasos is a very friendly, hospitable and courteous person.
In my opinion one of the best excursions in the area of Galatas / Poros.
Thanks Taso for the great time.
See you in the Summer:)",Date of experience: September 2019,Fishing Trips Poros,5,"Poros, Greece"
Best Cafe in Galatas,"Best cafe and breakfast in Galatas. We visit this locally every day and the staff was always very friendly.
Ευχαριστούμε πολύ για όλα
See you next year",Date of visit: August 2018,La Frianderie,5,"Galatas, Greece"
