reviewTitle,review_details,reviewDate,reviewFor,reviewRating,reviewLocationGorgeous if naughty!,What a lovely little find! We discovered it by accident when visiting the Farm Shop (which is opposite and also fab). We had an amazing hot chocolate and bought some lovely homemade fudge. The ladies who served us were lovely and couldn't have been more friendly and helpful. Definitely worth popping in for a hot chocolate and some naughty sugary goodies!,Date of experience: October 2016,The Chocolate Deli,4,"Little Walsingham, United Kingdom"
"Great food, lovely staff",Can't really fault this place. We had a spontaneous meal in there last night. The food was absolutely lovely and the staff a delight. I can highly recommend the madras. Gorgeous! Nice vibe and cost surroundings. Highly recommended.,Date of visit: October 2016,Black Lion Hotel Restaurant,4,"Walsingham, United Kingdom"
A real gem!,"I can only reiterate the words of the previous reviewer - this restaurant is really wonderful. Fine food, great service and a lovely ambience.

My husband discovered it recently and booked us in to their Cowboy night last Thursday. As soon as we walked in Adrian greeted us and took us to the bar. They have a really good selection of drinks. I was driving so I got stuck into some lovely cream sodas. Made a real change from the boring coke or water! I particularly enjoyed the non-alcoholic Butterscotch Beer.

We had pre-ordered our steaks so once we took our table and ordered our starters there wasn't a long wait for food to start arriving. It was all fantastic. My husband had the beef chilli to start which was gorgeous, and I can certainly vouch for the Chilli Poppers. Then the steaks arrived. Very large and beautifully cooked. No need for any sauce! Some of the best meat we have ever tasted. Home fries and bacon beans and 'shrooms which came with the steaks were also lovely. We were so full after the main course, but somehow we managed to find space for a shared Texas Mess (best variant on Eton Mess we've ever had!) At the end of our meal, Adrian, the owner, chatted to us about the meat, the recipes and travel. It was a fantastic evening in a warm, welcoming and cosy little restaurant. Thanks so much to Adrian, Martin the chef, and Lauren who served us.

I would highly recommend this place. We will be going back very soon!",Date of visit: September 2016,Gallacher's Smokehouse Bar and Grill,4,"Leigh-on Sea, United Kingdom"
Wonderful hotel!,"We have just returned from staying for two weeks at Akti Olous and had a fabulous time.
The hotel is located on the water’s edge just a few minutes’ walk from the centre of Elounda. It has been refurbished to a very high standard (we were surprised that it is only 3 stars), and even though the rooms are on the small side, they are lovely. Our room on the third floor had a fabulous ‘side sea view’ of the bay and looked out across to Spinalonga which was wonderful. The balcony, though small, is the perfect spot for an early morning beer and people watching. However, if you want to me more sociable, the bar on the roof, ‘Sky Bar’, offers fantastic views across the bay. Harry, the resident Mixologist is the perfect host. He made us feel very welcome from the moment we walked through the door. Throughout our holiday he always there for a chat and a laugh. He even planned a one day tour of east Crete for the day we had booked a car! (which turned out to be fab!) And of course he makes a fantastic cocktail (often with his own twist!) The atmosphere in the Sky Bar is very friendly and relaxed. We met some lovely people there on our holiday.

The pool is a little small for the size of the hotel, so sun beds can be limited but the hotel has a little beach at the front so there is always somewhere to sunbathe. There is also a nice little beach a few minutes’ walk towards the peninsula if you want a change.
Breakfast is a good selection of buffet items, from cooked English, to Continental (meats/cheese/croissant, etc), and cake, Greek yoghurt, toast, fresh orange juice, coffee, tea, etc. There’s certainly plenty of choice. Breakfast runs from 7.15 – 10.15am and although I don’t think we made it down before 9am most days, there was always plenty of food which was being constantly replenished. We would also definitely suggest trying the restaurant at the hotel, Blue Sea. The food and service are great, and you might even get to have your dinner on the jetty on the beach!

The staff at the hotel were, without exception, great. From Yiannis (the night manager?) who greeted us when we arrived at 3am, to the other Receptionists, and the bar/restaurant staff – particularly Maria who brought us our vanilla milkshakes with caramel syrup (!) most afternoons! And of course, Harry at the Sky Bar. All were very friendly and helpful. The cleaning lady was lovely and we found she cleaned our room at roughly the same time each day which worked well for us. There were always clean towels and shower mats, and the room was spotless after the cleaners had been.
The rooms have a very good aircon unit but you do have to pay extra for this, which I think is fairly standard. It is worth it though – it was very effective! You also have to pay extra for the same (ours was in the closet) but we didn’t bother. I left ipads, cameras, passports in our room and never had an issue, but the safe is there if you want it.

We would highly recommend this hotel and will definitely be returning. It made our stay in Elounda perfect.

Some little tips:
Bus to Plaka or Agios Nikolaos goes from near the chemist, just along from Euro Market, at the back of the hotel. Taxis go from Elounda Square and are about 8 euros to Plaka and about 14 euros to Ag. Nik.
There is a great little laundry opposite the Euro Market called Lol’s Laundry. We found it a life-saver. They do a great job and charge a very reasonable amount.
Try the Grill House just across from Euro Market. They do fabulous gyros, the staff are wonderful and it’s so cheap. They also deliver (to hotels as well as private addresses). The name is only on the front in Greek but they are called Salonikios.
If you want to go to the more popular restaurants along the water’s edge between the hotel and Elounda town centre, you might have to book. We particularly liked Lotus Eaters (Daniel is a fantastic host), Ferryman, and Olondi (look out for Ninos, the little white dog!) The bar next door to Olondi (I think it’s called Mediterranean Café is also very good and reasonably priced)
Ask Harry (the barman at the Skybar at the hotel) if you need any advice – he’s fantastic and a font of all knowledge!
Stacey the Jet2 rep was extremely friendly and helpful even though we didn’t book via Jet2. We booked a tour through her and she gave us some great local advice.
If you forget a beach towel, they sell them, and just about everything else at the very friendly Euro Market at the back of the hotel.
We hired a car from Elounda car hire which is a few minutes’ walk from the hotel (on either the sea front or the street behind). They were reasonably priced and delivered/collected the car from the hotel.
It can be very windy in Elounda. Get pegs to clip your towel to your sunbed from Euro Market.",Date of stay: August 2016,Elounda Akti Olous Hotel,4,"Crete, Greece"
Lovely gyros!,One of our favourite little places in Elounda. Loved it. And it's so cheap!! The staff are so friendly and the food so tasty.,Date of visit: August 2016,Salonikios Grill,4,"Crete, Greece"
Make sure you book!,"This is a fantastic restaurant! It was our favourite when we visited Elounda recently. Daniel, the owner, is a fantastic host. The food is wonderful, the service is great, and the view is gorgeous. It's quite small and always gets booked up, so make sure you book in advance. It is well worth it. They have the best pitta and humus in Elounda! We went twice in a week and would have returned again if we had had more time. Highly recommend this place.",Date of visit: August 2016,Lotus Eaters Restaurant,4,"Crete, Greece"
Lovely food and lovely view,This was another of our favourite restaurants when we visited Elounda recently. The food was excellent. My husband had fish (Bream I think) and most impressed that the chef actually brought the food to the table. And it was his favourite fish of the holiday. It is very popular so book to be sure of a table. Lovely staff too.,Date of visit: August 2016,Ferryman Taverna,4,"Crete, Greece"
Gorgeous restaurant,"This was the restaurant at the hotel at which we stayed. We ate there twice in two weeks, and chose to spend the last night of our holiday there. We weren't disappointed. We had a table on one of the little platforms on the edge of the beach/in the water. It was gorgeous. The food is lovely. Watch out for Tony, the cheeky waiter - he's fantastic!",Date of visit: August 2016,Blue Sea Restaurant,4,"Crete, Greece"
Lovely food but pricey,"We had the most delicious meal here. The food is excellent, and the location is stunning. However, it was, we felt, a little over priced. It was our most expensive meal of our holiday. We (two of us) ordered a reasonable amount of food but by no means excessive and it was over €100 with just one beer each. That's why we can only give it 4 stars, not 5. But food is great.",Date of visit: August 2016,Ergospasio Restaurant,4,"Crete, Greece"
Cool spot in the heart of Midtown,"This hotel is great. It has a beautiful lobby, and the bars are cool and quirky. It's ideally located on 58th, just off 8th Av, so ten minutes from the theatre district. There is a subway at the end of the street at Columbus Circle, and it's very easy and cheap to jump in a cab up 8th if you're having dinner/drinks down in the restaurant area around the forties.
The rooms are not the biggest - we stayed in a standard the first night, which was very small. BUT, we hardly spent any time in it so it really didn't matter, and it was very lovely, despite the size. The double deluxe was perfectly fine for us (we spent 3 nights in one) The rooms are quiet - we heard nothing from other rooms at all.The staff are lovely, and very helpful. In fact, I would say that their customer service is second to known in my experience. We would absolutely stay there again. If you're on a bit of a budget it's a great option. The library bar (or the cow bar as it become known between us - you'll see why it you visit!) was fab. Really lovely little bar and a lot quieter on a Friday night than the main bar (we're a bit too old for that level of music!). Oh, and the beds are amazing!
Loved this place. Will be returning soon.",Date of stay: March 2016,Hudson New York,4,"New York City, New York"
Wonderful meal,"Tonight we thought we'd try the latest addition to Billericay High Street. My husband and I are both bug fans of Thai food and having spent a bit of time in Thailand are not easily pleased. But I am delighted to say we had a lovely experience at the Giggling Squid this evening. We had booked and were immediately seated in a lovely spot. Throughout the evening the service was impeccable, the staff lovely, and the food beautiful. We couldn't fault it at all. We will definitely be returning - frequently! Highly recommend this restaurant.",Date of visit: September 2015,Giggling Squid Billericay,4,"Billericay, United Kingdom"
Second visit and still as fabulous!,"We stayed here in 2012 and had a wonderful time (my previous review is here somewhere) so we decided to return this August. I am delighted to report it was as wonderful as ever. Jenny and Gregory are the most welcoming hosts and Angelo is the best barman around. As before, we felt part of the family instantly. It may technically be only 2 1/2 stars but it is so much more. Rooms are kept spotlessly clean by the marvellous Dora, and the pool is cleaned to the highest standard every morning. There are always plenty of good quality sun beds for everyone and the bar is a shady respite from the sun. With views of Mount Ainos in one direction and the ocean with Zante in the distance in the other, you really can't ask for much more. And the icing on the cake is that it just seems to attract the nicest people. We met so many lovely folk, some of whom we will keep in touch with. So many people said to me that it was the most relaxed they've been in a long time. It really is a little bit of paradise. We will definitely be returning (again!) p.s. If you go, make sure you have lunch there - Gregory is the most wonderful chief. I recommend the Pasta Neopolitain!",Date of stay: August 2015,Maria Anna Hotel,4,"Cephalonia, Greece"
Lovely bar with lovely owners,Great spot for a beer or two with amazing views of across the sea towards Zante. Also show the major football games which kept my husband happy! Lovely spot and the British owners are very friendly and accommodating. One of our favourite places for an evening pint.,Date of visit: August 2015,Bar 360,4,"Cephalonia, Greece"
Fabulous!,"We didn't book, which was nearly a mistake. It was very busy when we arrived but the manager/owner (I presumed to be Matthew), quickly found us a table. Immediately we were taken with the intimate, friendly and relaxed atmosphere. It is small and homely, which makes the evening feel rather special - a bit like you're at a private exclusive dinner party. It was a mixed crowd, including some very well behaved children, older couples, young families, a younger couple, and a couple of groups of friends - it is clearly a place which appeals to all and I can see why. Everyone seemed to be wholeheartedly enjoying their meals. The menu caters for all tastes, the food is very much 'home-cooked', plentiful, very well presented and tastes amazing. There is a really selection of wine and beer too. I can personally recommend the goats cheese and Parma ham parcels, and the steak frites. Both were wonderful. Matthew serves with a joke and a smile, and is very accommodating. The whole evening was perfect, and was easily the best meal we had all week (and there was some stiff competition!)
Highly recommend this place. Next time we would book to avoid possible disappointment as I couldn't bear building myself up to another visit to find they were full. Warning: food envy is inevitable! What ever you choose, be prepared to also want what the people at the next table have as well. It all looked SO good.
Thank you, Matthew, for a special evening",Date of visit: February 2015,Matthew's Bistro,4,"Ambleside, United Kingdom"
"Lovely pub, lovely meal, lovely people","Staying in the local area for a few days this week, we have been looking for country pubs to eat in, and came upon the Outgate Inn. We popped in the day before to see what sort of menu they offered and were welcomed by the very friendly landlord, so we booked for the following evening.
We had a lovely meal at the Outgate. There was plenty of choice, the meals were generous in size, tasted great and were very nicely presented. They were also piping hot, which isn't always a given these days! All of the staff were extremely accommodating with everyone in the pub, and with a log fire burning, it was a warm, cosy evening.
We wouldn't hesitate to return and to recommend to others. Although we didn't have any, FYI - they welcome dogs, kids and muddy boots!",Date of visit: February 2015,Outgate Inn,4,"Hawkshead, United Kingdom"
One of our faves!,"Whenever we return to the Lake District, we always visit Hawkshead, if nothing else for afternoon tea at Minstrels. They do a wonderful afternoon cream tea which a must! It is a cosy little shop, quite old fashioned, quaint and quirky, with very friendly staff. I find Hawkshead a little too touristy generally but Minstrels is one place we will always return to.",Date of visit: February 2015,Minstrels Gallery,4,"Hawkshead, United Kingdom"
