reviewTitle,review_details,reviewDate,reviewFor,reviewRating,reviewLocationTranquil and comfortable,"Beautiful setting and clean, comfortable and well equipped houses. We stayed for 10 days and found this to be an ideal location to be based whilst we explored Northwest Murcia. Within 5 minutes drive of the centres of Caravaca and Cehegin the site couldn't' be better for getting to the attractions and restaurants of the area.
On site there is a well kept swimming pool and a laundry room and the rooms are just as described on the website.",Date of stay: September 2015,Casas Rurales,1,"Caravaca de la Cruz, Spain"
Traditional and enjoyable Tapas restaurant,"Delicious tapas from this little gem of a restaurant. Friendly service and good quality combined with some very good value offers (12 king prawns in batter and 6 x 200ml beers for €10!).
In the tradition of Spain don't arrive before about 9pm as they may not have got round to opening",Date of visit: September 2015,La Maestranza,1,"Caravaca de la Cruz, Spain"
Well worth the visit,Great food and choice of pleasant siting areas. We sat in the roof terrace area and had the half Peltilla and a Fillet steak. Both were delicious. Our young waitress was attentive and polite and the atmosphere and ambience were superb,Date of visit: September 2015,Restaurante El Sol,1,"Cehegin, Spain"
