reviewTitle,review_details,reviewDate,reviewFor,reviewRating,reviewLocation"Budget, Friendly Accommodation in a Great Location","Well it is called Eyre Square Hotel for a reason, it is across the road for the Eyre Square Park, one of Galway's main attractions. It is around a 5 minute walk to the pedestrian zone that is filled with cafes, pubs, shopping and more. The hotel had a 24 hour reception which was very handy for any questions or queries and the service from the staff was extremely friendly.
The rooms are basic, but just what you need. We stayed in the hotels nicest room as we were a couple looking for some space at the end of our trip and it certainly had what we required. A reasonably priced hotel in a great location. Would stay here again.",Date of stay: February 2017,Eyre Square Hotel,4,"Galway, Ireland"
Best Burger this side of NYC,"After having visited NYC only a month ago, we had Burgers and Chips freshly on our mind. Bunsen Burgers on Essex St East delivered this and more. We left this place knowing that the following day we would be back for lunch.
The burger patty was deliciously moist, the potato side was a decent size and the burger itself came with all the fillings that a good burger is known for, including a pickle!
Highly Recommend.
Very busy, so be prepared to wait 15 mins at least at the peak times.
The front of house manager has an excellent computer system that sends you a text so you can go away and come back when your table is ready.
Must Visit if in Dublin!",Date of visit: February 2017,Bunsen,4,"Dublin, Ireland"
Delicious village pub grub,"For a town of 600 people, this little village delivered the best fish and chips that we had in entire trip to Ireland.
Fresh, crisp and tasty. The service was sensational and the manager/owner made us feel right at home with the locals and the locals made us feel right at home in their pub. Great experience, a true memory!",Date of visit: February 2017,The Blue Bull,4,"Sneem, Ireland"
Hidden Gem outside of the bustle of NYC City Centre,"This hotel was so incredibly beautiful and true to its style. From the rooftop bar, to the ballroom to the Captains Suite, it was truly like being aboard the Titanic.
The staff and concierge are next level. They looked after us every step of the way and nothing ever felt like it was too much.
As a frequent traveller, it is much more effective for us to pay for things before we arrive, just so we know that it is done and we don't have to worry about it. This hotel doesn't offer that and that for us was its only downfall.
Suitable for all ages, the smaller cabin rooms have a bit of a hostel vibe to them as they are quite small - this may not suit some travellers who opt for the smaller room size. It is QUITE small.
One thing I do remember clearly is that some days the cleaners would do an amazing job and then others they would forget our room. Didn't bother us to much, but for some this may be an issue.
Location is in West Village and I am so glad we didn't do the NYC city thing, because the outlying suburbs are where the real NYC flavour comes in and the restaurants and nightlife around this area and further down in Soho and Nolita is just excellent. The Jane gives you that closeness to both city and outer suburbs.",Date of stay: January 2017,The Jane,4,"New York City, New York"
