reviewTitle,review_details,reviewDate,reviewFor,reviewRating,reviewLocation
Toller Halt für eine Brotzeit,Sehr schöner Ort für eine Brotzeit. Sehr leckere österreiche Schmankerln und insbesondere ein toller Apfelstrudel. Sehr empfehlenswert!,Date of visit: September 2020,Himmelwandhutte,4,"Bad Gastein, Austria"
Sehr empfehlenswert,"Sehr empfehlenswertes Restaurant mit sehr leckerem und tollem Essen. Sehr nett und aufgeschlossener Chef, der mit Rat und Tat zur Seite steht, wie auch das nette Personal. Sehr leckere schwäbische Spezialitäten und immer einige saisonale Besonderheiten.",Date of visit: November 2019,Weinstube Am Stadtgraben,4,"Stuttgart, Germany"
Perfektes Frühstück,"Gehe seit Jahren (un-) regelmäßig zum Frühstück zum Herbertz. Immer sehr schön, lecker, nette Leute und toller Kaffee. Tolle und lockere Atmosphäre. Leider komme ich nicht mehr häufig hin, aber wenn ich in der Nähe bin, immer gerne!!!",Date of visit: September 2020,Herbert z Espressobar,4,"Stuttgart, Germany"
Perfect!,"We had a very perfect evenning and enjoyed the excellent meal. As it was so good, we decided to visit this restaurant a second time. We had a perfect view over a very nice small part of the harbour and could cherish the sunset during eating. Really perfct!",Date of visit: August 2020,Γυροκομειο,4,"Koroni, Greece"
Perfect beach and very nice water.,Very nice beach area. Good place for resting a whole day. A very nice bar with good Cafe frape is locted right next to the beach.,Date of experience: August 2020,Zaga Beach,4,"Koroni, Greece"
Beautiful and nice place to be.,"Very nice place with lots of tourist shops and nice places to rest for a drink.
Very nice old castle / monastery.",Date of experience: August 2020,Koroni Castle,4,"Koroni, Greece"
Perfect trip!,"We had an amazing and perfect day with George. It was very beautiful experience and we made a nice trip along the coast. We were provided with an enormous sympathy and the hospitalty was really unique - Greeke salad, sweets and cookies were served. The boat trip brought us to two very nice bays where we really could enjoy swiming and watching fish. We cherrished the trip very much and will do it again!
The most perfect day during perfect holidays! Thanks, George!",Date of experience: August 2020,Fishing and Dreaming in Koroni,4,"Koroni, Greece"
