reviewTitle,review_details,reviewDate,reviewFor,reviewRating,reviewLocation
Amazing boat trip - swimming and snorkeling,"This boat trip with George was fantastic. We went out on his nicely refurbished and well adapted boat for a day trip along the coast and the close islands, stopped for swimming and snorkeling at almost untouched beaches and had a great time. Eating and drinking was included and George is a great host!
He is a former fisherman who knows a lot about the sea and the region and shares his stories with guests.
I can highly recommend this trip. „Swimming and Dreaming“ at its best !",Date of experience: August 2020,Fishing and Dreaming in Koroni,5,"Koroni, Greece"
Tolle Hotel am Peloponnes,"Camvillia Resort ist ein tolles Hotel nahe eines schönen Strandes mit feinem Sand und klarem Wasser. Sehr freundliches und hilfsbereites Hotel Team mit persönlichem Charme. Besonders das Team der Rezeption hat uns in allen Fragen gut beraten und großartige Touren organisiert. Das griechische Frühstücksbuffet ist reichhaltig und von hoher Qualität mit tollen Speisen (exzellenter Kaffee!). Der Ausblick vom Infinity Pool auf die Bucht von Koroni ist atemberaubend. Die Zimmer sind modern, sauber und mit allem Komfort. Ich kann dieses Resort für einen entspannten Wohlfühl Urlaub am Peloponnes sehr empfehlen.",Date of stay: August 2019,Camvillia Resort Messinia,5,"Vounaria, Greece"
Außergewöhnliche Tour über griechische Oliven Olivenöl Produktion und Verkostung,"Das ist eine außergewöhnlich interessante und kurzweilige Tour über griechische Oliven, Olivenöl Produktion, Verkostung von Olivenöl und griechischer Spezialitäten, die ich sehr empfehlen kann.
Dimitra ist eine besonderer Guide, die uns und die jugendlichen Kinder mit viel Charme und spannenden Details begeistert hat:
Die Olivenmühle befindet sich in der Nähe des Androusa Castle, das auf einer Anhöhe steht mit tollem Blick über die Bucht von Kalamata. Wir haben alles über die beiden regionalen Olivensorten erfahren, konnten Olivenöl unter fachkundiger Anleitung verkosten und wesentliche Geschmacksdetails schmecken. Als weiteren Höhepunkt haben wir selbstgemachte Spezialitäten zusammen mit Olivenöl gegessen. Danke für dieses tolle Erlebnis.",Date of experience: July 2019,The Olive Routes,5,"Androusa, Greece"
