,reviewer_profile,date,rating,title,text
0,https://www.tripadvisor.com/Profile/RachelA955,October 2020,5,A great insight into the fishing life of Kefalonia combined with amazing food and great swimming and relaxation too!,"Thank you for Michalis and Antonia for looking after us all so beautifully yesterday. As a family of six adults we were greeted on the dock with home made cake and coffee before we set off and then experienced in a very small way the life of the fishing boat. 2km of nets pulled in, hard work, brutal at times, explained in Antonia’s excellent English. The fabulous appetiser and lunch interspersed time swimming in the azure seas and diving off the boat. By the time we set off back for the port we were all happily full, relaxed and tired. What a lovely day out! "
1,https://www.tripadvisor.com/Profile/emybee393,September 2020,5,Unforgettable Experience,"Wow! What an incredible experience this was! Antonia and Michalis are wonderful, friendly people and they truly make you feel like family. Everything in the description is accurate and it’s worth your time and money! From helping with the catch, enjoying the ride on open water, eating a fabulous meal, swimming in a secluded area, to laughing and chatting, it’s truly magical. I hope to visit Kefalonia again so I can book this trip! Don’t hesitate! Book now!"
2,https://www.tripadvisor.com/Profile/R7767OTkarinr,August 2020,5,Great relaxing day out,Amazing day out with Antonia and Michalis. First great fishing adventure; getting to see the nets being brought up and the catch of the day. Very fascinating for kids. Afterwards you stop by in a small secluded bay where you can swim and jump off the boat while Antonia prepares the most amazing fish-based lunch. We found it really interesting to have time to speak to Antonia too and ask her about local customs and other things we'd been wondering about Greece and the islands.  A great day out that I can warmly recommend!
3,https://www.tripadvisor.com/Profile/Malt73,August 2020,5,Fantastic day out with the best food!,"Absolutely fabulous day out with Michalis Fishing. Antonia greeted us with Greek coffee and the most fabulous cake which her daughter had made. Once the other two families had joined us we set sail for where Captain Michalis had set the nets the previous day. We watched as the nets were reeled in and the catch was removed from the nets, and then we stopped in a lovely bay for a swim. Whilst we relaxed in the water Antonia made the most delicious bruschetta with all fresh ingredients - so tasty.  Then we set sail for an alternative spot for another swim stop whilst lunch was prepared. I can’t describe how fantastic the food was. A good fish restaurant in London would have charged a small fortune for half of what we ate. Absolutely beautiful. The wine and water flowed all day too. After lunch and another few swims and relaxing on the boat in the sun we set off back to the marina. It was the perfect day. The hosts were so friendly and it was really interesting watching the nets being brought up and emptied. And then the catch being turned into our lunch! But even if you don’t have the remotest interest in fishing you will still have a great day out on the water with lovely people. We would thoroughly recommend it. If you’re concerned about Covid-19 this year I can assure you they very much look after you - The boat is bigger than I expected but they don’t take out too many people so social distancing is not a problem. With temperature checks etc on arrival they clearly take every precaution to make sure everything is safe for their guests. We absolutely loved it and will definitely book when we’re next in Kefalonia. Thank you to everyone on board for making our day so special. Kat and Jonathan. X"
4,https://www.tripadvisor.com/Profile/Great_Expectations75,August 2020,5,This trip is a must if you like (love?) great food,"Let me just say this: before this trip, I had never NOT finished a lobster. With Michalis, we had so much of it (wonderfully cooked, just absolutely stunningly delicious!) that we just couldn't eat it any more! Antonia is a wonderful cook and a brilliant host. We didn't catch much fish, but what we did catch was: a stingray (threw it back overboard), crabs (ditto), a shark (ditto), octopus (cooked and ate), a scary looking fish (overboard), and a few plain looking fish (also overboard as there were just too few of them to cook). Kids had a great time, we all ate loads, jumped and dived off the boat into crystal clear water of the lagoon Antonia's husband took us to while we were waiting for our lunch to be cooked. This trip is a must, really, and we'll definitely be doing it again when we're back in Kefalonia."
0,https://www.tripadvisor.com/Profile/DeepFriedDodo,July 2020,5,A Trip to Remember!,"This was a lovely day trip which ticked all the boxes. Antonia was an excellent host and catered for everyone's needs at all times. We were looked after from the second we stepped on board until after we'd returned home. We saw our lobster caught in front of our eyes, were able to take pictures with the lobster and witnessed the preparation. Whilst cooking was ongoing we were dropped off at a secluded beach only accessible by boat, where we could swim  on the shores. Food was served with the most gorgeous fish soup made fresh from what was caught in the nets, rich lobster with pasta (for a first time eater) and finished with watermelon. This was all on top of the refreshments provided throughout the trip. On our return we witnessed how nets were relaid and we were given all the information we needed in perfect English. We were even lucky enough to have a few turtles circling the boat, alongside seeing all the fish in the crystal clear water. The trip was a delight, brilliant value for money and I would recommend to anyone."
1,https://www.tripadvisor.com/Profile/thelankiw,July 2020,5,Amazing day out fishing,"Best day of the trip, helped with the fishing nets and swam at a secluded beach while our lunch was being prepared. We got to see a few turtles as well, circling our boat while we were eating! Had a lovely lobster spaghetti as well as other fresh Greek dishes. Very friendly and excellent service, and really good communication. Really appreciated the quick responses whenever we had any questions beforehand, and thanking us by text soon after the trip and sending us photos, really added a personal touch. Would highly recommend to anyone who loves fishing, seafood and the sea!"
2,https://www.tripadvisor.com/Profile/ShanahA,July 2020,5,Must have experience in Kefalonia,"Amazing authentic fishing experience! As a family of four with two little ones, we had a blast. Especially, the kids who were in awe of the fishing experience. Delicious lunch with wine and beer to top it off. Highly recommended!"
3,https://www.tripadvisor.com/Profile/Mrsbonjovi59,October 2019,5,Lifetime experiance,My hubby has done this trip now twice. Once in May then in October. Both trips for him was fantastic. Truly what he wanted which was a hands on experience on a fishing boat. The company on board with the family was excellent. Good fun and good food and I know he would go again next year. Thank you to Antonia and her family for making him feel at home. Yours Janet and Michael ellis. Pesssda.
4,https://www.tripadvisor.com/Profile/mervrothwell,June 2019,5,AMAZING DAY,All I can say is that this was one of the best trips I have ever done on a holiday abroad. Experience life on a real fishing boat and be fed by what you catch on the day. Food is amazing. A big thank you to Antonia and Michalis - totally charming and extremely friendly. Good luck with your business. Saganaki!
0,https://www.tripadvisor.com/Profile/amyvM1352SU,October 2019,5,Fantastic Day,We met up with them at the dock and promptly got on the boat and had coffee and cake.  After visiting for a few minutes we were off to find the nets.  They reeled in the net and we got to pick the fish out.  Many varieties and sizes.  After we finished the nets they motored over to a nice cove for swimming and lunch.  Wonderful food!  Fresh caught fish cooked to perfection.  At the end of the day we motored back to the dock!  It was an excellent day.  Wonderful hosts!
1,https://www.tripadvisor.com/Profile/S8673EYsimonep,September 2019,5,FISHING TRIP WITH ANTONIA AND MICHALIS ON 30 SEPTEMBER 2019,"We had a fabulous day with Antonia and Michalis on Monday 30 September 2019.  We were picked up by Antonia and taken to the boat early in the morning. When everyone had arrived, there were 11 of us, we were served coffee and homemade cake which was lovely.  We then set sail for the nets.  When the nets were being pulled up the men on board enjoyed helping taking the fish from the nets.  We were then taken to a beautiful cove where you could only get to by boat.   While we snorkelled Antonia prepared a magnificent lunch.  The wine was made from their own grapes and the olive oil from their own olive trees which tasted superb.We met some lovely people on the trip from Italy, Holland and the UK who made the trip memorable.We cannot fault the trip even though I am not normally a boat lover!  Antonia and Michalis were wonderful hosts and we will definitely go again when we return to Kefalonia! Hopefully next year :)"
2,https://www.tripadvisor.com/Profile/Alison18,September 2019,5,Our favourite day of our holiday,"We had a fantastic day with Antonia and Michalis on board their working fishing boat. We met at 8am and were welcomed with Greek coffee and cake and a chance to chat to the other members of the group. Two couples had taken the trip previously which was a good sign. Having set sail we then watched the 2km of nets being brought in with the opportunity to help if you wanted to. There was a great mixture of fish including red mullet, German fish, scorpion fish, cuttle fish and a slipper lobster. We sailed to a cove only accessible by boat and swam in the clear waters whilst Antonia prepared lunch. A Greek bruschetta laden with fresh vegetables was a tasty appetiser whilst we waited for the main course of seafood spaghetti, a huge platter of the fish caught earlier on and huge bowls of salad all washed down with the family's own wine. Antonia Kindly filleted the fish for those of us who were slightly squeamish about eyes and bones! A platter of fresh fruit finished off the meal before we filed back to the marina at 4pm. At 60 euros per person the day represented great value. We'd book again if we return to Kefalonia.Thank you!"
3,https://www.tripadvisor.com/Profile/Medden30,September 2019,5,Wonderful experience.,"What a wonderful day we had venturing out on the fishing boat. We stopped and pulled in the nets that had been laid that morning. Whilst our food was being cooked we swam in the ocean near a beautiful secluded beach.  Our food was some of the best I have ever eaten on this island and I have eaten lots of good food here. I tried a scorpion fish that we had caught which was very tasty.  The seafood spegetti was awesome.  Home made cake, wine and food along with the most welcoming family that run the trip. I will definitely recommend this day out and return next year. Tip take a snorkel you see lots of fish."
4,https://www.tripadvisor.com/Profile/annablume2014,September 2019,5,Beautiful sail away :),"Antonia and her husband are the most wonderful, heart warming and lovely people you can spend a day on the boat with. We were shown how the fisherman is working daily - collecting the nets , checking the fish and later on throwing it back again in the sea to collect it the next day again!!!! And the best of all , you get to eat the most freshest and delicious fish of your life( for me especially , as I life in a big city far away from the sea).  Antonia is a fantastic cook , so she made sure we were all happy the whole day provided with lots of deliciousness!!! And the whole group was so nice to spend with, getting to know so many different life stories, having a break from your rational brain, relaxing your mind and feeding the soul!!! Thank you Antonia and Michaelis.... you Are the best!!!!"
0,https://www.tripadvisor.com/Profile/grimesters,September 2019,5,Amazing Day ❤❤,"This was our 3rd trip on this working fishing boat and what a wonderful day we had, Antonia and Michalis are fantastic host's and such lovely people,  we were met with Greek coffee and cake at 8am and then set sail to the fishing net's and Magda brought the catch in , there were all kinds of different fish,  we swam in the beautiful blue waters while lunch was prepared,  the food was beautiful,  and the  freshly caught fish was cooked we had a wonderful day and will be coming back again next year, this is a fantastic trip you will not want to miss,  thank you Antonia,  Michalis and Magda we will see you very soon. "
1,https://www.tripadvisor.com/Profile/F120ETphilg,September 2019,5,Amazing boat trip ,Fantastic day once again our 3rd time with michalis and antonia food was amazing as always and the seafood.. Wow... ️️ Highly recommended and we will be back next year 
2,https://www.tripadvisor.com/Profile/helencC7422OU,September 2019,5,❤❤❤❤❤,"So, 3rd time for us on this wonderful day trip on a working fishing boat. We were welcomed aboard with greek coffee and homemade vanilla cake, Mmmmm.  Then, we set sail at 8am to gather the nets that were set the night before. Magda (hope I've spelt it right) reeled in the nets. We caught copious amounts of varieties of fish which were then cooked for us on board whilst we stopped off in a beautiful bay for a jump off the boat into crystal clear waters. Once back on board we enjoyed a starter of bruschetta then onto the fish feast with a massive pan of freshly cooked spaghetti. We were also given wine (grape juice ) and water whenever we needed. Captain Michalis and Antonia were magnificent hosts as always and couldn't have done anymore for us. Once we had eaten we had time for more swimming then set off back to the harbour for 4pm. All in all it was an amazing day as ever and we are back in june and sept 2020 so we shall be booking again. Thank you thank you thank you for another unforgettable day where amazing memories were created once again. Love to you all  I would highly recommend booking this trip you won't be disappointed xx"
3,https://www.tripadvisor.com/Profile/Helste,September 2019,5,Another excellent trip,"We have just been on our third trip with Antonia & Mixalis and it was as excellent as ever.Once on board the boat you are offered coffee and cake to start off your day.You then sail to where the nets have been set the previous night and the catch is pulled in onto the ship.You are able to help getting the fish out of the nets if you wish, or just sit back and relax.Once the nets are in, you sail to a little secluded bay where you have swim time while the catch is prepared for your lunch.The food is obviously as fresh as it can be and delicious, washed down by a lovely white wine produced from the family vineyard.Our third time with this lovely family and we will to return on our next trip to Kefalonia.Beautiful, relaxed day with lovely people, highly recommended."
4,https://www.tripadvisor.com/Profile/wrigleydiggley,September 2019,5,Highlight of our holiday ,"Our trip with Antonia and Michaelis was fantastic.  Great company, amazing food freshly caught and cooked.  Thoroughly recommended to anyone who likes food and fun!  Lobster might even be on the menu if you’re lucky.  Thank you so much. "
0,https://www.tripadvisor.com/Profile/celiao930,September 2019,5,Wonderful day,We had a fantastic day. We Will never forget it thanks to the nice people who made it happen. We recommend this day if you like fishing eating and relaxing. And to learn more about sea life. Love from Stefan and Celia
1,https://www.tripadvisor.com/Profile/eilisWarwickshire,September 2019,5,Amazing day with fabulous food and great company,We have just arrived back fro a wonderful day with Antonia and Michalis on their boat. There were 12 guests - English Italian and Dutch (with a smattering of Columbian and Sri Lankan).We arrived at the boat to be greeted with authentic Greek coffee and homemade cake and set sail towards Dias. The journey was magical watching the sun rise above the mountain. Our first stop was to start drawing in the nets - 2 kilometres worth although Antonia told us that on a standard fishing trip they haul in 12km! The nets had caught all sorts of fish and a few lobsters. When completed we moved on towards Spartia and dropped anchor at a sheltered cove where we could dive or in my case take the steps into the crystal clear water to swim and snorkel. Time for a snack - freshly made Riganado - all the ingredients from Antonias garden. More swimming and chilling whilst lunch was cooked - the smells were fabulous and the end product by far the best fish I have eaten in 25 years on the island all washed down by a very pleasant home made white wine. It truly was a lovely day excellent value for money and we have come away having made new friends and great memories. Thank you Antonia and Michalis J and M xx
2,https://www.tripadvisor.com/Profile/romangodzeus,August 2019,4,Unique experience!,We loved our time on Michaelis fishing boat and it was a real experience seeing trawler fishing in action. Once the nets were up we moored in a cove and went snorkelling whilst the crew prepared the fish and lobster they’d caught. The seafood pasta they served was probably the best we had all holiday!
3,https://www.tripadvisor.com/Profile/Roving620666,August 2019,5,Amazing Trip ,We found this trip via trip advisor and after reading the amazing reviews we decided to book ourselves. I have 2 sons aged 7 & 11... we began by pulling up the nets dropped that day and it was really fun seeing all the different types of fish that had been caught... Antonia kindly explained to us all the different names & levels of poison which my boys really enjoyed. We then anchored at a beautiful spot with crystal clear water where we could swim & dive from the boat - again an amazing experience. The lobster & fish we caught were being cooked meanwhile then we all sat and ate the most DELICIOUS meal of my entire holiday & the BEST lobster i have ever tasted!! ( I am still dreaming of it now ) we drank some wine and by the end of the trip everyone was the best of friends even tho we didn’t speak the same language as the other guests! The trip was about 5 hours 30 mins and the time flew by..  i was slightly worried my sons would get bored but they didn’t and never moaned once (which is incredible in itself ) all in all I would totally recommend spending time with Antonia & Michalis - if we return to Kefalonia they will be top of our list to visit. 
4,https://www.tripadvisor.com/Profile/francescamI4734QL,August 2019,5,Amazing experience! ,"The last 24th August, my husband and I joined the fishing tourism ""Michalis"" and it has been one of the best experiences of all our trip to Kefalonia! The team is very nice and efficient! And the captain is also a very good chef! I definitely recommend this experience! "
0,https://www.tripadvisor.com/Profile/mtbury,August 2019,5,A perfect day,"We (a family including 3 boys aged 2, 7 and 8) organised a private trip with Antonia who picked us up from our cruise ship and took us to the small fishing port 20 minutes away. The children were fascinated by the process of hauling in the nets and the lobsters and fish that were collected. We then went to a small secluded beach and swam in the lovely clear water from the boat to the beach where we built sandcastles while Antonia prepared lunch, which was just excellent, up to the standard of anything we had on the cruise ship.The boys had their first experiences of fishing, free swimming in the sea and eating lobster.All in all it was a perfect day, the highlight of a cruise that was in any case wonderful."
1,https://www.tripadvisor.com/Profile/s_claudiu,August 2019,5,Mr,"Everything was perfect! The seafood lunch, the fishing experience and the crew was perfect. Highly recomended! :)"
2,https://www.tripadvisor.com/Profile/gianfrancoe2018,August 2019,5,BEST FISHING TRIP EVER!!!!!!!!!,"I've been experienced this amazing fishing trip the 12/08/2019 and to be honest there are no words to proper describe such an amazing experience....Andonia ,Michalis and the staff member working with them are fabulous, professional , kind, peoples with big heart!!!!I Travelled all Greece during this holiday and definitely this was the best think i could do....Andonia make a lovely breakfast before to start the tour...About the lunch she cooked the Lobster just caught with pasta and other specialities....tomatoes, veggies and wine home made...(i did like the wine a lot , Andonia knows it..;).... all this while we were having a lovely bath in a water clear as a crystal.... I gave 5 star rating but i would easily give 10....Next year i,ll be there 100%....It's not just a fishing trip, it,s like to be part of a family, so i can say that i,ve got my greek family now...I'll see you soon....LOVE YOU ALLGIANFRANCO"
3,https://www.tripadvisor.com/Profile/Zoetheseasonsvillas,August 2019,5,Highly Recommend,"I can’t say enough about this amazing evening!!! Hands down the best lobster I have ever had in Greece.So, I own a small group of vacation properties on the island. I have always heard amazing reviews of Michali’s Fishing Boat from my guests and decided to give it it a try with a group of friends from the island. I am so happy I did. I highly recommend this to everyone. You will not be disappointed. Andonia and Michalis catered to our every need. Professional courteous and went above and beyond to make our evening cruise memorable. Thank you Andonia and Michalis!"
4,https://www.tripadvisor.com/Profile/RomaPizza,August 2019,5,Amazing experience ,"We had this wonderful experience with Antonia and Michalis on their fishing boat! Fishing fish, crab and lobsters in the morning, a swim in a crystal water, and an amazing lunch with different courses with lobster cooked on the boat fresh just for us as in the best restaurant. The kids loved it and we will never forget!Extremely recommend. "
0,https://www.tripadvisor.com/Profile/LouiseCantrillGodden,August 2019,5,Happy 50th Birthday Little Sister,"I would 100% recommend this trip. The booking was easy to make from England & I was provided with all the necessary information. 11 family & friends arrived at Agia Pelagia for the 17.00 Sunset Trip to a very warm welcome from Antonia who offered Greek coffee & cake.  We set off to collect the catch (which would later appear on our plates) whilst Antonia prepared fabulous bruschetta as an appetiser. We then headed for a quiet bay where we swam, whist our supper was being prepared. Supper was spectacular with freshly homemade veg and salads dishes, the lobster spaghetti was what I had come for and it didn't disappoint. All said it was truly the best lobster they had ever eaten. We ate, drank and laughed the night away until it was time to put the nets back and headed back to  Agia Pelagia, thrilled at our unique outting. A big thank you to Antonia and crew x"
1,https://www.tripadvisor.com/Profile/ghowie82,August 2019,5,Fantastic Evening!,"My husband had booked this trip a few weeks before arriving in Kefalonia.  Antonia had contacted us the day before our trip to advise that the weather would not be good (windy) therefore the trip would need to be cancelled.  Although we were disappointed this shows that saftey of customers comes first regardless of the loss of income to them.To our delight Antonia had arranged the sunset trip for us instead on another day.  We really appreciated the extra hours her and her team members put in for this trip to go ahead.It was a fantastic experience and my 2 boys (age 7 & 11) absolutely loved it. Snorkeling in the sea and dinner at sunset, beautiful!!Dont be worried if you have fussy eating children, Antonia has this covered, she had asked me if the kids would be ok with the food that was served, so no one will go hungry!I have to say the food served on board was amazing!!! The best meal of my holiday from start to finish, the past was the best I've ever had!!!Highly recommend this trip!!!"
2,https://www.tripadvisor.com/Profile/Anna0831,August 2019,5,Wonderful Day,"My second time, my partner's first. Cannot recommend this experience enough. Remember it's not your ordinary excursion it's a a real fishing boat and that is what you are there to experience, which is what makes it so special. We both agree that we ate the best meal of our holiday on this boat.... Which considering the size of the kitchen is absolutely amazing. Antonia & Mikalis thank so much "
3,https://www.tripadvisor.com/Profile/irenedV5934FW,August 2019,5,Great experience,We had a lovely evening at the beginning of August. Mihalis and Antonia was amazing. Ohhhh and the food was delicious!!!The kids reallly enjoyed the diving and the swimming to the secret and private beach!!
