,reviewer_profile,date,rating,title,text
4,https://www.tripadvisor.com/Profile/kpm241,July 2019,5,Fabulous day out!,"We booked this trip with Antonia before we flew out to Kefalonia. She was very quick at replying and very informative about the day. It starts at 8am from Agia Pelagia in Svoronata with coffee, juice and cake freshly baked by Antonia.The sea had been a bit rough for a day or two, so our original trip date was postponed, but Antonia does a great job of rescheduling the trips so we were able to go the next day. Safety an enjoyment of guests is paramount to Antonia and Michalis.We watched nets for the next evening being cast and then the catch for the day was brought in, mainly the nets are for lobster but we also saw hermit crabs, starfish, red mullet and sea bream. Whilst the nets are cleaned you sail to a beautiful clear beach where you can jump from the boat and swim/snorkel. We had an appetiser of bruschetta and 7 day salt cured tuna, then the main event was lobster, spaghetti, Greek salad, potato salad and home made wine. This was our first experience of lobster (myself and 14 year old son) and it was delicious!This is a working fishing boat trip and several guests were not feeling great when out on the open water. Captain Michalis returned to the port to drop these guests off, then we continued for the day as just a group of 4, me, my son and a lovely Italian couple. It was like a private boat trip! My son said it was the best boat trip he had been on (our 3rd different boat trip in Kefalonia). Thank you Antonia, Michalis and crew for a great day. ️"
0,https://www.tripadvisor.com/Profile/a29nina,August 2019,5,Amazing from the minute we stepped on the boat!!,"This was an absolutely fantastic experience and I highly recommend it to all, couples, families, single travellers.  The owners are so friendly and welcoming.  The views sailing out are amazing! We did the sunset trip.  Watching the fisherman bring the nets in with our catch was so cool! Being able to swim in the waters while Antonia prepared our Greek version of bruschetta with Tuna & chilled white wine, before the main event.  The fish that was caught, cooked to perfection with sides of spaghetti, potato salad & Greek salad and lobsters!! Sharing the food and wine with fellow visitors, couples and families was such a great experience.   Star gazing on the boat and trip back in was out of this world! Such a great trip to take & we will definitely being doing it again the next time we visit the island!!"
1,https://www.tripadvisor.com/Profile/VickieH338,August 2019,5,Fantastic day out!,"This is a boat trip with a difference, a working fishing boat and you watch them haul the nets in...all 2.5km of them! Antonia was the perfect host, answering all our questions, providing us with homemade cake and coffee on arrival, tasty bruschetta later on, then cooking the catch of the day. So accommodating for us fussy non sea food eaters too with a delicious chicken and sausage casserole! Stopped in a beautiful spot for swimming and snorkelling and endless jumping off the side of the boat and watching them unraveling their catch from the nets was fascinating, we saw loads of different fish, lobsters, spider crabs and star fish! This really is a great day out for all ages! Thank you Antonia, Michalis and crew! Xx"
2,https://www.tripadvisor.com/Profile/karenpE1951OQ,July 2019,5,A must do when visiting Kefalonia,"I had an amazing day fishing/ swimming and of course eating on this excursion, would do again in a heart beat. Great fun for all ages and the hosts were amazing. I met several people on this trip, and everyone had a great time. Thanks. X"
3,https://www.tripadvisor.com/Profile/Hgjune,July 2019,5,Sunset fishing,Our family (with two boys aged 7 and 10) had a wonderful sunset fishing trip with Antonia and Michalis. This is a unique experience and one of the best things we did in our time on Kefalonia. Antonia made us feel very welcome and provided us with some of the best food we ate during our trip. This is a beautiful fishing boat and a real fishing experience. Highly recommended.
4,https://www.tripadvisor.com/Profile/glynisj2019,July 2019,5,Authentic Greek Fishing Boat Trip,"what a fantastic trip we had today thank you Antonia, Michelis and crew the whole trip from beginning to end was very interesting and informative from being told how the nets would be dropped to the length and lifespan of the lobsters the different species of fish in the area Antonia has so much knowledge and her English language is amazing the meal was amazing but felt a bit sad to be eating Larry ( the lobster) I must say he tested delicious as did the test of the meal and the homemade wine was awesome as I don't usually drink white wine Antonia got some Rose especially for me which was so thoughtful and didn't expect all in all we  thoroughly enjoyed our trip thank you Antonia, Michalis and crew  xx"
0,https://www.tripadvisor.com/Profile/karolinep742,July 2019,5,An authentic and amazing Greek boat trip 🇬🇷,"Hello from the Norwegians.My fiancé Sam and I booked this boat trip as our wedding present to one of our favourite friends :) We wanted to book a whole day trip with authentic Greeks and authentic Greek foods and views. And that is exactly what we got!Antonia, Michalis the boat captain were absolutely amazing hosts and company throughout the whole trip! The trip started with the crew picking up the nets of fish. After that the boat travelled quite a distance to get to a quiet location near a beautiful beach with cliffs and a gorgeous view. We got to swim for a long time around the beach and boat, and the water was so warm and delightful. Then we were served beautiful starters (Greek style bruschetta), and after a while we were served a full main meal consisting of lobster, fish, spaghetti, Greek salad, Greek potato mash and beautiful local white wine. Throughout the whole trip the crew made sure we were informed of all the sights and fun local facts about the island. The crew were really good with mingling with us, but also give us some space to eat and space when needed.The married couple could not have been happier and more pleased with the gift, and kept saying throughout the entire trip how amazing the trip was!We could not have been more thankful, amazed and grateful for the trip, and want to thank the crew once again!We definitely recommend this trip highly! One of the most amazing things to do when visiting Kefalonia All the best and greetings from Norway,Karoline, Sam, Marita and Gunnar "
1,https://www.tripadvisor.com/Profile/stepharena,July 2019,5,A must-do experience!,"A huge thank you to Antonia, Michelis & crew for a wonderful experience last night! My husband and I were on the 'sunset' trip which commenced at 5pm.Antonia was quick to respond to my enquiry (which was very last minute) and gave us all the necessary information promptly.Shortly after departing on the boat, we were treated to delicious cake. We then watched the crew pull in the nets - it was so interesting to see the whole process and watch how it's done! We then stopped for a swim stop in the most beautiful spot. Antonia made us a beautiful appetizer whilst we waited for dinner. Dinner consisted of a FULL table of deliciousness - fish soup, salads, pasta with octopus, prawns and lobsters! After dinner, we had the sweetest watermelon. The crew were all extremelly welcoming & friendly. Antonia also went out of her way to ensure we got back to our hotel safely at the end of the night. We highly recommend this experience!! It's a little different, fun & the food is amazing! Thanks again!!Stephanie & Martin xx"
2,https://www.tripadvisor.com/Profile/DeniseJarrow,July 2019,5,Best day ever,"This was our second trip with Antonia and it was every bit as good as the first. The trip itself is really well organised and because of bad weather we had to reschedule. Antonia kept us fully informed while she rescheduled everyone in trying to make sure everyone could go before the end of there holiday.On the day of the trip we were greeted by Antonia and welcomed on board and coffee and delicious cake is served.We were taken out to sea where we watched nets being cast and then we travelled a little further and watch some nets being brought back. The catch from these nets became our lunch. We then headed to a small bay for a swim in the sea whilst our lunch was cooked.There was plenty of time to relax ,swim and get to know our fellow passengers. Antonia answered any questions we had.The food arrived and to say it was amazing doesn’t do it justice we dined like royalty. I can’t believe so much fantastic food came out of such a small galley. This was a feast not just lunch. If carlsberg did lunches this would be it !!!We then cast some more nets and returned back to the jetty.The day was made extra special by our fellow passengers they were a lovely group even the kids on board were good company especially our new friend Innis !This is a full days trip which I would highly recommend. Antonia and the rest of the crew are very welcoming and more than happy to chat with you and answer any questions you may have. It’s so well organised they make it look easy which I’m sure it’s not. If your looking for a trip that’s a little different then you must try this it’s a brilliant day!!"
3,https://www.tripadvisor.com/Profile/EmmaMack78,July 2019,5,A must do whilst in Kefalonia!,"We had been recommended this fishing boat trip by family and it did not disappoint. A fantastic way to spend the day enjoying the sun, amazing views of the beautiful coastline and a lunch that wouldn’t look out of place at a five star seafood restaurant! Great fun watching the nets being brought in to see what’s for lunch but fear not Antonia has a plan B should the nets be sparse. Lobster is guaranteed! Bring towels and snorkels/goggles as whilst lunch is being prepared they set anchor in a cove for some swimming. We will definitely book up again next time we are in Kefalonia. Thank you to Antonia and her husband Michalis & Hassan for a fantastic trip! Emma & Myles"
4,https://www.tripadvisor.com/Profile/Dodger7569,July 2019,5,Fantastic Day not to be missed,"Our Second trip yesterday, I did ask myself how this can be bettered from last year....But they did and it was just by  keeping it the same.....You are welcomed in such  a way that only Kefalonians know how... From the moment you step onboard you can feel the warmth that everyone truly wants you there and wants you to enjoy the day. I don’t do reviews but felt this certainly needed it and can not recommend high enoughFantastic foodFantastic peopleTreasured MemoriesSee you next year"
0,https://www.tripadvisor.com/Profile/mllrannie,June 2019,5,A Unique Adventure,"Everything we hoped for and more! Gives you a real taste of their lives as fishermen and women. Antonia and Michalis offer a once in a lifetime opportunity to visit, swim and dine whilst seeing the most beautiful parts of the island. Couldn't recommend it more. Annie & Nick"
1,https://www.tripadvisor.com/Profile/andyagar,July 2019,5,Superb fishing day out,"A massive thank you to Captain Michalis, Antonia and Hassan for another wonderful day, This was our 2nd year running we have been on this trip and again we were were not disappointed .Day starts with coffee and cake and followed by a gentle cruise to lay and pick up nets. The fishing was as great as before; followed by a short cruise to a wonderful bay were swimming and snorkelling is a must.Lunch was amazing with Bruschetta and fish soup to start followed by lobster and other sea food all from the earlier catch, all washed down with some local wine.Can’t recommend this trip enough, well worth every single penny."
2,https://www.tripadvisor.com/Profile/Z133QOjulies,July 2019,5,Fantastic boat trip,"Had a fantastic day today on this boat trip! Amazing scenery, amazing fresh caught and cooked seafood and wonderful hosts who take very good care of us and the other guests. Our 2 boys loved it, especially swimming in the beautiful clear water. Would highly recommend this trip if visiting Kefalonia."
3,https://www.tripadvisor.com/Profile/lucyjane2700,July 2019,5,Best trip ever!!,"This fishing trip was definitely one of the best excursions I have ever been on and gave me a real insight into the hard work of a fisherman.As soon as you arrive are you greeted kindly by the crew and made to feel extremely welcome. You are provided with freshly made cake and drinks as you make your way to the nets. Once at the nets you are free to walk around the boat and watch the nets come out from the water and get a first look at the daily catch.All food provided on the day is super fresh and organic and definitely some of the most delicious food I have ever tasted. I would 1000% recommend this trip to anybody, one of the best experiences of my life!!!"
4,https://www.tripadvisor.com/Profile/Yclcu,July 2019,5,Excellent fishing trip,"After reading the reviews our expectations were set high and we were not disappointed, great fishing experience with lovely Greek hosts serving the freshest caught fish, lobster and crab for lunch, even our teenage son was impressed. If you want to try something with an intimate setting, would highly recommend this trip. Thank you for a lovely time xx"
0,https://www.tripadvisor.com/Profile/miladag2019,July 2019,5,The gem of our vacation,"In general, we are not really fans of group activities, this was however very different. You will get to enjoy a day out on the sea where you will witness how the fish you ate at the restaurants during your vacation in Cephalonia ended up on your plate and you will get to try how the really fresh fish taste. This is all accompanied by a very homey atmosphere, all of us 12 visitors were treated more like very cherished friends than tourists.All in all, you can expect a fun relaxing day with snorkeling, learning something new about fishing, laughter and great food! Is there really anything else to wish for?"
1,https://www.tripadvisor.com/Profile/davidhD6869TJ,July 2019,5,"Not just any boat trip, this is special.","Okay, so we’ve all been on boat trips haven’t we? You know the score, they take you somewhere for lunch then take you to a beach for a swim then to return to whence you came at the end of the day!This is not just different, it’s spectacularly different.After arriving in the morning to a warm welcome with freshly baked cake and lovely Greek coffee we set sail.After maybe 45 minutes we arrive and proceed to haul in the nets which have already been placed in situ the previous day.What’s in the nets forms the basis of our lunch. Three kilometres of nets later and we have Grouper, an abundance of lobster and various other things. The crew then proceed to prepare a delicious meal of fish soup, lobster, spaghetti cooked in the lobster water, beautiful fresh salad (all organically grown by Antonia) and whilst this is being prepared Antonia gives us some amazing bruschetta to whet our appetite!After diving off the boat into the beautiful sea, eating the fabulous food we then set sail and lay the nets for the next trip.Bloody brilliant!If you only go on one trip make it this one, for €60 it’s a bargain, it’s worth way more than that for the lobster alone.Thank you Antonia and Michalis, it was a pleasure to meet you and spend a day on your boat.It was interesting, fun and most of all delicious!"
2,https://www.tripadvisor.com/Profile/Zdvarko,July 2019,5,A wonderful expeience,"While our visit was not purely for pleasure, and was oriented more towards familiarising ourselves with the fishing tourism practices in Kefalonia, it still managed to provide a wonderful field trip, where we got to experience everything Michalis, Antonia and Hassan normally offer to tourists. Tourists normally visiting fishing villages and similar places generally don't have the opportunity to see fishing gear in actual operation, so the chance to first-hand experience lifting and setting of gillnets onboard the vessel, and see the daily catch lifted directly from the sea really provides a great experience. This is only improved with the delicious lunch offered on board, prepared straight from the net.All in all, I can only readily recommend this experience to anyone interested in artisanal fishery experience combined with a quality meal."
3,https://www.tripadvisor.com/Profile/Trisherfisher,July 2019,5,Wonderful day at sea!,"We had the most amazing experience a week ago on this little fishing trawler! We were welcomed by Antonia who is the very talented cook of the trip, who was also very informative re wildlife and fishing and beautiful Kefalonia. The nets were hauled in along with plenty of fish and lobster for our delicious lunch! Swimming off the boat in a tiny secluded bay whilst we waited for lunch to be cooked........We would say better than any restaurant fare, it was a true feast a la mer! Then to set the 3km nets again for tomorrows carch before heading home. Such a welcoming, relaxing, genuine  and fascinating experience.....stuff of great memories...thankyou all for a super super day to remember!"
4,https://www.tripadvisor.com/Profile/helbel63,July 2019,5,Day Trip on working fishing boat,"A lovely day trip on a working fishing boat with this hardworking family.  On arrival we had cake and Greek coffee.  Lunch was salads, lobster, soup, spaghetti and bruschetta for appetisers.  Water, wine and juice included.  Stopped off in a little beach alcove for lunch after collecting the nets with our catch for lunch.  Whilst food is prepped you are free to swim from the boat and to shore.  Generous portions and delicious.  Dessert was watermelon and lemon cake although I think they usually only serve fruit.  Everything is freshly caught and grown in their garden.  Wine and olive oil is also made by them.  We drove from Poros, 50 min drive then another 25 mins to port which is not well sign posted from the main road.  We did a recce the day before as it is an early start 8am. Boat takes 12 so no crowds or loud party music.  Antonia is wknowledgeable and quite a character. Photos below of our lunch and location.  Note they collect and drop fishing nets which takes some time but part of the experience.  We returned to Port at 430."
0,https://www.tripadvisor.com/Profile/Trek654679,July 2019,5,An amazing day out well worthwhile ,"A great fantastic day fishing, lovely people, fabulous food, great no matter what age this family run business are kind friendly and have a great sense of humour, nothing is to much trouble, it is also very educational.Have already booked for a second trip. A big thank you to all who made our day very memorable."
1,https://www.tripadvisor.com/Profile/736PaulR,July 2019,5,A real fishing boat experience,"Fishing trips can take many forms. This one is a 22 year old wooden fishing boat that is operating as it always has. The difference is that a few of us can watch it in action, see the days catch - various fish, lobster, crabs etc plus some interest for the children with starfish and sea urchins. While we swim in a secluded bay the crew produce a wonderful combination of appetisers, soups and pasta dishes made from the days catch and washed down with some local and very palatable wine. Great day. Swimming gear a must, snorkelling gear if you use it, but I would also recommend something a little softer to sit on during the trip. The experience is well worth it."
2,https://www.tripadvisor.com/Profile/LisaH2580,July 2019,5,The best day out!,"From the moment you arrive, Antonia & the crew make you feel like friends.Greek coffee & cake are served & then you set sail to the fishing nets.We had a bumper catch of lobster & grouper. If you choose to you can help clean the nets.Then you can swim off the boat whilst lunch is prepared on board. Everything is super fresh. The veggies, olive oil, wine are all produced by the family. We loved every minute. Thank you again Antonia- you're a star ️"
3,https://www.tripadvisor.com/Profile/marymN940HT,June 2019,5,"best day out, best value!!!","This was our 3rd trip on this traditional fishing boat, it is so perfect, if you want to swim you can!! The Captain and the ""family"" make you feel so welcome and relaxed, and everybody makes that ""WOW"" sound when the food is served up, as its fresh fish caught that day with delicious fish soup and a beautiful potato salad, lobster spaghetti and more, i always think i have died and gone to heaven.....Thank you so much for the perfect day, Michalis, Antonia, Hassan and Nicky!!!   Bad news is this... we will be back!! xxxx"
4,https://www.tripadvisor.com/Profile/Companion61117,June 2019,5,Our Favourite Excursion!,"Our family of 6, age 15 months to 74 years had a wonderful day! Antonia, Michalis, and Hassan are such warm people and we felt like family. We enjoyed watching the nets being brought in and learned that Hassan had made them.He also explained the sea life caught in the nets which was very interesting. Swimming was great. We LOVED the food...all homemade with local products of which most were from Antonia’s garden. What  an authentic day. Also want to say Antonia answered my messages quickly. Michalis and Antonia were waiting for us when we got off the ship and we  returned to the ship at our prearranged time.Relax, Enjoy and Eat. It doesn’t get better. Thank you for the memories."
0,https://www.tripadvisor.com/Profile/PragueCourtyard,June 2019,5,Norwegian Star to Fishing Boat,"Unfortunately our time here was limited because of the cruise itinerary.  Regardless this was a great adventure. We are a family of 4, Antonia was a great host. She was waiting for us as our ship docked and did a great job communicating back and forth with us. This trip is a hidden gem. When we arrived, we were treated with Greek coffee, cake, and sweet bread. 45 minutes later we were jumping off the boat, taking videos, and then swimming to XI beach. Next we enjoyed a delicious FEAST. Homemade white wine, bruschetta, lobster, spaghetti, Greek salad, and the best potato salad ever. Antonia my wife wants that potato salad recipe. Look if you want to get off the beaten path, I would highly recommend this. Great husband and wife host and their friend is a great chief. We really enjoyed this and my college kids loved this too."
1,https://www.tripadvisor.com/Profile/Runninggirl27,June 2019,3,Good but could been better.... ,"I feel I have to be honest on my review and looking at the previous 5* reviews unfortunately I don’t agree. Firstly it was great to be aboard a fishing boat seeing how the nets work and then to see the catch of day. Coming from a farmers background this was something we were interested in - seeing where our food came from. We caught lots of lobster and I believe ray. The food on board was lovely and freshly prepared. However we felt that we had to eat the lobster, this was caught that morning on the boat however me and my partner had no intention of eating the lobster. (I know some people may think we were being fussy but this is the only food we’re not keen on - were also weren’t the only ones) and would have declined knowing that all the lobster was being cooked. We would have tried but felt pressured into all the lobster being eaten which then pushed us further into saying no thank you. We enjoyed the bruschetta (best I’ve ever had) and the spaghetti and soup. There is a lot of food provided. Also we did stop for a little swim while lunch was being prepared however just be aware that the boat doesn’t stop on a beach as mentioned in our itinerary. Instead stopping near cliffs. If you not keen on deep water (me) then a life jacket is provided. However I know some people prefer to wade in the water and feel that this is important for people to know. My partner enjoyed his swim. We weren’t sure on rough timings so wasn’t too sure how long we had in the water - we had a long time (2+hours which was a little too long for us). Overall this is a lovely boat trip if you would like to see how the fishing world works. However for us we felt it was a little too long and at times felt we had done wrong by not eating the lobster. Perhaps state to the crew that this isn’t something you want to eat so they can accommodate you. It would have been nice to have been introduced to the crew too. It was nice to see a different part of the island and to be aboard a fishing boat eating freshly cooked food. "
2,https://www.tripadvisor.com/Profile/karenstewart108,June 2019,5,an absolutely perfect day,"we decided to opt for this boat trip after reading great reviews about it, and it didn't disappoint. Antonia is a lovely lady and we were made so welcome from the moment we stepped onto the boat.imagine watching your lunch being caught, and holding the catch (if you choose to) to seeing it being prepared and cooked for you.and better still, we were able to swim when the lunch was cooking.desert was fresh fruit from Antonias gardens, and the wine was home made by her father-in-law.I have done many boat trips in many different countries and have to say this is my favourite trip by far.we will be seeing Antonia and crew next year for sure!"
3,https://www.tripadvisor.com/Profile/StephenT2834,June 2019,5,Michalis fishing tour Svoronata,"Missing the fishing was only a very minor point of yesterday, what mattered was the overall experience which was fantastic. Your culinary delights were exceptional which overwhelmed all desire for fishing, your food quality was outstanding, you provided a spectacular day with glorious food and exceptional people thank you for making a mark in our holiday"
