,reviewer_profile,date,rating,title,text
4,https://www.tripadvisor.com/Profile/grimesters,September 2018,5,Wonderful Day with Beautiful People,"We had a wonderful day on this working fishing boat and are so glad we choose this over a ' normal boat trip 'My husband and our 2 friends were greeted with Greek coffee and homemade cake by Antonia and made to feel very very welcome, it was one of the best day's of holiday, we watched as Hassan brought the nets in full of all different types of fish, the food we ate was beautiful  cooked by Michalis and Hassan  fresh fish , fresh salads , Octopus spaghetti , potato salad,and more, Antonia even made me a seperate batch of one of the dishes as i am allergic to red wine , we had lots of time for swimming also , Antonia, Michalis, Hassan and Nikki thank you for once again you are such beautiful people and Antonia you are so funny I loved your sense of humour, we will be back next year and are already looking forward to another trip with you all."
0,https://www.tripadvisor.com/Profile/Helste,September 2018,5,Fabulous Fishing Trip,"We booked this trip after reading many reviews. We met at 8.00am and boarded the boat.Once we had set sail we were served cake and coffee, which was very nice and a good start to the day.We then travelled to where they had laid their nets the previous night and they started to bring the nets in. Apparently there was 3km of nets that they hauled in.We sat and watched a whole variety of sea life being landed, which was fascinating.Once the nets had been hauled in and all the fish landed, we travelled to a small beach which can only be reached by water. We anchored up and spent time swimming in the sea and relaxing on the beach, while Antonia & Michalis prepared and cooked the fish they had just cooked.The food was served up with wine and was delicious. You can't get fresher!There was then time for another swim if you wanted, before setting back off to the port and home.It was a great day spent with an absolutely gorgeous, friendly family who work so hard to make this a special day.Would definitely recommend this trip if visiting Kefalonia.  "
1,https://www.tripadvisor.com/Profile/sammig30,September 2018,5,Fabulous day at sea,"I am so glad I chose this trip over a normal sunbed filled, packed to the rafters boat trip. Antonia is the loveliest host and greeted me like we had met before. I felt so at ease straight away. The group of people we had on board were so nice and considering language was not easy. This was because I don't speak Russian or Italian, nor Greek for that matter but we all seemed to try and converse. Watching the nets get brought in by hand and all the fishes plus an octopus was so cool and interesting. Watching Mihales tenderize the octopus was fun, beating the life out of it basically but then when eaten was fantastic. The lunch that was prepared for us considering the limited facilities was amazing. The wine was very sweet and lovely to drink. I will definitely do this trip again because I know each time will be different. Thank you to you all, Antonia, Mihales and Hassan. Loved it. Samantha xx"
2,https://www.tripadvisor.com/Profile/helencC7422OU,September 2018,5,a truly unforgettable day,"2nd review as 1st one lost!My husband and 2 friends had the pleasure of going on this trip on Mon 3rd Sept. Antonia and Michalis were fabulous hosts from the moment we stepped on board and I hold a lot of memories from this day. We had a lot of laughs with the other guests and also when I took a 'dive' 1 intentional and the other not so intentional  but the memories will last a lifetime. I loved splashing about in the water with Niki who is an absolute credit to you both. This is a trip on a working fishing boat and Antonia & Michalis prepped some of the days' catch reeled in on 3km of net by Hassain, for a lovely feast. We stopped off for a swim in the crystal waters whilst food was prepped. I would highly recommend this trip.  to you all and THANK YOU again for the memories. Will definitely visit again when we return to Svoronata. love Helen and Steve Clayton xx "
3,https://www.tripadvisor.com/Profile/571AlanC571,September 2018,5,A very special experience,Hi we have just stepped off the boat after an excellent day with great food and great company. Highly recommended. Customer service 5 star.
4,https://www.tripadvisor.com/Profile/lindseytolson51,September 2018,5,Brilliant day,"We loved this trip, amazing day with wonderful freshly caught fish, squid and octopus cooked for lunch. A chance to snorkel and swim in the clearest sea. Antonia and her family are brilliant at what they do. Cant wait to do this trip next year."
0,https://www.tripadvisor.com/Profile/684dani_lleb,September 2018,5,Fishing with Michalis,"One of the most memorable days of our holiday in Kefalonia. Antonia and the crew welcomed us with some greek coffee (not our thing) and some delicious cake. They then took us to their nets and showed us the hard work of a fisherman. After a swim in the sea, they treated us with a great seafood lunch (2 kinds of lobster, seafood spaghetti, 2 kinds of salad and 7 different fishes). Delicious!P.S. Book a day without Italian people (kidding of course, had a great day with Gabrio and the rest)!"
1,https://www.tripadvisor.com/Profile/542phaedral,September 2018,5,The original Greek fishing experience,"It was a totally unique experience!! We saw a greek traditional way of fishing, we swam in the crystal waters of Kefalonia and we ate a delicious lunch that was consisted by fish we caught, about an hour before. Captain Michalis cooked the best spaghetti I had in my whole life, with the ""secret ingredient"" the fresh fish, of course. Also, he fried so many tasty fish, as you can see in the pictures. Furthermore, I'm incapable of finding the right words to describe his wife, Antonia, a very communicative person with excellent knowledge of English language, who taught us a lot about Kefalonia and fishing in general and made us laugh a lot too. Last but not least, their daughter Nicky who will keep the best possible company to the children of the family and she's adorable!! It's a completely amazing experience and the day we joined them was the best day at Kefalonia!"
2,https://www.tripadvisor.com/Profile/951naomih,September 2018,5,Fantastic day out,"Just come back from a fantastic day out. Felt like a real family affair....Antonia was such a great host with a good sense of humour & very informative. Fascinating watching Cassan (probably spelt that wrong....sorry) bringing in the nets. We stopped by a lovely secluded beach where we could swim & snorkel whilst Cassan, Antonia & Michalis prepared our dinner, which was delicious....can't get any fresher. Thank you to you all for making it a day to remember & hugs to Nikki who was adorable.....tell her to remember the stones! "
3,https://www.tripadvisor.com/Profile/zoer367,August 2018,5,Great day out,This was a unique experience......collecting the nets and seeing all the different types of fish including lobster and stingrays.Lots of information given about the catch and area.Antonia was such a pleasure to be around and so helpful- food was fantastic.Thank you all for a lovely time.Zoe x
4,https://www.tripadvisor.com/Profile/PortsmouthCaro,August 2018,5,Fantastic day trip,Highlight of our holiday. Day out on a fishing boat. Watched the nets being drawn in. The lobster and fish were then cooked on the boat for our lunch. Can't get any fresher than that ! Had nice length of time to swim off the boat to an isolated beach to work up an appetite. Wonderful home cooking. Small group of about ten in total. Really very friendly family. Highly recommended.
0,https://www.tripadvisor.com/Profile/mattesafa9111,August 2018,5,Great experience,"Experience to do absolutely! Antonia very nice and helpful person for everything, great food and company!"
1,https://www.tripadvisor.com/Profile/ianf911,September 2018,5,Surely the best way to spend your final day on Kefalonia,"After spending lots of time emailing with Antonia we finally got the booking we wanted on our last day. I had wanted to go on this trip well before our holiday but it took a while to convince everyone.We all had a great time starting with the orange cake through to the very drinkable wine. We cannot recommend this trip high enough. We finished the day tired, sun kissed and full of lobster what's not to like.Thank you to Antonia and co lots for the success of the day you are offering a great experience.I nearly forgot to add we also had the best meal we had on Kefalonia though the best part of the meal still ranges between the lobster, the spaghetti or the tomato salad but that is a family discussion."
2,https://www.tripadvisor.com/Profile/SWFUk,August 2018,4,"Well this was different.,,","We travelled on this trip at 5pm....yesterday.....I think if you are looking for a fishing trip then you need to do the morning trip!! Saying that ...it was great the kids could see the putting out of 6km of nets!! Ready for the mornings trip catch....It seemed a long labourious task that Captain Mihalis and Hassan  did with ease. It made us laugh as there were lots of seaweed relics in the nets. The whole trip was made a lot more bearable by three very lovely ladies that joined us on this trip, and they thankfully  supervised the children when they went for a swim from the boat...unfortunately my husband and I due to arthritis could not manage to get out of the boat to swim, neither can my daughter who has injuries to her foot. The children both age 9 swam beautifully from the boat and back  to the boat.  Finally Antonia cooked the most beautiful meal ever.... the lobster was massive and plentiful salads were gorgeous and I don’t know the name of the bread with tomatoes cucumbers and everything else traditional Greek dish was fabulous.  Antonia even provided the children with spaghetti some plain as we have a very fussy eater! All washed down by what Antonia called Grape juice ! It was lovely we all enjoyed ourselves..... thank you all very very much ...we got back to the port around 10 o’clock and the kids were exhausted and fell asleep,n the way back in the car "
3,https://www.tripadvisor.com/Profile/386katherinas,July 2018,5,This was the highlight of our trip,"We travel to Kefalonia yearly.  This time we were hosting family from New York and wanted to do something different. Captain Mihalis, Antonia, and Hassan made this outing the highlight of our trip.  We enjoyed swimming while they prepared an amazing meal from the catch of the day.  This is what it's all about: family, food, and amazing memories.I highly recommend booking this trip."
4,https://www.tripadvisor.com/Profile/davidriggs32,August 2018,5,Michaelis fishing trip,"What a fantastic day,thanks to the Captain,the Fisherman and Antonia.Lobster pasta was the 'best'Special thanks to Antonia who collected and returned us.Once again great trip.David Riggs"
0,https://www.tripadvisor.com/Profile/Fleaflyflo,August 2018,5,Best day of our holiday!,"Spending a holiday in Svoronata we looked into the boat trip here and emailed to pre-book-it was the best decision of our holiday! The most welcoming of hosts, superb company and gorgeous food together with swimming off the boat made this an idyllic day. This trip was worth every penny and if we’d had time we would have gone again the next day. During our trip our hosts were disappointed by the size of the day’s catch and seemed genuinely upset that they would be letting us down. Nothing could be further from the truth, the food cooked by Antonia and wine were plentiful and delicious. I cannot recommend this trip more highly, thank you all for a truly memorable day Lisa, Andy and Emma"
1,https://www.tripadvisor.com/Profile/cow182,August 2018,5,Michalis fishing boat trip! ,"What an amazing day! So much more interesting than the usual boat trips, I would highly recommend. We were served with coffee and delicious home made cake whilst we made our way out to the nets. Everyone had such fun watching the nets come in with all sorts of creatures including some massive lobster! A real fascinating insight into the daily life of a real fishing boat. After bringing in the catch we swam in the sea whilst an amazing meal was cooked for us. Delicious lobster, bruschetta, spaghetti and he best potato salad I’ve ever tasted.Our hosts were fantastic, friendly, informative and great cooks! Thank you so much and hope to see you in the future! Good luck with swordfish season! Nick, April & Zac!"
2,https://www.tripadvisor.com/Profile/Nickss1971,August 2018,5,Authentic Greek Fishing Boat!,"We went out with the lovely Antonia and her skipper husband and had a wonderful afternoon and evening. It’s a truly authentic experience with lovely fresh fish cooked on the boat, casting of professional nets, line fishing, and swimming in the beautiful crystal blue sea. Highly recommended and great value too!"
3,https://www.tripadvisor.com/Profile/FarAway809922,August 2018,5,Another great day,"This was our second trip and we once again enjoyed a great day with great food, company and scenery.Well done!"
4,https://www.tripadvisor.com/Profile/885jacquiep,August 2018,5,What an amazing day,Came to kefalonia with 11 others so we had the boat to ourselves. Some of the others had done this before and said it was the best day of their holiday - well I can see why. Felt very welcome from the start. Lovely cake and coffee to welcome us on board. A day of relaxing and amazing food cooked fresh from their catch with swimming and snorkeling off a lovely beach thrown in along with some lovely wine. Could not recommend this day enough 
0,https://www.tripadvisor.com/Profile/LauraM13162,August 2018,5,Fantastic authentic greek boat trip,"Family of three enjoyed the day on Michalis enjoying sun, sea food and splashing around in the sea. The food was great and can't fault all of our hosts including their encouragement when our young lad was reluctant to jump from the boat....he was so pleased with himself when he did. Thanks again to you all we had a fantastic time."
1,https://www.tripadvisor.com/Profile/StampingthePassport,August 2018,5,What a Day!,"Mixalis, Antonia and their lovely daughter Nikki were the best hosts. Not only did we have so much fun eating and swimming in the best places that Kefalonia offers, but we learnt so much - from the Greek language all the way to species of fish and how to cook them perfectly. You feel like one big happy family by the end of the trip and it is the perfect way to see a different side of Kefalonia and of Greece. Fishing is such an important part of life in this part of the world and why not experience it with the best. Thank you Fishing Tourism Kefalonia 'Michalis' for letting us share a fantastic day with us."
2,https://www.tripadvisor.com/Profile/952lindav,August 2018,5,Fantastic,"Cannot praise Antonia, Michalis and Hassan enough. Fantastic trip. Really enjoyed the day. So informative. The meal provided from our catch was absolutely delicious. Great company added enjoyment to the trip. Would highly recommend this fun day out."
3,https://www.tripadvisor.com/Profile/perryfra,August 2018,5,Best experience ever!!,"Antonia is a delicious person, so kind and so sweet: she came to peek us up early in the morning because we were a little bit far from the port! The day started with an amazing slice of cake cooked by herself and continued with a lot of great food and mostly important with a lot of fun! The company was great, we enjoyed the day so much from the first minute to the last.The beach we saw was incredible, we dived and swam all day. And lastly, I’m Italian and I can tell that the spaghetti that Michaelis and Antonia Made were simply PERFECT. Most beautiful day in Cefalonia.Thank you thank you thank you! "
4,https://www.tripadvisor.com/Profile/798tabitas,August 2018,5,Great time with great people in Kefalonia,"We just got back from our trip to Kefalonia,  where we had a wonderful time. We spent our last day in the island on the boat with Antonia and Michalis. We also got to know some very friendly Italians who happened to be our companions on the trip that day. It was a wonderful day. Not only did we enjoy a great, relaxing time and absolutely delicious, fresh food cooked on the boat, but we also got to see how much hardwork the profession of a fisherman implies. Also, Antonia was extremely kind and she even offered to give us a ride from and back to our accommodations, as we had to give our rented car back a day before the trip. We thank you for the beautiful day you gave us, Antonia and Michalis! Very recommended! "
0,https://www.tripadvisor.com/Profile/Afoz,July 2018,5,Fantastic Day out ! ,"We took the fishing tour with our two children (11 and 13) it was an early start. Antonio very kindly picked us up at 7.40 as we were in Svoronata. The day started with drinks and sailing out to put out the nets and to bring in the nets for the days catch. We couldn’t believe our eyes - huge crabs, lobster, star fish and a scorpion fish. We stopped at Pessada Beach to swim, which was just beautiful whilst Antonio and Michaelis made lunch with the fresh catch. We ate salad, potato salad, lobsters, crab and lobster spaghetti. It was the best food I’d tasted. It was a brilliant day - I’d definitely recommend it to anyone coming to visit Kefalonia! "
1,https://www.tripadvisor.com/Profile/sparksy171,July 2018,1,The trip that never was,"I arranged a trip while in uk when we got there was told they was not going out so we rebooked and then was told the day before there was going to be bad weather,let me just say I am a seasoned fisherman from Grimsby,and the weather was perfect hardly any wind i just think they overbooked people which is a shame because I was really looking forward to this trip."
2,https://www.tripadvisor.com/Profile/timmythesheep,August 2018,5,Fantastic evening trip,"We spent a wonderful late afternoon and evening with Antonia and the crew of Michalis. Heading out of the harbour, east along the coastline we enjoyed the fresh breeze and the beautiful views of the mountains. Having placed their lobster nets, we then sailed to Spartia beach and had some time to swim in the clear turquoise sea while Antonia prepared dinner. What a treat- succulent fresh lobster, spaghetti and salads served with delicious local wine. Having stuffed ourselves silly, we enjoyed a beautiful sunset as we sailed back home. A fabulous experience that I would recommend. Antonia is a kind and helpful hostess, who made us very very welcome and cared for. I would recommend+++"
3,https://www.tripadvisor.com/Profile/Just_me76,July 2018,5,Amazing day trip,"What a fantastic day we had! Started in Agia Pelagia around 8am, coffee and fresh home baked cake soon after leaving the port, then set the new net and went to pick up the already set one which had quite a few lobsters! Set off to Pessada where we stopped for a swim while Antonia and her husband were preparing the fresh catch. We had an amazing meal and left around 15:30.Antonia and her husband are lovely and very knowledgeable about fishing and the area. Their fishing is environmentally friendly, all the small catch is thrown back and they don't fish more than they need.A lovely day with a lovely family, certainly the highlight of our holiday!"
4,https://www.tripadvisor.com/Profile/Watsons2014,July 2018,5,Amazing Experience,"A big heartfelt thank you to Michalis, Antonia & all onboard for your fantastic hospitality & an amazing day out, it was one of the best trips we have experienced.  We really enjoyed the fishing experience & fabulous tasty food onboard."
0,https://www.tripadvisor.com/Profile/DeniseJarrow,July 2018,5,Simply the best fishing trip ever !!,This is a brilliant fishing trip. Our hosts were very nice and welcomed us on board serving delicious food throughout the day and showing us a fisherman’s typical working day. From casting the nets to bringing in the catch it’s fascinating. Then a stop off to swim in the sea whilst our catch was cooked. Can’t recommend this enough we will certainly be back next year. Thank you Antonia you have helped us create some lovely memories!
1,https://www.tripadvisor.com/Profile/46danilo29,July 2018,5,Fishing tourism day,"Yesterday a wonderful day on the boat of Michalis and Antonia, despite a bit of fog in Pessada to be framed among the most beautiful memories of Kefalonia.I want to thank Antonia and Michalis with all my heart for having introduced us, through the fun, the true life of the fishermen made of hard work and sacrifices and often not sufficiently compensated as they deserve.An experience to try absolutely"
2,https://www.tripadvisor.com/Profile/798williamr,July 2018,5,The best fishing trip ever,"My friends Alina & Debbie booked this trip as a surprise for me. Boy, what a surprise.  We arrived at the quay at 8am to very warm reception.  We boarded almost immediately and were served Greek coffee and home made sponge cake, delicious. Once all the guests, I think they have a maximum of 10 on a trip, arrived we set off to place fresh nets. Once this was done, it took about 20 minutes, we moved on to recovery the previous days nets. Once the hauling process began much to my surprise a lobster appeared! In fact on that day the majority of the catch was rock lobsters - see picture. It took a fair amount of time to complete the hauling exercise but every minute was exciting as you didn’t know what would appear. All undersized fish and sea creatures were immediately returned to the ocean to continue to grow and preserve stocks. Once the process was complete we headed off to a quiet bay for swimming and relaxing whilst Antonia and the crew prepared our lunch. The lunch consisted of bruschetta followed by lobster, spaghetti cooked with the pan juices of the lobster etc. Greek and potatoes salad was plentiful plus white wine, water and soft drinks. After a good rest we could resume swimming or in my case I enjoyed a quiet nap. We returned to the harbour at around 4 pm throughly satisfied having been entertained royally by a wonderful family.   a splendid unique day out for all the family. "
3,https://www.tripadvisor.com/Profile/laurenjessicankkm,July 2018,5,The best day!!!,"So today has been the most incredible day with Antonia and the rest of the crew! We were collected from our hotel and brought down to the harbour and taken onto the boat by Antonia for homemade cake and coffee. We literally have had the most amazing time being taken out to place the nets for the next 2 days catch.. then to go and collect the nets set beforehand for our lunch!  We waited in anticipation for the catch to be pulled in and couldn’t have been more excited to see lobsters and spider crabs come aboard!!  While we were taken to a gorgeous bay To swim and relax in the beautiful settings, antonia prepared the the most incredible lunch. Freshly prepared bruschetta on the tastiest bread to start, and then to be served with the most amazing seafood spread with spaghetti , potatoes and salad!!  Water was crystal clear, fish and lobster was so fresh and tasty And i genuinely cannot recommend this trip enough!! Antonia, her husband and the amazing fisherman who brought in the catch were all a pleasure to meet and spend the day with! If youre unsure whether to book- do it!! :D"
4,https://www.tripadvisor.com/Profile/crismis2015,July 2018,5,"Fun, perfect, and delicious!","What an amazing experience to see how fish gets picked up early morning, and then to have a wonderful meal with the freshest of ingredients. I cannot say enough about the kindness of the staff especially Antonia, so welcoming and friendly, always making sure the group was happy. We ate so much fish, and her spaghetti were just cooked perfect, the staff is so kind. We went for the best swimming and had lots and lots of fun meeting new friends.I would most definitely recommend anyone to sign up for the day trip, you will have an amazing time!!!!!!Thank you so much, for making our vacation extra special!"
0,https://www.tripadvisor.com/Profile/RosemaryW25,July 2018,5,Outstanding Day Out!,"I found this outstanding value for my group of three. So Helpful when we had an issue with hire car they arranged to collect us and bring us home afterwards. The Luncheon provided was  incredible the most extravagant lobster and Seafood Fest you could wish for  including two sorts of Lobster ,Red Mullet!!! and many amazing starters ,side salads. Do not know how they do it at the price! I would highly recommend it . appreciated the amazing old carvel hull Fishing Vessel hand built by owner family over period of two years"
1,https://www.tripadvisor.com/Profile/jonirosie,June 2018,5,Do something different!,"A great day out with a lovely crew, great food and great company.Thank you for a fabulous trip.Best wishes, Jon, Nicola & Rosie."
2,https://www.tripadvisor.com/Profile/S8042NNmandyb,June 2018,5,OMG ! What a great day out.,"In our opinion this trip out is a must do. From start to finish were made to feel welcome, and within 30 minutes of boarding the boat, we felt that we were with friends that we had known all along. Antonia and Michalis, and their lovely daughter Nikki who also joined us, were superb hosts, and our lunch consisted of our ""catch"" for the day - lobsters - with home grown veg and home-made wine!. It happened to be my birthday, and turned out to be one of the most memorable I have ever had. We even had cake. What a lovely personal touch. Thank you Antonia and Michalis"
