,reviewer_profile,date,rating,title,text
1,https://www.tripadvisor.com/Profile/matgaudreau,June 2019,5,A must do trip,"First of all, the Captain, Giorgios, is one of the most friendly person I've met. When we arrived, he offered us coffee and biscuits made by his mother-in-law, who does the cooking in the shop. He will also talk to you like you are one of his best friend and it makes the experience very special and intimate. The ship is extremely clean and it's easy of access. It has a toilet, a couple of benches and you can also go in the front next to the Captain's cabin to sunbathe. The experience is a thing you have to live if you go to zakynthos. Giorgios will explain the process of fishing with nets, the type of fish you will catch and tell you fishing stories. The two places we go swimming are incredible. You will see fishes if you have water goggles and the water is very clear and warm. Finally, you will eat a very good dinner,made by the Captain's mother-in-law, composed of the fishes you caught and many other things. "
2,https://www.tripadvisor.com/Profile/christina1zeri,June 2019,5,A joyful day at sea,"Great experience!!!  Getting fish out of the nets is such a fun! The greek flair at sea. Captain George - a higly skilled sailor, his mother in law -the best cook ever- and Sadik will make your day. Dont miss it."
3,https://www.tripadvisor.com/Profile/elenik929,June 2019,5,oceanographic research and experimental fisheries ,"Very well organized fishing boat for oceanographic research and experimental fisheries. Excellent service, very friendly atmosphere onboard the boat as well."
4,https://www.tripadvisor.com/Profile/argiro2015,June 2019,5,Perfect trip,HCMR scientists are cruising with F/V Panagia and captain Giorgos investigating #plastic #pollution at Zakunthos waters within the framework of the INTERREG-MED #PlasticBastersMPAs project
0,https://www.tripadvisor.com/Profile/LuteH1,May 2019,5,Best fishing experience with Captain Giorgios. ,"Friendly Captain Giorgios and his family members, excellent fresh seafood lunch and unforgettable experience. It is a good way for you to know how to fishing on the sea. Sometimes you could find the seal and turtles in good season. 友好的船长和他的家人，丰盛美味的海鲜午餐，很难忘的一次体验。近距离体验当地渔民的生活，还可以在清澈见底的海里游泳。"
1,https://www.tripadvisor.com/Profile/MorrisonJo,May 2019,5,Fantastic day out,"Zante fishing tours is an early start but well worth it Georgio the captain is an excellent host and the small group of 12 made it more interesting You will see and learn traditional methods of fishing in Zakynthos and the lunch of spaghetti and squid ,homemade bread Local Wine and fried fish which had just been caught can only be described as a feast Highly recommended Johnny"
2,https://www.tripadvisor.com/Profile/rachelpJ1283WW,May 2019,5,THE best day of our holiday!,"Its an early start, but so worth it. With only 12 passengers it was a very intimate and interesting trip. Giorgio was so friendly and makes everyone feel very welcome as soon as you get on board. You can have as much ‘hands on’ experience as you wish, helping to put nets in and out, taking fish out of the nets etc. Then relax in the sea for a swim before lunch is served. Fresh pasta, fish, salad and wine. Beautiful! All in all a truly unique fishing experience! THANK YOU! Giorgio and team for a very memorable day"
3,https://www.tripadvisor.com/Profile/tomlA1824ZU,September 2018,5,Great trip,Loved the trip with George and the crew!Got the 7.30 start and was well worth it Had multiple swimming stops and even cooked seafood that was caught along the trip! A must do day trip for everyone involved! Cheers George 
4,https://www.tripadvisor.com/Profile/billywood2404,September 2018,5,Excellent Day out on the sea,"If you fancy a change from sunbathing and doing something a little bit different, I would recommend you try this trip with Captain Georgios and his crew, Set sail from Zante Town about 07.30 sail for approx 1 hr then put the nets in, move closer to the shore have some breakfast / refreshments then set sail to pick the nets up then watch Gergios and his crew land the fish, then some are cooked aboard and served with spaghetti / rice local wine / local beers, fruit. Lovely day out and a stop for swimming / relaxing. 5 star day out"
0,https://www.tripadvisor.com/Profile/sueh812018,September 2018,5,Fantastic fishing trip!,"I visited Zante for a two week holiday, I love fishing and this trip was brilliant and well worth the money. Would highly recommend and the food was great too as we caught it ourselves Geoffrey Hardware"
1,https://www.tripadvisor.com/Profile/Dina240,September 2018,5,"Fishing, food & fun!!","This day out with the lovely Captain Giorgos and his crew was well worth getting up early for!  We watched the sunrise as we headed out to sea from Zante Town at 7.30am.  After the nets were cast we headed for a lovely, secluded beach only accessible by boat or bike for swimming and free time, then back to haul in the catch which we subsequently stuffed our faces with over a lovely lunch set up on board with wine, beer and charming conversation with Giorgos.  On the return journey we sunbathed and had a few more drinks ... bliss!!  We went on this trip as a group of 12 friends and it's quite a unique day out as far as boat trips in Zakynthos go.  It's safe to say that after we recovered from the early start we all had a brilliant time.   Thanks Giorgos and crew for looking after us and for a wonderful day out on the water! XX"
2,https://www.tripadvisor.com/Profile/emilykatewoods,September 2018,5,This was a ripper tour!,"Friendly and informative captain, Giorgos. Enjoyable net-fishing experience followed by a sumptuous buffet on board (which included our catch of red mullet - delicious!).Also included swimming stops and a beach stop. A top-value experience not to be missed! Would definitely recommend - Tom and Trish"
3,https://www.tripadvisor.com/Profile/CMcPW,August 2018,5,Best trip of the holiday,"Giorgos is one the nicest Greek Sea Captains I’ve ever come across – it doesn’t count that I haven’t met another before!I had seen the trip on Facebook and really fancied it.  If you do the trip as a private large group booking, it is fantastic value for money!Giorgos is very helpful in accommodating everyone’s needs on board, we booked as a group of 11 of all ages and abilities and the trip was fantastic from start to finish.We were a bit dubious about stepping on board a fishing boat and imagined all sorts!  How very pleasantly surprised we all were.  The boat looks brand new!  It is so clean and tidy you would think it was someone’s home!The crew Giorgos, Sadek & Vaso look after you like you are family, it really is 5 star treatment!The food on board was by far the best meal of our whole vacation!  We had fresh baked traditional pastries, fresh fruits, Greek coffee, fruit juices, salad, olive oil, calamari spaghetti, freshly caught fish, bruschetta and wine – ALL homemade and simply delicious!  SO much food was available; they do NOT let you go hungry (this was a concern of mine and I always carry snacks).Vaso prepares all the food and drink on board and keeps it all flowing whilst keeping  on top of cleaning the boat, the slightest drip is soon cleaned up.Sadek is a professional fisherman and knows his stuff; he showed my son all the fish they caught and let him help get them off the nets and hold them.Giorgos is a fantastic, fisherman, captain and friend.  He is full of information about the local island and surrounding areas.  His personal background is very interesting and he is very knowledgeable.We snorkelled, swam and dived off the boat and we all thoroughly enjoyed it!  The fish you see in the beautiful spots he takes you to are breath taking.  We even saw a family of seals!  The little private beach is beautiful and they will supply you with dry boxes to put your stuff in when you swim out to keep your phone, towels etc. dry.The fishing part was a little rocky for me – I had to lie down whilst the nets were put down and pulled back in.  I also felt a little rocky for a day or 2 but that has not put me off and I will definitely return on Giorgos boat next year when we return.  The rest of our party on board were fine (I must be a light weight).If you forget anything on board, I’m sure Giorgos will help you out, he leant us dive masks and floats and I also charged my phone up whilst on board.There is a shower and toilet to use, which like the rest of the boat is spotlessly clean!If you have any questions at all get in touch with Giorgos and ask, he is very helpful!An absolutely fantastic trip, comes highly recommended and a must do whilst visiting the island of Zante!"
4,https://www.tripadvisor.com/Profile/davesooty69,September 2018,5,Zante  fishing,Wow what can i say about this trip.just an amazing  experience  fishing the old traditional  way.you leave zante harbour  7.30 am traveling  out in the boat for a  round 90 min then the anchor  goes in and you then start putting  the nets  in this takes around 90 min .you then go too a lovely  quiet  beach for around 2 hr too snorkel  or just have a few beers in the bar there.them you head back too the nets and bring them in which takes about 1hr .watching  the nets coming in with fish we even  had a octopus. Then it's food time all made with the fresh catch of the day.a few beers and wine too wash it down.then head back too zante  harbour  arriving around 4.00 pm .was a fantastic experience 
0,https://www.tripadvisor.com/Profile/MichaelJ6137,August 2018,5,value for money,"leaving zante harbour at 07.15 we sailed for about 90 mins Captain George was keeping us entertained and well informed on every aspect of traditional Greek fishing accompanied by coffee and homemade very tasty cookies.We then all took part in casting the nets these were about 1000 metres in length,this done we headed for 2 seperate very private quiet beaches for a couple of hours snorkeling(gear provided)we then sailed back to the nets hauling them in all the guests help take the fish fromthe nets thes were cooked and along with salad kalamari and rice local wine fruit juice water we all ate as much delicious fish as we could,a wonderful day,MIKE"
1,https://www.tripadvisor.com/Profile/Dunena90,September 2018,5,"Fishing, swimming and 1st class hospitality","This is a must do day out when at this beautiful Greek island. With a maximum of 12 persons allowed a trip you get 5* treatment with plenty of room. We meet the crew first thing. Set sail and cast out the nets. They cruised around the beautiful coast to private bay for a swim and short break. We then returned to bring the nets in for our lunch .Went for a another swim whilst our large feast was prepared. Fresh fish, fresh spaghetti with squid, fresh salad with organic vegetables grew in the captains own garden. To top it of we had wine also made by the captain.  Highly recommend "
2,https://www.tripadvisor.com/Profile/carolinelespapillons,September 2018,5,Best trip in zante,Amazing trip. If you don't do this tripthen you're miss g a trip of a life time. George is a super captain and guide. His mother in law is an amazing cook
3,https://www.tripadvisor.com/Profile/kimsD2879PJ,July 2018,5,"Excellent day out, authentic and friendly","My husband and I always said we'd never go back to the same place twice, but we're going to break our own rule and go back again, to experience this trip again. A fabulous day with excellent hosts, fishing, swimming, eating the catch, washed down with local wine - my idea of heaven. The group's are small enough to be friendly and are really authentic unlike many of the other touristy boat trips. Definitely a 10/10. "
4,https://www.tripadvisor.com/Profile/Arvnev,August 2018,5,Amazing,"Had a real fun time with Mr. G and his nice crew. An authenthic Catch and cook experience, would do it again."
0,https://www.tripadvisor.com/Profile/awgy,August 2018,5,Fisherman's Friends,Definitely the best day trip in Zakynthos!We had to get up really early to get our transfer from Vasilikos to the Zante Harbour which was kind of hard for the kids. But what we experienced this day was definitely worth it! The Captain and his friendly crew offered delicious greek coffee and fruit juice. So we enjoyed the morning sun while the authentic and very tidy boat took us out to the fishing ground where we could help throwing out the nets. After a nice stop to swim and relax in the blue waters of a quiet cove we went back to see if we were lucky - and yes it was more than enough for a delicious lunch on the boat with homemade wine and a lot of talking and laughing and (again) swimming in the sea... By the end of the day we knew a lot more about fishing and local life and best of all - we made friends! Thanks a lot Giorgos for that day!
1,https://www.tripadvisor.com/Profile/433ethand,June 2018,5,Absolutely amazing day out,"This trip is by far one of the best trips I’ve done in my life.loved the trip from start to end, you get to see a lot of places and learn insider knowledge of fishing in Zante.the Captain  is amazing really friendly,all the crew are welcoming. After you catch your fish the cook on board prepares an amazing meal.I don’t usually like fish but this fish was amazing.definitely recommend this to everyone ignore the price and just book it. Well worth it."
2,https://www.tripadvisor.com/Profile/alizh3,August 2018,5,Authentic fishing,"We spent two weeks on the island of Zakynthos and this program was by far the best of all those we took part in, We got to know  a little bit of the real Zakynthos though our captain and his crew. Away from the crowd we could spend a day with friendly company and learnt a lot about fishing. Without this trip our holiday would have been less fun, and I also have to mention that for such a price it was well worth it.András, Hungary"
3,https://www.tripadvisor.com/Profile/AlizHorvath,August 2018,5,Fishing in Zakynthos,"Our family ( two kids, 10 and 13) spent an unforgettable day on ship Panagia in August 2018. Captain Giorgos Nikolatos showed us everything concerning fishing with a net, and he answered our numerous questions with pleasure. We had the best sea food lunch of our life, it was cooked on the ship from the catch of the day, and it was super delicious. Kids loved every minute of the day, especially when they could jump into the water from the ship. We also tried to help with taking the fish out of the net -  pretty tricky, almost like solving a puzzle :)). The ship was perfectly clean, shiny white, so even as a guest we felt very comfortable. I highly recommend this trip to anyone interested in fishing, or for those  who would like to get a little bit deeper knowledge of the place, or the life of Zakynthian people.Aliz from Hungary"
4,https://www.tripadvisor.com/Profile/car0line63,August 2018,5,Zante fishing tours ,"This was one of the highlights of my holiday. It was such a unique experience I will never forget. My friend and I had sole attention of the crew who are a family run enterprise. We started out at sunrise and after a while helped to let down the nets,leaving them for a few hours we swam to Porto Roma for a drink and stroll on the beach. When it was time we hauled in the catch and sat down to eat the lovely feast cooked by Giorgios mother in law. Very happy memories to take home,I highly recommend to anyone looking for something out of the ordinary, thank you ️"
0,https://www.tripadvisor.com/Profile/andym452,August 2018,5,Fantastic trip,"This isan experience of a lifetime. We left zante Harbour while the sun was rising and then we stopped to put the fishing nets in the water then we had sone melon and drinks. Then we left the netd behind to go and have a swim at a beautiful secluded beach for a few hours. Then back to the nets to pull them back on board. A very successful catch too with a variety of fish caught including an octopus and a sponge. Then we sailed to another beach for a swim while the fish was prepared on board with wine spaghetti and bread. Absolutely beautiful meal. Giorgos the captain has a great sense of humour and lets you get involved in everything and if you're lucky he might let you stear the boat. Very clean and hygienic which i didn't expect. Couldn't recommend anymore, dont miss out!"
