,reviewer_profile,date,rating,title,text
0,https://www.tripadvisor.com/Profile/V8804UJcatherinet,June 2020,5,Best service by the best captain!,"The cruise was great, the boat absolutely clean, the crew very warm and friendly, the food amazing and the fishing very professional! We performed a succesfull scientific research expedition witth Giorgos boat!"
1,https://www.tripadvisor.com/Profile/TravelEU1983,June 2020,5,Booked 2 trips in the same week!!!!!!!!,"Something I will never forget. At the begging I was not very happy with the idea of my husband to do this excursion.The result after the first trip was to book myself another trip as anniversary gift for my husband.Friendly crew, spottless clean boat, excellent cooked dinner from day’s catch accompanied with various local delicacies!!! Thank you captain George for such an amazing experience!! Definitely we will visit you again."
2,https://www.tripadvisor.com/Profile/_W799IE,August 2020,5,Fishing at it's best!!,"Speechless of the experience...The best day of our holidays. Suggested for everyone.From early the morning until late the afternoon, was a great day with my family out in the sea.Crew is very friendly and make you feel comfortable every minute onboard!"
3,https://www.tripadvisor.com/Profile/popArg812,July 2020,5,Amazing experience,"Amazing day!! Everything was perfect...The fishing techniques, the food, the crew were 100% better than expected... Definitely do it again ,when back in Zante. Thank you cpt.Giorgo for such a unique experience."
4,https://www.tripadvisor.com/Profile/OpelG,August 2020,5,Highly recommented for everyone!!,"This excursion was the highlight of our holidays!!I am not so familiar with fishing and to be honest i am not a great fan, BUT i loved this excursion! HIGHLY recommended for everyone. Thank you Giorgos for such a nice day out in the sea.We will visit you again..."
0,https://www.tripadvisor.com/Profile/tomlA1824ZU,September 2020,5,Great day ,Amazing tour in zante 100% recommend George and the crew are amazing!! We went early morning and spend the day sea fishing and stopped at swimming spots. Eat fresh fish on board and stopped at a cafe by the sea 
1,https://www.tripadvisor.com/Profile/BillyW854,July 2020,5,Day with a difference,"A fantastic day out with a difference, sail with the fishermen, watch how they catch fish, take in a couple of stops for swimming and relaxing then the crew cook what they catch and feed you delicious Ionian cuisine, excellent day out well worth it if you fancy a change from the pool or beach. Highly recommended"
2,https://www.tripadvisor.com/Profile/Wbilling,September 2020,5,Best ever boat trip.,"When we went I was a bit sceptical about it, thinking I have been on fishing trips before but this was completely different. There was 6 of us another group were unable to go at the last minute. Luckily enough I wrong about it and we had one of the best trips ever. The boat is a proper working  fishing boat with with all the nets. So he actually puts out the nets takes you to various place to view and swim then returns a few hours later to bring in the nets {they were a cple of kilometres long}. You then have your diner with the fresh fish. I am not really a fish eater, I am now it was fabulous. All of us had a fantastic meal along side the homemade wine.. The captain and the crew were superb and also as with most Greeks we have met I love their humour as well as the passion and pride they have in their work. Finally one thing to point out was he does not overload  the boat with loads and loads of people  just to make money. On the way back we passed a boat sailing out of Zante town, it was not much bigger than ours, it was absolutely rammed with people like sardines. To me that is not an enjoyable day out. All in all the six of us had a fabulous day out and we would highly recommend it to anyone."
3,https://www.tripadvisor.com/Profile/F6248EMianb,August 2020,5,Trip,"Superb day out, great food, great swimming stops, great atmosphere on board, very informative, if you are in zakynthos give this trip a try"
4,https://www.tripadvisor.com/Profile/car0line63,September 2020,5,Out of this world,"I can’t distinguish a favourite part of this experience, just that it was unforgettable and I will remember it forever. I will always remember Giorgos staying by my side as we swam to shore, I am terrified when I am out of my depth but I did it ! Learning how the whole process works to catching the fish, reeling it in and eating it was just so unique an experience, so out of the ordinary. I would recommend doing this to anyone, well worth the money and the hosts are fabulous and friendly . Hope one day to do it again!!"
0,https://www.tripadvisor.com/Profile/GerardR420,May 2019,5,Gerard,"Fantastic day out. Stunning scenery, great food and wonderful company of Captain Giorgos and his crew. An experience you should not miss!"
1,https://www.tripadvisor.com/Profile/fitzyit,September 2019,5,Read the reviews then just book it.,"Booked our trip from the UK and everything was very easy.Our original trip was cancelled due to adverse weather so Giorgos (captain) tried to fit us in at a later date. Called that morning saying he would have to cancel again due to weather. Rang me back about 2 hours saying although we were about 3 hours late  would we still like to go but on a condensed trip as Giorgos did not want to let us down. We all agreed to go. Giorgos said the trip would not be as long as normal but we would get a feeling of what normally happened.So glad we went, the best day of our holiday. The boat is absolutely spotless. After coffee Giorgos explained what we would do and explained all about fishing. So interesting and informative. We put nets out and went to an island with no one on it for swimming etc. Went back to collect nets, hoping we would get some fish, which we did. More swimming at a different beach while lunch was prepared. Food was excellent and so tasty and also very plentiful.All in all an excellent day we all agreed that if we return we would do it again but hope to get the full day in. Can not recommend this trip enough, all crew and facilities first class."
2,https://www.tripadvisor.com/Profile/Aliyajd,August 2019,5,Amazing,This was by far the best day of our holiday. It was a great learning experience and lots of fun. The boat was clean and beautiful and they paid attention to detail using beautiful hand made plates instead of plastic.. the fish we caught was well cooked and delicious.. all in all a fantastic day. Thank you Giorgos!
3,https://www.tripadvisor.com/Profile/bundi103,September 2019,5,My best day in Zaky,"1st impression: the looking of the ship: beautifully maintained and amazing clean2nd impression: warm and smiling welcome of the captain and its crew3nd impression: the sailing to the fishing spot, with Cpt.Giorgos and his presentation what we gonna do and why4th impression: the beautiful and unique beaches where we couldn't get access without this amazing team5th impression: the chance to have a little taste of this heavy fishing life6th impression: tasting the delicious lunch prepared out of our catch, prepared by Cpt.Giorgos (NO, it was not his reward, but his lovely team member)7th impression: the kindness and patient he showed to all of us8th impression: he wanted to drive us back to the hotel, when our taxi didnt show up 9th impression: few hours after the cruise, we have already got the pics he madeI can probably keep listing impressions here, but the point is, that Zante Fishing Cruise is an absolute recommended category, u can miss the shipwreck beach, u can miss the island tour, but never miss this tour!!! U will get wonderful experience what the perfect hosting mean!!!Thank u Cpt.Giorgos Nikolatos!!"
4,https://www.tripadvisor.com/Profile/Sarahp55555555,August 2019,5,Amazing day fishing ,"Had an amazing day fishing ( 27/8/19) with George and his crew , the boat can take 12 passengers but we decided to hire it privately as we were a party of 7 . We all had a go at putting the nets out about 1500 metres , then over to a private island for a swim to shore , drinks in Porta Roma which is beautiful. Kids had a go on a speedboat inflatable ride which they loved! Then lunch on board the boat which was delicious, best day of our holiday, only Georgios has the licence to do this type of trip , was brilliant day! Thanks Georgios "
0,https://www.tripadvisor.com/Profile/lisachaffey,September 2019,5,HIGHLY RECOMMEND ZANTE FISHING TOURS,Myself and my two brothers went on the all day traditional Greek fishing trip with captain Giorgos and his crew. The trip was throughly enjoyable and Giorgos was very informative. They really care about the environment and spoke passionately about the importance of sustainable fishing.Hot and cold beverages were always available as were snacks. Lunch was plentiful and delicious.  I would highly recommend using Zante fishing tours.Thank you Giorgos and crew for a fantastic day.Lisa.
1,https://www.tripadvisor.com/Profile/Mabel1018,August 2019,5,Fantastic day out!,"Our family spent a fantastic day with Cpt. Giorgos last week.  My children (aged 15 and 13) had the most amazing time learning about the fishing and then diving in from the boat in some of the most beautiful spots on the island.  Nothing was too much trouble and the communication throughout was excellent.  Cpt. Giorgos even suggested we wait a day before going on the trip as the sea conditions would be calmer for the family.  Everything worked perfectly.  You can park your car next to the ship, coffee and pastries waiting as you leave the harbour and the fresh fish lunch was delicious.  I would also recommend taking a map and a pen as Cpt. Giorgios will also tell you about all the best beaches, tavernas and things to do on the island.  It was like having your very own tour guide!  I would highly recommend this trip and hope to return again one day!"
2,https://www.tripadvisor.com/Profile/Mbscarey,August 2019,5,Fantastic day Fishing,"This trip was booked to celebrate a birthday, there were 7 of us in our group and it was the most amazing day ever.  I was a little worried about sea sickness which I had suffered from before, I have to say I didn’t, feel unwell at all.  The whole day from start to finish was excellent, Giorglas and his crew where most welcoming and informative the whole day,  from putting the nets out to  the surrounding area and the bays we stopped in.  The food was delicious,  and we enjoyed sitting and chatting with the Other 5 guests on board.   Yes it was an early start but so worth it"
3,https://www.tripadvisor.com/Profile/ElfCaerdydd,August 2019,5,Amazing day out,"I can not recommend this trip enough. We were made so welcome from beginning to end and the trip was an amazing experience for us adults as well as the children. We consisted of 4 adults and 5 children ranging from 5 years old to 15. Our first impressions were how spotlessly clean the boat was and how friendly George was. He was cheerful and very informative. Even the kids listened! After lowering the nets, we went swimming at a private island which was so beautiful. The children were amazed when we pulled the nets in and they saw all the fish that they’d caught. We then had another stop while George’s mother in law cooked for us. Absolutely delicious food. The kids even enjoyed it. George’s wine tasted amazing. Really great to see the kids tasting the fish that they’d caught. An unique experience for them. Thank you so much for a truly memorable day. The kids say it’s the best day of the holiday."
4,https://www.tripadvisor.com/Profile/750deanm,August 2019,5,Amazing,I booked this trip for me and my son for a bit of bonding while on holiday. What a amazing day we had giorgias was very informative and a pleasure to be around. We learnt about how they fish and stopped of for swimming while the nets was out. We ate our catch and was absolutely beautiful if you have one trip in zante make it this one.
0,https://www.tripadvisor.com/Profile/WalesWorldwide,August 2019,5,What an amazing day!,"What an amazing day we had. From the moment we arrived on the boat to be greeted by traditional greek coffee and pastries we were made to feel welcome and part of Giorgio‘s fishing family. We were all taught how to let the net out and bring it back in and my son even caught his own fish by line fishing which completely made his day. We ate what we caught, all cooked by Giorgio’s mother in law, and what a spread we had all washed down with Giorgio’s home made wine and ouzo. One of the highlights of the trip was stopping off at an uninhabited private island in Zone A of the marine conservation area, where we got to snorkel and jump/dive off the boat and swim to the island. I can’t recommend this trip enough, it was the highlight of our holiday for us and my two children and if you only do one trip while on Zakynthos do this one."
1,https://www.tripadvisor.com/Profile/276mathiast,August 2019,5,The undisputed highlight of our holiday!,"My girlfriend and I were looking for day trip by boat and got in contact with Georgios a few days in advance. Due to a cancellation we were lucky to get on the trip, so I recommend you to book the trip from home or at least a few days before (just to be sure). Georgios and his team took good care of us and we enjoyed a very nice meal consisting of the fish we caught, a fresh greek salad, spaghetti with squid and cuddle fish and bruschetta. We also got to swim and snorkel in the beautiful waters of Zakynthos. Don't hesitate to book this trip! It's ideal for both families and couples. Georgios is very easy to get in touch with, so if you have any questions, he will be happy to answer them."
2,https://www.tripadvisor.com/Profile/597vagelisa,August 2019,5,Simply amazing,Very original idea!A nice way to see all the beautiful places in the island.Crystal clear blue waters and tasty food.And if you are lucky like us you will get to see some turtles as well!
3,https://www.tripadvisor.com/Profile/Hellamour,August 2019,5,Highlight of our vacation,"We booked a morning/afternoon fishing tour at Zante Fishing Tours. We were in contact with the owner (Georgios) a couple of days before the tour and we were given prompt instructions on departure time, the program of the tour etc. We arrived too early on the day of the tour (approx. 40 min earlier) but were greeted very very friendly by Georgios and his crew.As we waited for the other guests to arrive we were given a nice cup of greek coffee and homemade breakfast sweets. As we took off to our first destination, Georgios explained to us the basics of fishing. Being newbee to fishing, it was really nice to listen to the explanation and techniques used during fishing. After the explanation, the fishing nets were put out in the sea and we left for a great swim near a deserted island. The water here was so nice and great for snorkling. We were provided with some refreshing fruits after the swim. We continued our trip by pulling our the fishing nets from the sea and looking at out catch. It was really nice to experience fishing so closely - Georgios’ his crew was also very nice and provided us with instructions on which fish we could touch (and which not because of the poison), and we were even allowed to pull out the fish from the fishing nets ourselves (this was so much fun)We took a second swim at the Porto Azurro beach - which is a beach where you can cover your whole body and face in a clay mask. Straight from the sea, it does not get any purer than that! It was a great experience and added a lot to our trip. After being completely worn out after the swimming sessions, we got back on the boat around 3 o clock PM to a delicious late lunch made from a.o. the fish we catched from the sea. The food was prepared by Georgios’ his mother in law who was with us with the day, it tasted delicious!! Also, Georgios’ his lovely wife and daughter joined us during the trip, as the tour was on a Sunday they were helping out. In summary: this was te highlight of our vacation in Zakynthos. Would not have want to missed out on this experience at all - it was truly perfect, from the food to the program to the music on the boat. The hospitality of Georgios and his family is major and this created the great atmosphere during the whole trip. We had so much fun, a big THANK YOU to Georgios and his family for providing us with this epic experience!!! "
4,https://www.tripadvisor.com/Profile/Sarsteph1,August 2019,5,Amazing Zante Fishing Tour,"This journey with Georgios and his crew was simply amazing! Departure from Zante harbour, breakfast on the boat, put the net in the water, go on a wonderful beach to wait to catch, come back, remove the fishes, go on another beach and finally eat the fishes... All this in a beautiful environment! You will love it, just do it!"
0,https://www.tripadvisor.com/Profile/109DavidW109,July 2019,5,Best fishing tour ever,"Our day with Zante fishing tour was amazing. A great crew, beautiful swim stops, delicious food. Highly recommend this fishing tour to everyone!"
1,https://www.tripadvisor.com/Profile/F6248EMianb,August 2019,5,Trip,"This is a must do trip when in zakynthos, very professional and very  greek, fish caught, cooked (by the FBI) superb day out "
2,https://www.tripadvisor.com/Profile/cerid885,August 2019,5,Highly recommend,"Booked this through PM on facebook and communication was swift & informative. Didn’t want the usual boat trips available and this sounded exactly what we were looking for. I was messaged the evening before that there would be a later start with apologies. It was only 30 mins & caused no concerns to us. We arrived earlier than expected and was invited straight away into the boat. Giorgos was a very friendly captain and immediately made everyone feel at home as soon as we stepped on to his boat. It was amazingly clean for a fishing boat and we were immediately offered Greek coffee’s to wake us up. He kept us up to date as others were delayed arriving (his English is brilliant). We still left earlier than he had messaged me the night before. He explained to us all how the nets work and some history as we were passing by the island. When they started to cast the nets it’s very hypnotic and hard not to study the technique used. He encouraged the other guests to try too... It takes about 20mins - nearly a KM in length will not be quick! No one was bored during this time it’s entrancing and the strangers on board started to become companions.. we went for a lovely swim at a secluded spot called Pelouzo Island. Giorgos explained the history of the island and also that the marine conservation & WWF had a part in the island too (very encouraging info) that he is also a member of.We moved after a couple of hours to collect up the nets. This was great to watch aswell... We went off for another swim in deeper waters with the snorkels that he’d provided. Giorgos explained to a few of us his catches and what’s available and when-his aim for today was red mullet I loved the snorkelling-never done it before... i eventually got called back to the boat  Dinner was ready. It looked incredible! Never tried so many different fish sea bream; mackerel even a cuttlefish to name few. Along with his home made wine available and the wonderful food we all got to know the others on board from different countries on their holiday and conversations were flowing. I can’t say enough about this trip, it was perfect from start to finish, you never went hungry and always had cold drinks offered. This was exactly what we’d been looking for and more! Don’t hesitate to book with 12 max on board it really is a welcoming personal experience to remember. "
3,https://www.tripadvisor.com/Profile/Kkolenac,July 2019,5,Unforgoten adventure MUST TRY 👌🏻,"It was an unforgettable day and I would be very sorry that I would not take part in this excursion, fishing. As soon as we boarded the boat, they served us with excellent coffee, biscuits. Captain Giorgios  is very friendly and hospitable, as well as his crew. The fish that we caught with the grid were prepared for lunch and they were excellent, and we all had a choice of drinks in an unlimited quantity all day. We also took a couple of beaches where we could swim. He makes sure you feel great and remember the adventure. It's a must try Fishing tour on Zante.greetings from Slovenija Kristijan"
4,https://www.tripadvisor.com/Profile/Welshtash1970,July 2019,5,A Truly Fantastic Day at Sea!!!,"We experienced this fantastic boat trip with Zante Fishing Tours whilst on holiday in Kalamaki. We have holidayed here for many years and were looking for something different. This trip provided this and lots lots more! From being involved in casting the nets, watching the catch come in and swimming in some truly beautiful places, all topped off with a wonderful lunch which included the fish we had caught fresh from the sea! Giorgos and his “FBI” in-laws were such marvellous hosts, and provided great insight into fishing techniques and of the island. They ensured we sailed the waters in such a way to prevent a rough ride and therefore no chance of sea sickness, which we were all slightly worried about. Life jackets, snorkels and flotation aids were all provided to help those less confident in the water. The swimming stop offs were in areas which were isolated and off the beaten track, making the experience all the more special. We were a party of 10 and everyone enthused about the trip. In fact once telling others about it back at our hotel, many swiftly booked in the following days. This was truly the highlight of our holiday and will definitely return to do it again next year! Thanks to Captain Giorgos and the family, from Dave, Natasha and friends!"
0,https://www.tripadvisor.com/Profile/cguevara,July 2019,5,If you do one trip in Zante - do this one!,"We now live in Zakynthos and this trip was recommended to us by friends they raved about it so much we booked and took along our daughter and her partner, leaving from the Port of Zakynthos we headed out to sea, George (Captain) explained what we would do and what we would see over the day, swimming trips were organised and undertaken, George gave us a running history not only of the island but also the Zakynthos way of life, the importance of sustainable fishing and the role people play, we were all encouraged to help the crew drop the fishing nets the catch from which would be our delicious lunch later, Red Mullet, Octopus,Sea Bream with side dishes of spaghetti salad and bruschetta all cooked on board by Georges amazing mother in law who also doubles up as an FBI Agent (we think that may be false as she looked more CIA) all in all a truly magnificent day made all the more pleasurable by good company on board from Sweden and Slovenia  and also a very welcoming crew. Yammas George from Joe Ann Mairi and Dan - ps we plan to be back "
1,https://www.tripadvisor.com/Profile/Rachel15F,June 2019,5,What a great day out,Celebrated a friends 50th birthday on board and had the most fun.  The fish freshly caught and cooked as part of an amazing lunch.  So friendly and welcoming on boat.  Highly recommend a trip with Zante Fishing Tours.  Thanks for the memories. 
2,https://www.tripadvisor.com/Profile/Experience793598,June 2019,5,Sniffer’s 50th!,"Well, what can I say, came with 13 mates, booked with George a while back, and we had a brilliant day!!  Great fun, swimming, great hosts, and the lunch/ wine etc was lovely! Caught some fish too, and had a swim with a turtle! Great thanks to George, his mum in law, and other crew, a great day!"
3,https://www.tripadvisor.com/Profile/gamanc2015,June 2019,5,A unique experience that shouldn’t be missed,"A special day spent with special people that are passionate about what they do, at the end even preparing us an absolutely exquisite meal from the fish caught on board.The ride is a commercial fishing ship that fits a maximum of 10 people and doesn’t cause nausea. It is incredibly clean and well taken care of. The commercial net fishing is an experience absolutely worth trying.Way more interesting and engaging than a simple tourist boat trip around the island. We even had the chance to anchor the ship near a private island and swim by marvelous views.Giorgos, the ship’s commander, is an incredible person, very welcoming and friendly. It was an absolute pleasure listening and learning about all the wonders of Greece. From interesting facts about the island to amazing tavernas known only by locals. Took his recommendations to heart, the culinary experience being unbeatable."
4,https://www.tripadvisor.com/Profile/larryuan,June 2019,5,Fantastic day with Giorgos,"It is my first time ocean fishing.Giorgos is the best captain! He is knowledgable, and likes to share with people.  Such a good experience. It's not only about fishing. The food we got is fabulous as well!!"
0,https://www.tripadvisor.com/Profile/X885CLneilm,June 2019,5,Boat trip you will never forget,"An amazing day spent with the crew of Zante Fishing tours.You get to go aboard an authentic fishing boat, get up close and personal with the 2 crew. The captain makes you feel welcome and wants to make sure the day is on of continual happiness and pleasure. You go out , put out fishing nets and then bathe and swim waiting for your catch . Get the nets in and then the captains mother in law cooks the fish and serves it with spaghetti and bruschetta.Washed down with wine and laughter.Best day you could have on board any boat .Thank you for a wonderful experience."
